date,title,sentiment__polarity
2019-11-07T21:05:00+00:00,"Kimball Electronics, Inc. Announces Election of Directors",0.995
2019-06-04T11:02:00+00:00,Sparkhound Helps Albemarle® With Complete Digital Transformation To Cloud-Based Communications,0.986
2019-04-10T12:00:00+00:00,"Report: Developing Opportunities within Albemarle, Stratasys, Pure Storage, Tenaris S.A, GNC, and The Providence Service — Future Expectations, Projections Moving into 2019",0.995
2019-02-27T13:00:00+00:00,Smart Money in the Lithium Sector Betting on Future Global Demand,0.992
2019-02-26T15:30:00+00:00,Charging Ahead with EV Growth Beyond Cars; Lithium-ion Batteries will Continue to Dominate,0.999
2019-02-26T13:00:00+00:00,"Investor Expectations to Drive Momentum within Newmont Mining, Albemarle, Abraxas Petroleum, Osisko Gold Royalties, Toro, and Dova Pharmaceuticals — Discovering Underlying Factors of Influence",0.995
2019-02-06T13:00:00+00:00,The Battery Race in the US and How Lithium Plays a Leading Role,0.993
2019-02-01T13:00:00+00:00,Advanced Technology for Rapid Extraction Will Be Key to Meeting Future Lithium Demand,0.981
2018-11-30T12:20:00+00:00,"Report: Developing Opportunities within Unifirst, Royal Caribbean Cruises, Albemarle, Tableau Software, Huami, and Johnson & Johnson — Future Expectations, Projections Moving into 2018",0.995
2018-10-30T12:30:00+00:00,Cameo Cobalt Completes Successful Chilean Site Visits,0.983
2018-10-22T11:30:00+00:00,"Market Trends Toward New Normal in CryoPort, The J. M. Smucker, Accenture, Albemarle, The Allstate, and Huami — Emerging Consolidated Expectations, Analyst Ratings",0.995
2018-06-13T11:50:00+00:00,"Detailed Research: Economic Perspectives on Och-Ziff Capital Management Group, Axalta Coating, Trinity Industries, Match Group, Eversource Energy, and Albemarle — What Drives Growth in Today's Competitive Landscape",0.997
2018-04-03T20:15:00+00:00,Grace Completes Acquisition of Albemarle Polyolefin Catalysts Business,0.999
2018-02-23T13:25:00+00:00,"Research Report Identifies PNM Resources, Inc. (Holding Co.), Sensient Technologies, PS Business Parks, Albemarle, Eversource Energy, and Axalta Coating with Renewed Outlook — Fundamental Analysis, Calculating Forward Movement",0.997
2017-12-19T12:30:00+00:00,"Analysis: Positioning to Benefit within Albemarle, Eversource Energy, Axalta Coating, PNM Resources, Sensient Technologies, and PS Business Parks — Research Highlights Growth, Revenue, and Consolidated Results",0.997
2017-12-14T22:00:00+00:00,Grace to Acquire Polyolefin Catalysts Business,0.999
2017-11-15T12:50:00+00:00,"Report: Developing Opportunities within The New York Times, Albemarle, Vista Outdoor, Owens & Minor, Select Medical, and Gastar Exploration – Future Expectations, Projections Moving into 2018",0.997
2017-08-01T12:00:00+00:00,Wealth Signs Letter Agreement to Acquire Interest in ‘Seven Salars’ Lithium Project in Chile,1
2017-04-03T12:00:00+00:00,Advantage Lithium JV Hits Lithium in Brines with Two New Holes; Completes 2nd Phase Drilling,0.997
2016-06-20T13:00:00+00:00,Resolve Ventures Provides Update Regarding  Neptune Property Option,0.997
