headline,date,stock
"Chemical Industry Off to a Good Start, 4 Stocks to Buy Now",03/03/2017,ALB
PPG Industries Completes Waterborne Coatings Production Line,03/03/2017,ALB
Air Products (APD) Wins Long-Term Hydrogen Supply Contract,02/03/2017,ALB
Four 10%+ Dividend Increases In Second Half Of February And One More Expected In March,01/03/2017,ALB
PPG Industries to Showcase High Transfer Efficiency Coatings,01/03/2017,ALB
Albemarle Corporation (ALB) Shows Strength: Stock Up 9.8%,01/03/2017,ALB
Energy/Materials - Top 5 Gainers / Losers as of 2:00 pm,28/02/2017,ALB
Albemarle (ALB) Q4 2016 Results - Earnings Call Transcript,28/02/2017,ALB
Albemarle +10% after Q4 beat; guides 2017 revenues above consensus,28/02/2017,ALB
Albemarle Corporation 2016 Q4 - Results - Earnings Call Slides,28/02/2017,ALB
"Albemarle (ALB) Tops Earnings, Revenue Estimates in Q4",28/02/2017,ALB
"Albemarle beats by $0.05, beats on revenue",27/02/2017,ALB
Albemarle Corporation (ALB) Flat on Expected Quarterly Earnings,27/02/2017,ALB
Lithium Miner News For The Month Of February 2017,27/02/2017,ALB
"28 Dividend Increases: February 20-24, 2017 (Part 2: The Remaining Sectors)",27/02/2017,ALB
Notable earnings after Monday's close,26/02/2017,ALB
Albemarle declares $0.32 dividend,24/02/2017,ALB
Valuation Complicates An Otherwise Interesting Story At W.R. Grace,23/02/2017,ALB
A Weaker Australian Dollar Is Likely To Lift Australian Lithium Miners Higher,22/02/2017,ALB
One 20% Dividend Increase Expected Among 8 Announcements In 2nd Half Of February,20/02/2017,ALB
"Point7— Asia (Singapore) Pte. Ltd. Buys Hess, Air Products & Chemicals, Albemarle, Sells ...",16/02/2017,ALB
Is the Lithium Sector Still Apealing?,15/02/2017,ALB
Is the Lithium Sector Still Appealing?,15/02/2017,ALB
Dividend Contenders: 35 Increases Expected By The End Of April,13/02/2017,ALB
LIT Investors: Don't Forget Your Lithium Pills,13/02/2017,ALB
Is This The Top Commodity Play For 2017?,13/02/2017,ALB
"Wal-Mart, Cisco, Coca-Cola predicted to hike payouts next week - Bloomberg",10/02/2017,ALB
The Chinese Electric Vehicle Boom May Soon Accelerate,09/02/2017,ALB
Celanese (CE) to Acquire Nilit's Nylon Compounding Business,06/02/2017,ALB
Lithium Miner News For The Month Of January 2017,27/01/2017,ALB
"BARING ASSET MANAGEMENT Ltd Buys Alibaba Group Holding Ltd, Schlumberger Ltd, Itau Unibanco ...",27/01/2017,ALB
This Dividend Growth Chemical Manufacturer On A Bullish Breakout,24/01/2017,ALB
Goldman Calls Lithium The New Gasoline: Galaxy Resources Is A Buy-On-Weakness Play,24/01/2017,ALB
Eastman Chemical (EMN) Q4 Earnings: What's in the Cards?,23/01/2017,ALB
Dividend Contenders: 43 Increases Expected By The End Of March,20/01/2017,ALB
Pilbara Minerals: Don't Miss This Junior Miner At The Dawn Of The Age Of Lithium,20/01/2017,ALB
DuPont (DD) Q4 Preview: Another Earnings Beat in Store?,20/01/2017,ALB
Lithium Americas Is Looking Good And Is Now Significantly De-Risked,19/01/2017,ALB
"The Zacks Analyst Blog Highlights: Kronos Worldwide, Ingevity, LyondellBasell Industries NV, Celanese Corporation and Albemarle",19/01/2017,ALB
5 Chemical Growth Stocks to Enrich Your Portfolio in 2017,18/01/2017,ALB
Tesla's Lithium Supply - Update,18/01/2017,ALB
International Flavors Completes Fragrance Resources Buyout,18/01/2017,ALB
Albemarle upgraded at Baird amid growing lithium market,17/01/2017,ALB
RIO Tinto (RIO) Reports Robust Production Results in Q4,17/01/2017,ALB
POSCO's (PKX) Growth Initiatives Look Good: Time to Buy?,17/01/2017,ALB
The Two Hottest Commodities Of 2017,12/01/2017,ALB
"Robecosam Ag Buys Air Products & Chemicals Inc, Microsemi Corp, Silicon Laboratories Inc, ...",10/01/2017,ALB
"PPG, Axalta cut at Citi on more defensive outlook for chemical/ag sector",09/01/2017,ALB
Valuation Dashboard: Energy And Materials - Update,05/01/2017,ALB
Top 12 Lithium Miners To Create Your Own Lithium ETF,05/01/2017,ALB
Neo Lithium Corp Has Great Potential,04/01/2017,ALB
Albemarle gets OK to expand lithium operations in Chile,04/01/2017,ALB
Lithium Miner News For The Month Of December 2016,27/12/2016,ALB
Resource Sector Digest: Yamana Gold Says It's All About 'Realizing' Value,27/12/2016,ALB
9 Stocks Steven Cohen Continues to Buy,15/12/2016,ALB
"Zacks Industry Outlook Highlights: Dow Chemical, DuPont, Albemarle, FMC and Westlake Chemical",09/12/2016,ALB
The Lithium Market Will Grow To 20 Times Its Current Size In The Next 15 Years,07/12/2016,ALB
Oil Stocks Rally To New Highs On OPEC Deal; Dow's United Tech Reverses,30/11/2016,ALB
"Lthium output will keep pace with electric vehicle growth, Albemarle CEO says",28/11/2016,ALB
Lithium Miners News For The Month Of November 2016,28/11/2016,ALB
Pilbara Minerals Could Be The Next Greenbushes Lithium Blockbuster,21/11/2016,ALB
Electric Vehicles Set To Electrify The Market In 2017,10/11/2016,ALB
Albemarle (ALB) Q3 2016 Results - Earnings Call Transcript,08/11/2016,ALB
Albemarle Corporation 2016 Q3 - Results - Earnings Call Slides,08/11/2016,ALB
"Albemarle beats by $0.10, beats on revenue",07/11/2016,ALB
Notable earnings after Monday's close,06/11/2016,ALB
Albemarle declares $0.305 dividend,03/11/2016,ALB
"Copper, Zinc And Lithium - Fresh Value, The Boom And The Pull Back",01/11/2016,ALB
Albemarle: Expect Shares To Trade Horizontally Till Year-End,01/11/2016,ALB
Lithium Miners News For The Month Of October 2016,28/10/2016,ALB
Best And Worst Performing Stocks 2016 YTD,25/10/2016,ALB
"As Lithium Scramble Continues, Here Are — Players to Watch",20/10/2016,ALB
"Fusion And Energy? Despite Private Support, It's Always Too Early To Tell",20/10/2016,ALB
Kraton Hugs Support As It Climbs Toward Buy Point,11/10/2016,ALB
Lithium Miners News For The Month Of September 2016,27/09/2016,ALB
Soil Survey Shows Strong Lithium Results at the Nevada Energy Metals Black Rock Desert Project,23/09/2016,ALB
The Rush Is On For Argentine Lithium Assets,22/09/2016,ALB
The World In 2020 And What Companies To Own,16/09/2016,ALB
China's top lithium producer proposes deal for stake in Chile's SQM,09/09/2016,ALB
"Albemarle's Lithium And Overall Product Mix, Makes It Well-Positioned For The Long Term",09/09/2016,ALB
Should You Buy Into The Lithium Mania?,06/09/2016,ALB
Oroplata Resources (ORRP) Takes Shape as a Potential Lithium Acquisition Target,06/09/2016,ALB
Shale Gas 2.0: An Explosive Expansion Of The U.S. Chemicals Trade,02/09/2016,ALB
Lithium Miners News For The Month Of August 2016,30/08/2016,ALB
"Lithium ETF Captures Key Element Of Mobile Tech, Electric Cars",26/08/2016,ALB
An Update On Lithium And The Pure Play Lithium Miners,11/08/2016,ALB
Combining Different Momentum Factors,09/08/2016,ALB
Albemarle Corporation 2016 Q2 - Results - Earnings Call Slides,04/08/2016,ALB
Albemarle (ALB) Luke C. Kissam on Q2 2016 Results - Earnings Call Transcript,04/08/2016,ALB
Valuation Dashboard: Energy And Materials - Update,03/08/2016,ALB
Albemarle beats by $0.09,03/08/2016,ALB
Notable earnings after Wednesday's close,02/08/2016,ALB
Mining Technology Trends Reveal Investment Opportunities In The Electric Vehicle Market,26/07/2016,ALB
Lithium in focus with Gigafactory event on tap,22/07/2016,ALB
Chinese Electric Vehicles Continue To Boom,21/07/2016,ALB
Lithium Extraction Techniques - A Look At The Latest Technologies And The Companies Involved,14/07/2016,ALB
Critical Elements - A Lithium Miner With An Exceptional Buying Opportunity,12/07/2016,ALB
Albemarle declares $0.30 dividend,11/07/2016,ALB
"State Street Global Advisors SPDR S&P Dividend ETF SDY: These Times, They Are A-Changin'",06/07/2016,ALB
Lithium X Has The X Factor,05/07/2016,ALB
Galaxy Resources: An Emerging Leader In The Lithium Industry,05/07/2016,ALB
"Brexit Isn't The Biggest Concern, It's Inflation And Deflation's Double-Edged-Sword",01/07/2016,ALB
The Lithium Boom - An Analysis Of Future Demand Vs. Supply,27/06/2016,ALB
Brexocalypse - 3 Ways To Protect Your Portfolio Today,24/06/2016,ALB
"Albemarle, Fortive to join S&P 500",23/06/2016,ALB
1 Year With Seeking Alpha,23/06/2016,ALB
American Lithium in the Thick of the White Gold Rush of Lithium in Nevada,22/06/2016,ALB
Galaxy Resources - An Excellent Way To Invest Into The Lithium Miners,22/06/2016,ALB
Albemarle - Investors Rightfully Applaud Chemetall Divestiture,20/06/2016,ALB
Resource Sector Digest: Don't Count On Tesla To Sustain The Lithium Hype!,19/06/2016,ALB
Orocobre - Leading The Lithium Pure Play Miners In The Lithium Boom,17/06/2016,ALB
BASF to buy Albemarle's Chemetall surface treatment unit for $3.2B,17/06/2016,ALB
ProShares S&P MidCap 400 Dividend Aristocrats: A Crown Jewel?,15/06/2016,ALB
Top 5 Lithium Miners To Consider,13/06/2016,ALB
"Lithium Americas: A Well-Valued, Near-Term Lithium Producer",10/06/2016,ALB
"Whether We Want It Or Not, We All Need A Break",26/05/2016,ALB
Examining the Current State of Health Care and Skin Care Stocks,23/05/2016,ALB
"The Lithium-Ion Battery Trifecta - Selecting The Best Lithium, Cobalt And Graphite Miners",23/05/2016,ALB
Albemarle: Best Lithium Investment Right Now,16/05/2016,ALB
Bloomberg: Albemarle considers sale of $3B surface treatment unit,13/05/2016,ALB
Apple And Disney Have Staying Power - Cramer's Mad Money (5/11/16),12/05/2016,ALB
Albemarle (ALB) Luther C. Kissam on Q1 2016 Results - Earnings Call Transcript,11/05/2016,ALB
Albemarle declares $0.305 dividend,10/05/2016,ALB
Notable earnings after Tuesday's close,09/05/2016,ALB
26 Stocks For May 2016,02/05/2016,ALB
The Scramble For Lithium Is On As Prices Double,13/04/2016,ALB
Are There Any Deals Among The Dividend Contenders?,12/04/2016,ALB
Top Expert Resource Stock Picks from PDAC 2016,08/04/2016,ALB
Lithium Miners Are Booming As Lithium Spot Prices Rise - Which Lithium Companies Should I Buy?,07/04/2016,ALB
23 Stocks For April 2016,01/04/2016,ALB
Goldman Calls Lithium The New Gasoline - Get In Before It's Too Late Or Stay Out?,24/03/2016,ALB
"With The Lows Behind Us, There Are New Market Leaders And Opportunities Emerging",21/03/2016,ALB
"Reuters: Interest grows in South America's ""lithium triangle""",15/03/2016,ALB
Albemarle Is Not Expensive After The Recent Chilean Approval,15/03/2016,ALB
19 Dividend Increase Announcements In February And 4 More Expected In March,02/03/2016,ALB
21 Stocks For March 2016,01/03/2016,ALB
"19 Dividend Increases, February 22-February 26, 2016",28/02/2016,ALB
Albemarle declares $0.305 dividend,26/02/2016,ALB
Electric Car War Sends Lithium Prices Sky High,25/02/2016,ALB
Albemarle (ALB) Luke C. Kissam on Q4 2015 Results - Earnings Call Transcript,18/02/2016,ALB
"Albemarle beats by $0.20, beats on revenue",17/02/2016,ALB
Notable earnings after Wednesday's close,16/02/2016,ALB
Dividend Contenders: 35 Increases Expected In The Next 11 Weeks,14/02/2016,ALB
Albemarle gets Chile approval to boost lithium production,03/02/2016,ALB
23 Stocks For February 2016,02/02/2016,ALB
"16 Scheduled Dividend Increases For February, And January Announcement Recap",01/02/2016,ALB
Dividend Contenders: Better Choice Than Dividend Aristocrats?,24/01/2016,ALB
"Oil Will Come Roaring Back, But Lithium Might Still Be A Better Bet",21/01/2016,ALB
Dividend Contenders: 50 Increases Expected By The End Of March,16/01/2016,ALB
What Investors Need To Know About Lithium Ion Batteries,14/01/2016,ALB
My Top Chemicals Stocks For 2016,31/12/2015,ALB
"John Burbank Has Big Losses on E-Commerce China, Sohu.com, Autohome",29/12/2015,ALB
"Macquarie Infrastructure Leads Strategic Dividend Dogs With 6.9% Yield, 54.9% Upside, And 58.8% Net As Of December 2016",21/12/2015,ALB
Albemarle: A Clever Way To Play The Tesla Revolution,17/12/2015,ALB
Albemarle selling pair of businesses to J.M. Huber,16/12/2015,ALB
Albemarle: M&A Confusion Drives ~60% Upside,06/12/2015,ALB
25 Stocks For December 2015,01/12/2015,ALB
28 Stocks For December 2015,01/12/2015,ALB
"Albemarle Tops EPS Estimate, Misses On Revenue",05/11/2015,ALB
"Albemarle Tops EPS Estimate, Misses On Revenue",05/11/2015,ALB
DuPont Inks Multi-Year Contract with QCCP for Enzyme Supply,20/10/2015,ALB
"Albemarle (ALB) Shares March Higher, Can It Continue?",19/10/2015,ALB
Potash Corp Cut to Strong Sell: Should You Dump It?,16/10/2015,ALB
Celanese Hikes Prices for Acetyl Intermediate Products,16/10/2015,ALB
Air Products Unveils InuMax Advanced Retinol Solution,16/10/2015,ALB
Syngenta (SYT) Q3 Results Hurt by Currency & Credit Woes,15/10/2015,ALB
"PPG Industries' (PPG) Q3 Earnings Meet, Profits Rise",15/10/2015,ALB
Albemarle added to Conviction Buy List at Goldman Sachs,09/10/2015,ALB
"It's Game Over, Tesla Wins",28/09/2015,ALB
Tesla Vs. The Lithium Oligopoly,25/09/2015,ALB
Albemarle (ALB) to Beef Up Battery Grade Lithium Production,18/09/2015,ALB
Albemarle (ALB) Looks Good: Stock Adds 5.7% in Session,16/09/2015,ALB
"Stocks Open Up, But Not Much; Albemarle, Chevron, Sucampo Rise",15/09/2015,ALB
David's High Velocity Solution For A Buy And Hold SWAN Portfolio,10/09/2015,ALB
26 Stocks For September 2015,01/09/2015,ALB
Albemarle Shifting Corporate Headquarters to Charlotte,26/08/2015,ALB
Albemarle's (ALB) Chemetall Unveils Water-Based Penetrant,20/08/2015,ALB
"Zacks Industry Outlook Highlights: PPG Industries, Albemarle, CF Industries, LyondellBasell Industries and Celanese",19/08/2015,ALB
What's Supporting the Bullish Case for Chemical Stocks?,18/08/2015,ALB
"Thinking Outside The Commodity Box: Benchmark's Investment Primer For Lithium, Cobalt And Graphite",14/08/2015,ALB
International Flavors (IFF) Q2 Earnings: What's in Store? - Analyst Blog,07/08/2015,ALB
Albemarle (ALB) Luke C. Kissam on Q2 2015 Results - Earnings Call Transcript,06/08/2015,ALB
"Albemarle beats by $0.02, beats on revenue",05/08/2015,ALB
Notable earnings after Wednesday's close,04/08/2015,ALB
Will Century Aluminum (CENX) Miss Q2 Earnings Estimates? - Analyst Blog,04/08/2015,ALB
Will CF Industries (CF) Disappoint Q2 Earnings Estimates? - Analyst Blog,03/08/2015,ALB
Will Challenges in Agriculture Dent Mosaic (MOS) Earnings? - Analyst Blog,03/08/2015,ALB
Will FMC Corp's (FMC) Q2 Earnings Surprise Estimates? - Analyst Blog,03/08/2015,ALB
Will Trimble Navigation's (TRMB) Q2 Earnings Disappoint? - Analyst Blog,31/07/2015,ALB
What to Expect from ON Semiconductor (ON) Q2 Earnings? - Analyst Blog,31/07/2015,ALB
"Air Products (APD) Beats on Q3 Earnings, Ups FY15 View - Analyst Blog",30/07/2015,ALB
Methanex's (MEOH) Q2 Earnings & Revenues Miss Estimates - Analyst Blog,30/07/2015,ALB
Albermarle Corp.: Play The Distributed Generation Transformation,30/07/2015,ALB
"Praxair (PX) Q2 Earnings Meet Estimates, Revenues Lag - Analyst Blog",29/07/2015,ALB
Eastman Chemical (EMN) Jumps: Stock Up 6.8% - Tale of the Tape,29/07/2015,ALB
"Airgas (ARG) Q1 Earnings Beat, Updates FY16 Guidance - Analyst Blog",28/07/2015,ALB
"DuPont's Earnings Miss on Agriculture Weakness, Cuts View - Analyst Blog",28/07/2015,ALB
"LyondellBasell Q2 Earnings Trounce Estimates, Sales Trail - Analyst Blog",28/07/2015,ALB
Will Yamana Gold (AUY) Surprise This Earnings Season? - Analyst Blog,28/07/2015,ALB
Will Potash Corp's (POT) Q2 Earnings Post a Surprise? - Analyst Blog,28/07/2015,ALB
Is CVR Partners (UAN) Likely to Disappoint Earnings in Q2? - Analyst Blog,28/07/2015,ALB
Can Air Products (APD) Sustain Its Earnings Streak in Q3? - Analyst Blog,28/07/2015,ALB
"Eastman Chemical Beats on Q2 Earnings, Misses Revenues - Analyst Blog",28/07/2015,ALB
Albermarle Corp Is Worth A Look,27/07/2015,ALB
What to Expect from Lam Research's (LRCX) Q4 Earnings - Analyst Blog,27/07/2015,ALB
Will Garmin's (GRMN) Q2 Earnings Disappoint Estimates? - Analyst Blog,27/07/2015,ALB
Will Cliffs Natural (CLF) Beat Earnings Estimates in Q2? - Analyst Blog,27/07/2015,ALB
Will Praxair (PX) Lag Q2 Earnings Estimates on Forex Woes? - Analyst Blog,27/07/2015,ALB
Will Airgas (ARG) Disappoint Q1 Earnings on Cost Concerns? - Analyst Blog,27/07/2015,ALB
Univar (UNVR) to Report Q2 Earnings: What to Expect? - Analyst Blog,27/07/2015,ALB
Methanex Corp (MEOH) Crumbles; Stock Falls by 5.3% - Tale of the Tape,27/07/2015,ALB
DuPont (DD) Q2 Preview: Will a Strong Dollar Hit Earnings? - Analyst Blog,24/07/2015,ALB
Is Another Earnings Beat Coming for LyondellBasell (LYB)? - Analyst Blog,24/07/2015,ALB
Will Eastman Chemical (EMN) Beat Q2 Earnings Estimates? - Analyst Blog,24/07/2015,ALB
New Strong Buy Stocks for July 22nd - Tale of the Tape,22/07/2015,ALB
Albemarle Rationalizing Capacity at New Johnsonville Plant - Analyst Blog,14/07/2015,ALB
Albemarle (ALB) Enters Oversold Territory - Tale of the Tape,10/07/2015,ALB
Albemarle declares $0.29 dividend,09/07/2015,ALB
Albemarle Starts Commissioning of Lithium Carbonate Plant - Analyst Blog,09/07/2015,ALB
Calgon Carbon -8% after Supreme Court ruling on mercury emissions,29/06/2015,ALB
What's in Store for Monsanto (MON) this Earnings Season? - Analyst Blog,22/06/2015,ALB
MRC Global Rides On Growth Curve with New SABIC Deal - Analyst Blog,18/06/2015,ALB
Why Albemarle Corporation (ALB) Stock Might be a Great Pick - Tale of the Tape,17/06/2015,ALB
Monsanto in Trouble as France Puts Ban on Roundup Sale - Analyst Blog,16/06/2015,ALB
How To Ride The Lithium Battery Boom: JGL Partners' Jonathan Lee,03/06/2015,ALB
Methanex Enters into Unified Communications Deal with BT - Analyst Blog,21/05/2015,ALB
PPG Industries Unveils Metal Coatings Color Selector Tool - Analyst Blog,21/05/2015,ALB
Celanese to Hike Prices of Potassium Sorbate & Sorbic Acid - Analyst Blog,21/05/2015,ALB
Is This the Right Time to Buy Sherwin-Williams (SHW) Stock? - Analyst Blog,20/05/2015,ALB
Dow Chemical to Exhibit Packaging Solutions at Chinaplas - Analyst Blog,20/05/2015,ALB
Is Celanese (CE) Worth Adding to Your Portfolio? - Analyst Blog,19/05/2015,ALB
Cabot Corporation Down to Strong Sell on Weak Q2 Results - Analyst Blog,19/05/2015,ALB
Albemarle Buys Chemal's Aluminum Finishing Businesses - Analyst Blog,18/05/2015,ALB
"Praxair Hikes Gas Prices, Inks Gas Supply Contract in India - Analyst Blog",18/05/2015,ALB
Zacks Rank #1 Additions for Monday - Tale of the Tape,18/05/2015,ALB
Praxair Wins Oxygen Supply Contract from Beijing Drainage - Analyst Blog,13/05/2015,ALB
Albemarle (ALB) Luther C. Kissam on Q1 2015 Results - Earnings Call Transcript,07/05/2015,ALB
David Vs. Goliath: Small-Cap Tech To Save Giant Coal,07/05/2015,ALB
"Albemarle beats by $0.46, misses on revenue",06/05/2015,ALB
Albemarle declares $0.29 dividend,05/05/2015,ALB
Notable earnings after Wednesday's close,05/05/2015,ALB
"Alternative Coal Stocks or Coal Technology Plays (ADES, ALB, CCC, FTEK & MEEC)",23/04/2015,ALB
"Zacks Industry Outlook Highlights: PPG Industries, Albemarle, Air Products and Chemicals, Celanese and LyondellBasell Industries - Press Releases",21/04/2015,ALB
Are Chemical Stocks Heating Up? - Industry Outlook,20/04/2015,ALB
"For Midwest Energy Emissions, Everything Changed When the Clock Struck Midnight (SO, ADES, MEEC, DUK, ALB)",17/04/2015,ALB
"How Much is Midwest Energy Emissions Worth? Here's Why the Number Rises in Eight Days. (ALB, SO, MEEC, DUK, AEDES)",07/04/2015,ALB
"New EPA Rule Could Hit the ""On"" Switch for This Overlooked Name (ALB, MEEC, ADES)",01/04/2015,ALB
Dividend Growth Stock Overview: Albemarle Corporation,25/03/2015,ALB
Albemarle Streamlines Mineral Flame Retardant Portfolio - Analyst Blog,16/03/2015,ALB
The End Of The Lithium 'Big 3',16/03/2015,ALB
"Dividend Increases, February 23-March 6, 2015",10/03/2015,ALB
Investing In The Lithium Oligopoly,09/03/2015,ALB
Albemarle: That Wildly Ignored Dividend Stock With 12% Annual Growth,07/03/2015,ALB
Tesla: Gigafactory Tipping Point,03/03/2015,ALB
Albemarle declares $0.29 dividend,24/02/2015,ALB
10 Dividend Growth Stocks For February 2015,16/02/2015,ALB
Dividend Contenders: 35 Increases Expected By The End Of April,15/02/2015,ALB
The Lithium Oligopoly: Reviewing Investment Opportunities,13/02/2015,ALB
Should You Get Rid of Albemarle (ALB) Now? - Tale of the Tape,11/02/2015,ALB
Zacks Rank #5 Additions for Tuesday - Tale of the Tape,10/02/2015,ALB
The Cheapest Dividend Growers From The MidCap 400 Dividend Aristocrats Index,10/02/2015,ALB
The Cheapest Dividend Growers From The MidCap 400 Dividend Aristocrats Index,08/02/2015,ALB
Zacks Rank #5 Additions for Thursday - Tale of the Tape,05/02/2015,ALB
Zacks Rank #5 Additions for Tuesday - Tale of the Tape,03/02/2015,ALB
"InsiderInsights.com Daily Round Up 1/30/15: FXCM, RYAM, CAS, SNCR",31/01/2015,ALB
Top Income Stocks: S&P Updates Dividend Aristocrats,29/01/2015,ALB
Albemarle (ALB) Q4 2014 Results - Earnings Call Transcript,29/01/2015,ALB
"Albemarle misses by $0.04, misses on revenue",28/01/2015,ALB
Notable earnings after Wednesday's close,27/01/2015,ALB
Albemarle Realigns Business Units after Rockwood Buyout - Analyst Blog,21/01/2015,ALB
"Merger Arbitrage Mondays - January 19, 2015",20/01/2015,ALB
Dividend Contenders: 48 Increases Expected In The Next 11 Weeks,16/01/2015,ALB
Albemarle (ALB) Wraps Up Rockwood Holdings Acquisition - Analyst Blog,14/01/2015,ALB
Should You Bet on a Chemical Industry Recovery? - Industry Outlook,17/12/2014,ALB
Albemarle (ALB) Closes Notes Offering for Rockwood Buy - Analyst Blog,09/12/2014,ALB
Rockwood Upgraded to Strong Buy on Solid Q3 Earnings - Analyst Blog,08/12/2014,ALB
Albemarle's $6.2B Rockwood Buyout Gets Shareholder Nod - Analyst Blog,18/11/2014,ALB
Albemarle: An Increasing 10 Year Return,21/09/2014,ALB
Zacks Rank #5 Additions for Wednesday - Tale of the Tape,17/09/2014,ALB
Albemarle Clears Antitrust Hurdle for $6.2B Rockwood Buy - Analyst Blog,12/09/2014,ALB
Albemarle Partners ICL on Polymeric Flame Retardants - Analyst Blog,02/09/2014,ALB
Chemical Industry Recovery Stays the Course - Industry Outlook,12/08/2014,ALB
Chemical Industry Recovery Stays the Course - Zacks Analyst Interviews,12/08/2014,ALB
Will Eastman Chemical (EMN) Keep the Earnings Streak Alive? - Analyst Blog,25/07/2014,ALB
Will Airgas (ARG) Miss Earnings Estimates this Quarter? - Analyst Blog,23/07/2014,ALB
Will Sigma-Aldrich (SIAL) Keep the Earnings Streak Alive? - Analyst Blog,23/07/2014,ALB
Is Dow Chemical (DOW) Likely to Miss Earnings Estimates? - Analyst Blog,22/07/2014,ALB
Will DuPont (DD) Surprise This Earnings Season? - Analyst Blog,21/07/2014,ALB
Can Praxair (PX) Beat Earnings Estimates This Season? - Analyst Blog,21/07/2014,ALB
Rockwood Holdings Takes Flight on $6.2B Takeover Deal - Analyst Blog,16/07/2014,ALB
"Company News for July 16, 2014 - Corporate Summary",16/07/2014,ALB
Albemarle to buy Rockwood,15/07/2014,ALB
Albemarle To Extend Electronics Reach With Rockwood,15/07/2014,ALB
Westport Asset Management Comments on Albemarle Corp.,16/04/2014,ALB
Albemarle Boosts Dividend Payout by 15% - Analyst Blog,26/02/2014,ALB
Zacks Rank #5 Additions for Thursday - Tale of the Tape,13/02/2014,ALB
Zacks Rank #5 Additions for Tuesday - Tale of the Tape,11/02/2014,ALB
Zacks Rank #5 Additions for Friday - Tale of the Tape,31/01/2014,ALB
Columbia Wanger's Third Quarter Selling,20/11/2013,ALB
Albemarle's Cambridge Chemical Buy Holds Potential - Analyst Blog,11/10/2013,ALB
Albemarle to Realign Business - Analyst Blog,24/09/2013,ALB
Albemarle Downgraded to Strong Sell - Analyst Blog,16/09/2013,ALB
Zacks #5 Rank Additions for Monday - Tale of the Tape,16/09/2013,ALB
Albemarle to Hike SAYTEX CP-2000 Price - Analyst Blog,05/09/2013,ALB
Albemarle Starts Catalyst Plant in South Korea - Analyst Blog,13/08/2013,ALB
Albemarle to Hike n-Propyl bromide Prices - Analyst Blog,12/08/2013,ALB
Albemarle Hikes Performance Chemicals Prices - Analyst Blog,08/08/2013,ALB
Zacks #5 Rank Additions for Wednesday - Tale of the Tape,31/07/2013,ALB
Albemarle JV Starts up TEA Facility - Analyst Blog,15/07/2013,ALB
Albemarle to Hike DBM and BCM Prices - Analyst Blog,05/06/2013,ALB
Albemarle Corp: Fundamental Stock Research Analysis,04/06/2013,ALB
"Albemarle, Senze Meilu in Joint Venture - Analyst Blog",17/05/2013,ALB
Albemarle Hiking ETHANOX Price - Analyst Blog,12/04/2013,ALB
A New Beginning for Codexis?,08/03/2013,ALB
Albemarle JV Completes First Phase - Analyst Blog,08/03/2013,ALB
Albemarle Hikes ETHANOX 4716 Price - Analyst Blog,01/03/2013,ALB
65 Stocks and Funds Increased Dividends Last Week,18/02/2013,ALB
Albemarle Hikes Dividend by 20% - Analyst Blog,15/02/2013,ALB
4 Stocks Rising on Big Volume,14/02/2013,ALB
Albemarle Starts Tyrone Expansion - Analyst Blog,13/02/2013,ALB
Albermarle,12/02/2013,ALB
"Airgas' Sales Beat in 3Q, EPS Misses - Analyst Blog",24/01/2013,ALB
Albermarle,22/01/2013,ALB
Analysts' Actions: ADI BKW CMA RIMM PFE,13/12/2012,ALB
Analysts' Actions: ADI BKW CMA,13/12/2012,ALB
5 Toxic Stocks to Dump Before 2013,27/11/2012,ALB
Albemarle Corp: Fundamental Stock Research Analysis,13/11/2012,ALB
Early Research Calls,13/11/2012,ALB
Zacks #5 Rank Additions for Tuesday - Tale of the Tape,06/11/2012,ALB
Zacks #5 Rank Additions for Monday - Tale of the Tape,22/10/2012,ALB
"At The Right Price, Albemarle Would Be A Great Idea (ALB, CHMT, GRA, RDS-A, AAPL)",02/10/2012,ALB
Albermale Plans R&D Center in Korea - Analyst Blog,29/08/2012,ALB
5 Toxic Stocks to Sell Now,14/08/2012,ALB
"Weekly Top Insider Buys: COF, YHOO, FIS, ALB, NVR",30/07/2012,ALB
Albemarle Corp. Reports Operating Results (10-Q),19/07/2012,ALB
New Analyst Coverage,13/07/2012,ALB
Basic Materials Sector Wrap,30/05/2012,ALB
Basic Materials Sector Wrap,14/05/2012,ALB
Albemarle Corp. Reports Operating Results (10-Q),19/04/2012,ALB
"How Much Further To Bottom For OM Group? (OMG, DOW, EMN, ALB)",09/03/2012,ALB
Albemarle Corp. Reports Operating Results (10-K),22/02/2012,ALB
"Stocks With Dividend Growth From Last Week (February 13-19, 2012)",19/02/2012,ALB
Most Dividend Stock Leaders Act Well After Q4 Reports,26/01/2012,ALB
Albermarle,23/01/2012,ALB
10 Mid-Cap Stocks Analysts Love,15/12/2011,ALB
