headline,date,stock
Albemarle (ALB) Reports Next Week: Wall Street Expects Earnings Growth,13/02/2019,ALB
Livent's China caution clouds lithium industry outlook,12/02/2019,ALB
Albemarle (ALB) Stock Sinks As Market Gains: What You Should Know,11/02/2019,ALB
Albemarle: Focused On Accretive Lithium Expansion,06/02/2019,ALB
"Albemarle downgraded at Citigroup, preferring Livent for lithium exposure",05/02/2019,ALB
Oversold Lithium Could Be About To Rally,29/01/2019,ALB
"Albemarle: By Far The Worst Performer In My Portfolio, Yet I Am Hopeful",29/01/2019,ALB
Albemarle reaches agreement with Chile in lithium dispute,24/01/2019,ALB
Lithium Miners News For The Month Of January 2019,24/01/2019,ALB
Albemarle's Stronghold In Specialty Chemicals Is Evident,17/01/2019,ALB
Chile nuclear watchdog may probe fraud over lithium exports - Reuters,15/01/2019,ALB
"Albemarle, Livent downgraded at Nomura on price data point outlook",15/01/2019,ALB
"Albemarle -6% as Berenberg downgrades, seeing start of fundamental shift",03/01/2019,ALB
Albemarle Initiates Earthworks at Kemerton Lithium Site,03/01/2019,ALB
Wild Stock Market Swings (Wall Street Breakfast Podcast),28/12/2018,ALB
Wall Street Breakfast: Wild Stock Market Swings,28/12/2018,ALB
Chile to delay arbitration with Albemarle - Reuters,28/12/2018,ALB
Lithium Miners News For The Month Of December 2018,24/12/2018,ALB
Lithium troubles for Albemarle in Chile?,24/12/2018,ALB
US Chemical Industry Rebounds in November As Output Rises,20/12/2018,ALB
Albemarle Enters Oversold Territory,18/12/2018,ALB
Albemarle & Mineral Resources Ink Deal to Form Lithium JV,18/12/2018,ALB
Time To Connect The Dots (Stocks To Watch Podcast),16/12/2018,ALB
Stocks To Watch: Time To Connect The Dots,15/12/2018,ALB
Albemarle (ALB) Well Placed on Lithium Expansion Actions,14/12/2018,ALB
Chemicals Start Q4 on Soft Note with Sluggish October Growth,14/12/2018,ALB
"Albemarle, Australia's Mineral Resources reach $1.15B lithium JV deal",14/12/2018,ALB
Portfolio Update: Stocks Getting Slammed As Dividends Shine Bright,11/12/2018,ALB
Will New Technologies Replace Lithium Brine Solar Evaporation Ponds?,10/12/2018,ALB
France's 'Gilets Jaunes' And The Future Of The Global Energy Industry,08/12/2018,ALB
Is Albemarle A Bargain After Its 30% Plunge This Year?,06/12/2018,ALB
Why Should You Add Albemarle (ALB) Stock to Your Portfolio?,05/12/2018,ALB
The Best Lithium Stocks: Industry Investment Analysis From Mining To Batteries,26/11/2018,ALB
Chile's Corfo says will file arbitration suit against Albemarle by Dec. 15,26/11/2018,ALB
Lithium Miners News For The Month Of November 2018,26/11/2018,ALB
Tracking Larry Robbins' Glenview Capital Management Portfolio - Q3 2018 Update,24/11/2018,ALB
Tracking Robert Karr's Joho Capital Portfolio - Q3 2018 Update,22/11/2018,ALB
Albemarle (ALB) Inks Exclusivity Deal with Mineral Resources,22/11/2018,ALB
Albermarle to pay $1.15B for 50/50 lithium mine JV in Western Australia,21/11/2018,ALB
Albemarle (ALB) Launches XPLORE & First Grade KF 787 PULSAR,16/11/2018,ALB
"Probity Advisors, Inc. Buys iShares –-' Year Credit Bond ETF, SPDR Series Trust Portfolio ...",14/11/2018,ALB
Reuters: Chilean regulators reject Albemarle's plans to boost lithium output,13/11/2018,ALB
Albermarle gets environmental OK for A$1B Australia lithium plant,09/11/2018,ALB
Albemarle Corporation 2018 Q3 - Results - Earnings Call Slides,08/11/2018,ALB
Albemarle (ALB) Q3 2018 Results - Earnings Call Transcript,08/11/2018,ALB
Albemarle stops Chile expansion plans amid lithium tech scrutiny,08/11/2018,ALB
"Albemarle (ALB) Q3 Earnings Top Estimates, Revenues Lag",08/11/2018,ALB
Alemarle -2.5% as unexpected shutdowns at lithium plants hurt Q3 results,07/11/2018,ALB
Albemarle (ALB) Surpasses Q3 Earnings Estimates,07/11/2018,ALB
Notable earnings after Wednesday's close,06/11/2018,ALB
Energy And Materials Dashboard - Update,06/11/2018,ALB
Can Albemarle (ALB) Beat Earnings in Q3 on Lithium Strength?,05/11/2018,ALB
Albemarle (ALB) Gains As Market Dips: What You Should Know,02/11/2018,ALB
Albemarle declares $0.335 dividend,30/10/2018,ALB
Lithium Miners News For The Month Of October 2018,26/10/2018,ALB
The Trade Desk Will Be Under Pressure - Cramer's Lightning Round (10/22/18),23/10/2018,ALB
Livent: Alive And Well?,18/10/2018,ALB
Chile eyes international arbitration over Albemarle contract,17/10/2018,ALB
"Brunch, Craft Beer & Investing: Embracing Volatility & Managing Risk",16/10/2018,ALB
Sale Of Chemical & Mining Co. Of Chile Inc. Stake Suspended - What It Means For Nutrien,15/10/2018,ALB
Is a Beat in the Cards for Celanese (CE) in Q3 Earnings?,15/10/2018,ALB
Will Higher Costs Dent PPG Industries' (PPG) Q3 Earnings?,15/10/2018,ALB
Cal-Maine Foods to Acquire Assets of Featherland Egg Farms,11/10/2018,ALB
"Albemarle -4% as rival adds key hire, Vertical Group analyst says",09/10/2018,ALB
Report: Chile regulator refuses to raise Albemarle's lithium output quota,08/10/2018,ALB
"Road To Financial Independence: Best September Ever, Investing Into Technology Stocks Amid Mounting Trade Woes",08/10/2018,ALB
5 Chemical Stocks That Are Poised for Solid Upside in Q4,05/10/2018,ALB
"China's Tianqi can buy 25% stake in SQM, Chilean antitrust court rules",04/10/2018,ALB
"Spiros Segalas Buys Alphabet, Tesla",04/10/2018,ALB
Chile considers arbitration with lithium producer Albemarle,04/10/2018,ALB
Livent Files Proposed Terms For $380 Million IPO,01/10/2018,ALB
"Harbor Capital Appreciation Fund Buys AstraZeneca PLC, Alphabet Inc, Alphabet Inc, Sells FedEx ...",28/09/2018,ALB
Albemarle CEO foresees future as pure-play lithium market leader,27/09/2018,ALB
Lithium Miners News For The Month Of September 2018,24/09/2018,ALB
Wall Street at Record Highs,21/09/2018,ALB
Wall Street Jumps Wednesday,19/09/2018,ALB
5 Reasons to Add Albemarle (ALB) Stock to Your Portfolio Now,19/09/2018,ALB
Tianqi And SQM Lithium: Resolution Of A Deal Both Need,17/09/2018,ALB
Top Dividend Growth Stocks By Sector,12/09/2018,ALB
Why Is Albemarle (ALB) Down 2.4% Since Last Earnings Report?,06/09/2018,ALB
Reuters: Albemarle may buy FMC's lithium operations if IPO stumbles,05/09/2018,ALB
"Road To Financial Independence: Growing Dividends, Endless Opportunities But Limited Capital",03/09/2018,ALB
Energy Metals Expert Chris Berry Gives An Industry Update With Matt Bohlsen Of Trend Investing,31/08/2018,ALB
FMC's Livent IPO Is Critical For Lithium Investors,31/08/2018,ALB
Livent files for IPO,27/08/2018,ALB
Lithium Miners News For The Month Of August 2018,24/08/2018,ALB
Reuters: Chile plans clampdown on water rights in lithium-rich area,23/08/2018,ALB
Tracking Robert Karr's Joho Capital Portfolio - Q2 2018 Update,20/08/2018,ALB
The Lithium Collapse Is Creating Opportunity,19/08/2018,ALB
The U.S. Must Rely On Innovative Domestic Startups To Reduce Dependency On Imported Lithium,15/08/2018,ALB
Trump's Shift Into Overdrive Could Bury America's EV Space,13/08/2018,ALB
S&P 500: It's All In The Numbers And The Numbers Never Lie,12/08/2018,ALB
"Reuters: Peru president sees lithium, uranium laws passed in six months",10/08/2018,ALB
"Fiduciary Financial Services Of The Southwest Inc Buys Annaly Capital Management Inc, NVIDIA ...",10/08/2018,ALB
SQM says will pass Albemarle as world's no. 1 lithium producer by 2022,09/08/2018,ALB
Albemarle (ALB) Looks Good: Stock Adds 6.4% in Session,09/08/2018,ALB
Albemarle: Up On Better Than Expected Q2 Results,08/08/2018,ALB
Albemarle (ALB) Q2 2018 Results - Earnings Call Transcript,08/08/2018,ALB
Wall Street Mostly Higher Wednesday,08/08/2018,ALB
Albemarle +6% after following strong Q2 with added $250M stock buyback,08/08/2018,ALB
Albemarle Corporation 2018 Q2 - Results - Earnings Call Slides,08/08/2018,ALB
"Albemarle (ALB) Tops Q2 Earnings Estimates, Raises FY18 View",08/08/2018,ALB
"Albemarle +3% after beating Q2 earnings estimate, raising guidance",07/08/2018,ALB
"Albemarle beats by $0.08, beats on revenue",07/08/2018,ALB
"Dividend Portfolio Review: Busy Earnings Season, Heavy Buying, Growing Dividends",07/08/2018,ALB
Notable earnings after Tuesday's close,06/08/2018,ALB
"Chemical Stock Earnings to Watch on Aug 7: ALB, IFF, VSM",06/08/2018,ALB
FMC: Diversified With A Great Upside That Provides Lithium For A Hungry World,30/07/2018,ALB
Albemarle declares $0.335 dividend,26/07/2018,ALB
Lithium Miners News For The Month Of July 2018,25/07/2018,ALB
"Albemarle names Norris as new lithium chief, replacing Mitchell",25/07/2018,ALB
Piedmont Lithium: On Track To Become The Next U.S. Producer,23/07/2018,ALB
Germans Promise The Earth To Build Lithium And Magnesium Hydroxide Plants And Further Develop The Lithium Downstream In Bolivia,22/07/2018,ALB
"Baillie Gifford & Co Buys Spotify Technology SA, Apache Corp, Jefferies Financial Group ...",17/07/2018,ALB
4 Chemical Stocks Poised to Outshine Q2 Earnings Estimates,17/07/2018,ALB
Tesla's China Factory Resolves Neodymium Risk To Model 3 Production,15/07/2018,ALB
Buy PayPal Up To $98 - Cramer's Lightning Round (7/10/18),11/07/2018,ALB
Dividend Portfolio Review: Top 2 Dividend Income For June,10/07/2018,ALB
Albemarle: Long-Term Lithium And Electric Vehicle Play,05/07/2018,ALB
US Stock Markets High on Tuesday,03/07/2018,ALB
Albemarle +4% as Goldman Sachs calls lithium selloff overdone,03/07/2018,ALB
A Review Of The North American EV Metal Miners,03/07/2018,ALB
Albemarle: Cyclical Value? Or Super-Cyclical Trap?,02/07/2018,ALB
Lithium Miners News For The Month Of June 2018,25/06/2018,ALB
Gilead Sciences Is Too Cheap To Ignore - Cramer's Lightning Round (6/22/18),25/06/2018,ALB
"Albemarle, Sinopec sign Heads of Agreement for catalytic hydrocracking",21/06/2018,ALB
Albemarle: Lithium Cooled But Volume Will Grow,20/06/2018,ALB
Dividend Portfolio Review: New Dividend Record,18/06/2018,ALB
Albemarle: Lithium And Non-Lithium Business Move Together,15/06/2018,ALB
"Detailed Research: Economic Perspectives on Och-Ziff Capital Management Group, Axalta Coating, ...",13/06/2018,ALB
Fed Prepares To Hike Interest Rates (Wall Street Breakfast Podcast),13/06/2018,ALB
Wall Street Breakfast: Fed Day Comes Round Again,13/06/2018,ALB
Lithium revival across the U.S.,13/06/2018,ALB
Piedmont Lithium: Should You Buy This Nasdaq-Listed U.S. Explorer?,06/06/2018,ALB
The ECB Will End Its QE Program; India's Central Bank Raised Rates (Wall Street Breakfast Podcast),06/06/2018,ALB
Wall Street Breakfast: ECB Steps Toward Exiting QE,06/06/2018,ALB
"Honeywell, Dover among companies exiting Iran presence before sanctions",05/06/2018,ALB
Lithium's Chinese Connection,04/06/2018,ALB
Lithium Investing: Production Remains Concentrated Despite Significant Rise In Exploration Activity,31/05/2018,ALB
"Tesla Sees An Undersupply Of Lithium, But Why Don't You?",29/05/2018,ALB
Lithium Investment: Balancing Battery Demand Against Innovative Production And Supply,28/05/2018,ALB
Lithium Miners News For The Month Of May 2018,27/05/2018,ALB
US Stocks Red Thursday,24/05/2018,ALB
Is Albemarle (ALB) Stock a Solid Choice Right Now?,24/05/2018,ALB
Lithium Stocks to be Boosted by Chinese EV Demand Growth,23/05/2018,ALB
Insights From The IMJI Lithium Subsector Index,20/05/2018,ALB
Albemarle (ALB) Presents At Barclays Electronic Chemicals Conference - Slideshow,15/05/2018,ALB
Wall Street Rallies on Thursday,10/05/2018,ALB
Albemarle Corporation 2018 Q1 - Results - Earnings Call Slides,10/05/2018,ALB
Albemarle (ALB) Q1 2018 Results - Earnings Call Transcript,10/05/2018,ALB
Albemarle (ALB) Q1 Earnings Top Estimates on Lithium Strength,10/05/2018,ALB
"Albemarle beats by $0.09, beats on revenue",09/05/2018,ALB
Notable earnings after Wednesday's close,08/05/2018,ALB
Albemarle declares $0.335 dividend,08/05/2018,ALB
Will Lithium Unit Help Albemarle (ALB) Beat Earnings in Q1?,07/05/2018,ALB
"Dividend Asset Capital, Llc Buys Medtronic PLC, International Business Machines Corp, United ...",02/05/2018,ALB
"David Carlson Buys Diamondback Energy, Closes ' Positions",02/05/2018,ALB
Analyst Calling For Tesla Stock Plunging To $84 Reinforces My View On Lithium,02/05/2018,ALB
"Elfun Trusts Buys The Cooper Inc, Applied Materials Inc, Diamondback Energy Inc, Sells Amgen ...",01/05/2018,ALB
Lithium Miners News For The Month Of April 2018,27/04/2018,ALB
Lithium Prices Remain Strong In Q1 2018,25/04/2018,ALB
Backing Blackstone For A Decade - Cramer's Lightning Round (4/23/18),24/04/2018,ALB
Will Chile's Lithium Blockade Send Chinese Buyers to Argentina?,20/04/2018,ALB
Why Albemarle Corporation's Outlook Is Still Strong Despite Recent Slump,18/04/2018,ALB
Lithium miner SQM says industry needs $10B-$12B investment over decade,18/04/2018,ALB
Meet the electric/autonomous vehicle ETF,17/04/2018,ALB
"Plancorp, LLC Buys Vanguard Short-Term Bond, Salesforce. ...",16/04/2018,ALB
Lithium Investing: Capital Continues To Flow Into Lithium Assets As Demand Rises,16/04/2018,ALB
2019 Dividend Aristocrat Newcomers,16/04/2018,ALB
Albemarle +2% as Citigroup upgrades to Buy,13/04/2018,ALB
Oroplata (ORRP): The Unknown Lithium Stock That Could See 400% Gains in 2018,12/04/2018,ALB
Road To Financial Independence: My March 89-Stock Portfolio Review,11/04/2018,ALB
Why Lithium Is About To Replace Oil,08/04/2018,ALB
Albemarle Closes Sale of Part of Performance Catalysts Unit,04/04/2018,ALB
Expect Positive Surprises On President Trump's Trade Policies,03/04/2018,ALB
Lithium Investing: Focus On Advanced Explorers And Early Stage Production Companies,03/04/2018,ALB
Should Value Investors Pick Albemarle (ALB) Stock Now?,03/04/2018,ALB
Dividend Sensei's Portfolio Update 29: Hope For The Best But Plan For The Worst,03/04/2018,ALB
5 S&P 500 Stocks on the Forefront of Q1 Slump,29/03/2018,ALB
Albemarle (ALB) Down 16.3% Since Earnings Report: Can It Rebound?,29/03/2018,ALB
QMC Completes 3D Modeling for The Irgon Lithium Mine,28/03/2018,ALB
QMC Identifies Huge Lithium Anomaly,26/03/2018,ALB
Lithium Miners News For The Month Of March 2018,26/03/2018,ALB
"Bought Albemarle In 2 Stages, Looking At Adding More As Lithium Negativity Continues",23/03/2018,ALB
4 ETFs to Join The Sustainable Investing Trend,22/03/2018,ALB
Toshiba Unveils New Super Fast Charging Lithium Battery Upping the Stakes for Li-on Market,22/03/2018,ALB
"Are Chemical & Mining Co. Of Chile, FMC Corp., And Albemarle Buys Right Now?",21/03/2018,ALB
"Zacks Industry Outlook Highlights: DowDuPont, Albemarle and Monsanto",15/03/2018,ALB
Chemical Industry Looking Up: Stocks Warranting a Look,14/03/2018,ALB
"Albemarle (ALB) Presents At JP Morgan Aviation, Transportation & Industrials Conference - Slideshow",14/03/2018,ALB
Road To Financial Independence: My February 88-Stock Portfolio Review With Big Apple Purchase,13/03/2018,ALB
Chile OKs increase in lithium quota for Albemarle,09/03/2018,ALB
"Upcoming Dividends: 83 Companies, 35 Increases, 17 Double-Digit Increases",08/03/2018,ALB
Time To Buy Some Lithium Miners,08/03/2018,ALB
"Hard Rock Lithium Can Quickly Bridge 50,000-tonne Lithium Supply Gap",05/03/2018,ALB
Quick Note On Recent Lithium Majors' Earnings,02/03/2018,ALB
"33 Dividend Increases: February 19-23, 2018 (Part 2: Consumer Discretionary And Materials Sectors)",02/03/2018,ALB
Buy JPMorgan - Cramer's Lightning Round (3/1/18),02/03/2018,ALB
"SQM, Albemarle continue this week's slide following earnings, supply concerns",01/03/2018,ALB
"At Least 2, Possibly 3 Double-Digit Payout Increases Expected In March",01/03/2018,ALB
Albemarle (ALB) Q4 2017 Results - Earnings Call Transcript,28/02/2018,ALB
Energy/Materials - Top Gainers / Losers as of 2:00 pm (2/28/2018),28/02/2018,ALB
Albemarle Corporation 2017 Q4 - Results - Earnings Call Slides,28/02/2018,ALB
Albemarle's (ALB) Q4 Earnings & Revenues Top Estimates,28/02/2018,ALB
Why Lithium ETF Plunged to Start the Week?,27/02/2018,ALB
"Albemarle +2% after beating on earnings, revenues",27/02/2018,ALB
"Albemarle beats by $0.13, beats on revenue",27/02/2018,ALB
The Rise Of EVs: Capturing Value From The Megatrend,27/02/2018,ALB
Notable earnings after Tuesday's close,26/02/2018,ALB
Energy/Materials - Top Gainers / Losers as of 2:00 pm (2/26/2018),26/02/2018,ALB
Lithium Miners News For The Month Of February 2018,26/02/2018,ALB
"Lithium prices -45% by 2021, Morgan Stanley says in cutting Albemarle, SQM",26/02/2018,ALB
Albemarle a Buy at Argus on strong lithium demand,23/02/2018,ALB
2 Early Lithium Companies With Management To Succeed,23/02/2018,ALB
Albemarle declares $0.335 dividend,23/02/2018,ALB
Tracking Ole Andreas Halvorsen's Viking Global Portfolio - Q4 2017 Update,22/02/2018,ALB
Can Albemarle (ALB) Beat Q4 Earnings on Lithium Strength?,22/02/2018,ALB
Smackdown: How a Rapid Extraction Process is Reinventing the Lithium Industry,21/02/2018,ALB
Multiple Double-Digit Payout Increases In The First 2 Weeks Of February,20/02/2018,ALB
Road To Financial Independence: My January 88-Stock Portfolio Review,14/02/2018,ALB
Lithium Investing: Investors Look To Argentina's Low Cost Brines For High Returns,14/02/2018,ALB
"Global X Management CO LLC Buys Albemarle Corp, NVIDIA Corp, Intuitive Surgical Inc, Sells ...",08/02/2018,ALB
AIS Resources Is Racing Towards Lithium Production In Northern Argentina,07/02/2018,ALB
"Tesla, The New Atacama Debutante",06/02/2018,ALB
Lithium Investing: Asia Makes Bold Investments To Secure Supply,05/02/2018,ALB
"Albemarle upped to Buy at UBS, which sees lithium demand tripling by 2025",30/01/2018,ALB
Trump Leading The Charge To Increase Lithium Supply In The U.S.,30/01/2018,ALB
"Twin Capital Management Inc Buys FMC Corp, Tapestry Inc, Marriott International Inc, Sells ...",29/01/2018,ALB
Lithium Miners News For The Month Of January 2018,28/01/2018,ALB
What To Make Of Albemarle's Selloff? A Buying Opportunity,25/01/2018,ALB
Lithium Investing: SQM And The Changing Supply Landscape,22/01/2018,ALB
Game Plan For The Week - Cramer's Mad Money (1/19/18),22/01/2018,ALB
Lithium producers routed after Chile regulator rules on SQM,18/01/2018,ALB
Energy/Materials - Top Gainers / Losers as of 2:00 pm (1/18/2018),18/01/2018,ALB
Premarket Losers as of 9:05 am (1/18/2018),18/01/2018,ALB
"Chile's Corfo, SQM reach agreement in lithium dispute",18/01/2018,ALB
Lithium Investing: 2018 Key Trends In The Lithium Mining Markets,17/01/2018,ALB
Lithium miners mixed a day after big losses,17/01/2018,ALB
"Lithium stocks slide amid Asian supply, SQM's Corfo talks",16/01/2018,ALB
Dividend Contenders: 47 Increases Expected In The Next 11 Weeks,16/01/2018,ALB
Road To Financial Independence: My December 88-Stock Portfolio Review,15/01/2018,ALB
A Warning Sign Of High Dividend Growth Stocks,12/01/2018,ALB
3 Brine Lithium Developers Picked Following A Relative Value Analysis,12/01/2018,ALB
2018 Stationary Storage Outlook: Home Battery Storage Systems Fully Charged,11/01/2018,ALB
Orocobre Provides Update On Expansion Plans In Argentina And Japan,11/01/2018,ALB
6 Well Valued Lithium Miners To Buy Now,10/01/2018,ALB
Marvell Technology Can Go To $30 - Cramer's Lightning Round (1/9/18),10/01/2018,ALB
Make Your Own High-Risk/High-Reward Lithium ETF,09/01/2018,ALB
Stocks To Watch: Albemarle Sees RS Rating Rise To 82,09/01/2018,ALB
Top 5 Stock Picks To Consider For 2018,09/01/2018,ALB
CES Officially Starts; EV Stock Plays To Watch: Investing Action Plan,08/01/2018,ALB
Lithium Miners News For The Month Of December 2017,25/12/2017,ALB
Albemarle (ALB) Stock Up 25% in 6 Months: Here's Why,21/12/2017,ALB
W.R. Grace (GRA) Updates On Acquisition Of Polyolefin Catalyst - Slideshow,15/12/2017,ALB
"My Journey To Financial Independence: 86-Stock November Portfolio Update - Buying Apple, AbbVie And BMW",15/12/2017,ALB
Albemarle to Sell Portion of Performance Catalysts Unit,15/12/2017,ALB
Grace to buy Albemarle's polyolefin catalysts business,15/12/2017,ALB
U.S. Chemical Industry Set to Ride High: 5 Stocks for 2018,13/12/2017,ALB
Albemarle (ALB) Down 9.6% Since Earnings Report: Can It Rebound?,11/12/2017,ALB
73 Dividend Growth Stocks Going Ex-Dividend Next Week,08/12/2017,ALB
Albemarle (ALB) Shares Up 48% YTD: What's Driving the Stock?,07/12/2017,ALB
"Tesla, lithium stocks lower after Reuters defects report",29/11/2017,ALB
Electric Vehicle Market Powered Up To Accelerate,29/11/2017,ALB
Lithium Miners News For The Month Of November 2017,27/11/2017,ALB
Tracking Stephen Mandel's Lone Pine Capital Portfolio - Q3 2017 Update,24/11/2017,ALB
Lithium: Wrapping Up And Elaborating On My Tweets In The Last 24 Hours,24/11/2017,ALB
Lithium Stock Face Off: Is ALB More Attractive Than FMC?,22/11/2017,ALB
Tracking Ole Andreas Halvorsen's Viking Global Portfolio - Q3 2017 Update,21/11/2017,ALB
"Susquehanna International Group, Llp Buys Apple Inc, Boeing Co, Arista Networks Inc, Sells ...",20/11/2017,ALB
Li-Ion Battery Market Surge Will Put Further Demand on Lithium Suppliers,20/11/2017,ALB
"Aldebaran Financial Inc. Buys Albemarle Corp, Centene Corp, Paragon Commercial Corp, Sells ...",17/11/2017,ALB
Fundamentals Support Strong Lithium Pricing In 2018,17/11/2017,ALB
"Zacks Industry Outlook Highlights: DowDuPont, Albemarle, Monsanto, Westlake Chemical and Kraton",10/11/2017,ALB
Chemical Industry on Solid Footing: Stocks Worth a Look,09/11/2017,ALB
"Harvey Capital Management Inc Buys DowDuPont Inc, Albemarle Corp, Oracle Corp, Sells Otonomy ...",08/11/2017,ALB
Beyond Tesla: 2 Lithium Stocks to Buy Now,07/11/2017,ALB
More Stable Li-ion Batteries Could Mean Even Greater Demand for Lithium,07/11/2017,ALB
"Strategic Financial Services, Inc, Buys iShares Core MSCI EAFE, iShares Intermediate ...",06/11/2017,ALB
Can Albemarle (ALB) Beat Q3 Earnings on Lithium Strength?,06/11/2017,ALB
"Grandfield & Dodd, Llc Buys Weyerhaeuser Co, US Bancorp, M&T Bank Corp, Sells Emerson ...",03/11/2017,ALB
"David Carlson Buys Biogen Inc, Broadcom, Albemarle Corp, Sells Charter Communications Inc, ...",30/10/2017,ALB
"Tom Gayner Buys Goldman Sachs Group Inc, Tyson Foods Inc, Albemarle Corp, Sells Exxon Mobil ...",27/10/2017,ALB
"Glenview State Bank Trust Dept. Buys DowDuPont Inc, Magellan Midstream Partners LP, Albemarle ...",26/10/2017,ALB
Air Products (APD) Q4 Earnings & Revenues Top Estimates,26/10/2017,ALB
"BHP Billiton Reports Q1 Operational Results, Reaffirms View",18/10/2017,ALB
"Guild Investment Management, Inc. Buys YY Inc, iShares Russell —………, Royal Caribbean ...",17/10/2017,ALB
A Red Friday for US Stock Markets,06/10/2017,ALB
Albemarle (ALB) Up 28% in 3 Months: What's Driving the Stock?,05/10/2017,ALB
Why Is Albemarle (ALB) Down 3.5% Since the Last Earnings Report?,07/09/2017,ALB
"AGF Investments America Inc. Buys Medtronic PLC, Danaher Corp, Cummins Inc, Sells Mobileye NV, ...",09/08/2017,ALB
"Svenska Handelsbanken AB (publ) Buys UnitedHealth Group Inc, Proto Labs Inc, Albemarle Corp, ...",08/08/2017,ALB
Albemarle (ALB) Q2 Earnings Preview: What's in the Cards?,03/08/2017,ALB
"New Jersey Better Educational Savings Trust Buys Biogen Inc, Allergan PLC, United Rentals Inc, ...",02/08/2017,ALB
"Domtar Corp (UFS) Q2 Earnings Beat Estimates, Stock Up 2.2%",31/07/2017,ALB
"Tom Gayner Buys Blackstone Group LP, Tyson Foods Inc, Albemarle Corp, Sells Schlumberger",28/07/2017,ALB
"Verus Financial Partners, Inc. Buys Vanguard Total Stock Market, Sells Albemarle Corp, Cintas ...",28/07/2017,ALB
"Pillar Pacific Capital Management Llc Buys Weibo Corp, Symantec Corp, Facebook Inc, Sells ...",27/07/2017,ALB
"Zacks Industry Outlook Highlights: Dow Chemical, DuPont, Syngenta, Albemarle and Monsanto",26/07/2017,ALB
Chemical Industry in Fine Shape: Stocks to Bet on Right Now,25/07/2017,ALB
7 Reasons that Make Chemours (CC) a Solid Choice Right Now,14/07/2017,ALB
Albemarle Touches New 52-Week High on Solid Prospects,13/07/2017,ALB
Dow Chemical to Sell Certain Corn Seed Assets for $1.1B,12/07/2017,ALB
"Albemarle Corp (ALB) Chairman, President & CEO Luther C Iv Kissam Sold $5.5 million of Shares",11/07/2017,ALB
6 Reasons to Add Koppers (KOP) Stock to Your Portfolio,11/07/2017,ALB
"PolyOne Buys Mesa, Expands Color & Additives Offerings",11/07/2017,ALB
Beyond Tesla: 2 Lithium Stocks to Buy Now,10/07/2017,ALB
"Top Analyst Reports for Procter & Gamble, Verizon & Citigroup",07/07/2017,ALB
Eastman Chemical vs Albemarle: Which Stock Is a Better Pick?,07/07/2017,ALB
"KAMES CAPITAL plc Buys Burlington Stores Inc, LCI Industries Inc, Lam Research Corp, Sells TJX ...",07/07/2017,ALB
7 Outperforming Stocks With Rising Prices,27/06/2017,ALB
Stocks Pare Losses But Still Close Lower; Nike Drags Dow,15/06/2017,ALB
5 Investor Bets On An Electric Car Boom,13/06/2017,ALB
Beyond Tesla: 2 Lithium Stocks to Buy Now,07/06/2017,ALB
Tom Gayner Gains 4 New Stocks in –st Quarter,01/05/2017,ALB
"KAMES CAPITAL plc Buys Ansys, Zions Bancorp, Tetra Tech, Sells Bank of Americaoration, PACCAR, ...",27/04/2017,ALB
Stocks That Are Beating the Market,12/04/2017,ALB
5 Companies Reach Yearly Highs,11/04/2017,ALB
"National Pension Service Buys SBA Communications, Waste Connections, Huntington Bancshares, ...",11/04/2017,ALB
"Spiros Segalas Buys JPMorgan Chase, Parker Hannifin, Texas Instruments, Sells American Tower, ...",31/03/2017,ALB
Lithium Suppliers Can't Keep Up With Skyrocketing Demand,23/03/2017,ALB
Lithium X: Insider Buying Well-Timed,20/03/2017,ALB
Albemarle (ALB) Investor Presentation - Slideshow,16/03/2017,ALB
Time To Top Up On The Junior Lithium Miners,10/03/2017,ALB
Fed Could Hike 4 Times - Cramer's Mad Money (3/8/17),09/03/2017,ALB
Methanex (MEOH) Declares New Share Repurchase Program,08/03/2017,ALB
Air Products Declares Pricing Milestone at Fueling Stations,07/03/2017,ALB
Global EV Sales Off To An Interesting Start For 2017,06/03/2017,ALB
Will Albemarle (ALB) Continue to Surge Higher?,06/03/2017,ALB
Valuation Dashboard: Energy And Materials - Update,05/03/2017,ALB
