headline,date,stock
Albemarle Corporation to Participate in Deutsche Bank's Virtual ––th Annual Global ...,02/06/2020,ALB
Albemarle Corporation to Participate in Virtual Electric Vehicle Supply Chain Festival from ...,21/05/2020,ALB
"Perseverance Asset Management International Buys Pinduoduo Inc, Weibo Corp, NetEase Inc, Sells ...",14/05/2020,ALB
Dow Jones Falls Over 5…… Points on Wednesday,13/05/2020,ALB
"GHP Investment Advisors, Inc. Buys Miller Industries, Albemarle Corp, SPDR Series Trust ...",13/05/2020,ALB
"Svenska Handelsbanken AB (publ) Buys Abbott Laboratories, Baxter International Inc, Albemarle ...",12/05/2020,ALB
"AGF Investments America Inc. Buys MSCI Inc, Stantec Inc, Ball Corp, Sells Westinghouse Air ...",08/05/2020,ALB
Albemarle Corporation Announces Dividend,05/05/2020,ALB
"Legacy Capital Partners, Inc. Buys Apple Inc, Colgate-Palmolive Co, Albemarle Corp, Sells ...",05/05/2020,ALB
"B & T Capital Management DBA Alpha Capital Managem Buys SPDR S&P 5……, iShares ...",05/05/2020,ALB
"Johnston Asset Management Corp Buys Boston Scientific Corp, Albemarle Corp, Prologis Inc, Sells ...",04/05/2020,ALB
"Kanawha Capital Management Llc Buys Truist Financial Corp, iShares Core S&P Small-Cap, SPDR ...",04/05/2020,ALB
Albemarle (ALB) to Post Q1 Earnings: What's in the Offing?,04/05/2020,ALB
"KAMES CAPITAL plc Buys Haemonetics Corp, Microsoft Corp, Biogen Inc, Sells EOG Resources Inc, ...",30/04/2020,ALB
"Whitener Capital Management, Inc. Buys McDonald's Corp, Rockwell Automation Inc, Intel Corp, ...",24/04/2020,ALB
"Tompkins Financial Corp Buys iShares MSCI USA ESG Select, Adobe Inc, Essential Utilities Inc, ...",22/04/2020,ALB
"Albemarle Announces J. Kent Masters Elected Chairman, President and Chief Executive Officer",20/04/2020,ALB
Albemarle (ALB) Gains on Lithium Expansions Amid Pricing Woes,14/04/2020,ALB
Albemarle Shows Improved Relative Price Performance; Still Shy Of Benchmark,13/04/2020,ALB
"Albemarle Corporation to release first quarter —…—… earnings results on Wednesday, May ...",09/04/2020,ALB
Coronavirus Casts a Pall Over Diversified Chemical Industry,09/04/2020,ALB
"Blackhawk Capital Partners LLC. Buys First Trust Capital Strength ETF, First Trust VL Dividend, ...",03/04/2020,ALB
Albemarle (ALB) Gains But Lags Market: What You Should Know,26/03/2020,ALB
Albemarle Corporation to Participate in Virtual Fireside Chat with David Begleiter at Deutsche Bank,23/03/2020,ALB
Stock Upgrades: Albemarle Shows Rising Relative Strength,18/03/2020,ALB
Why You Should Keep Albemarle (ALB) Stock in Your Portfolio,18/03/2020,ALB
Albemarle Announces New Investor Relations Leadership,16/03/2020,ALB
Albemarle Corporation to Attend Goldman Sachs Chemicals Intensity Days Conference,12/03/2020,ALB
Albemarle Demonstrates Green Building Leadership with LEED Gold Certification,12/03/2020,ALB
"Berman Capital Advisors, LLC Buys Appian Corp, ViacomCBS Inc, iShares Core S&P 5……, ...",04/03/2020,ALB
Albemarle (ALB) Announces Hike of 5% in Quarterly Dividend,02/03/2020,ALB
Albemarle Corporation Announces Dividend,28/02/2020,ALB
Albemarle Corporation to Attend J.P. Morgan Industrials Conference,27/02/2020,ALB
Coronavirus Casts a Pall Over Chemical Industry: Here's How,27/02/2020,ALB
' Fast-Growing CapEx Stocks,24/02/2020,ALB
Ten Plagues,23/02/2020,ALB
Albemarle (ALB) Surges: Stock Moves 5.6% Higher,21/02/2020,ALB
"Albemarle (ALB) Q4 Earnings & Sales Miss, View Disappoints",20/02/2020,ALB
"Shapiro Capital Management Co Inc Buys Albemarle Corp, SPDR S&P 5……, Urban Outfitters ...",17/02/2020,ALB
"Wills Financial Group, Inc. Buys American Campus Communities Inc, Zoetis Inc, The Walt Disney ...",17/02/2020,ALB
Albemarle (ALB) to Report Q4 Earnings: What's in the Cards?,14/02/2020,ALB
"AGF Investments America Inc. Buys Cummins Inc, Ansys Inc, Albemarle Corp, Sells Monolithic ...",13/02/2020,ALB
"Washington Capital Management Inc Buys ViacomCBS Inc, The Kroger Co, Truist Financial Corp, ...",07/02/2020,ALB
"Rock Point Advisors, LLC Buys ViacomCBS Inc, Albemarle Corp, SunPower Corp, Sells PGT ...",06/02/2020,ALB
"Albemarle Chairman and CEO, Luke Kissam, Will Retire for Health Reasons, Effective June —…—…",05/02/2020,ALB
Albemarle Shows Market Leadership With Jump To 90 RS Rating,05/02/2020,ALB
Baird Downgrades Albemarle To Neutral After 24% Year-To-Date Rally,05/02/2020,ALB
"Oil firms up on production cut hopes, Nasdaq at record highs",05/02/2020,ALB
US Stocks Rally on Tuesday,04/02/2020,ALB
"Gs Investments, Inc. Buys McKesson Corp, Henry Schein Inc, iShares MSCI EAFE ETF, Sells Celgene ...",04/02/2020,ALB
HP and Progressive Show Value and Momentum,03/02/2020,ALB
Weighing the Week Ahead: Coronavirus – Cause for Analysis or Paralysis?,02/02/2020,ALB
"Lowe Brockenbrough & Co Inc Buys Truist Financial Corp, Albemarle Corp, Alico Inc, Sells ...",31/01/2020,ALB
"Growth Prospects in the PBN Rods Market —…—…| AXT(US), Stanford Advanced Materials(US), ...",31/01/2020,ALB
Albemarle Corporation Recognized by Wildlife Habitat Council for Environmental Excellence,29/01/2020,ALB
"John G Ullman & Associates Inc Buys Albemarle Corp, Xerox Holdings Corp, International ...",29/01/2020,ALB
Dividend Aristocrats In Focus: Albemarle Corporation,29/01/2020,ALB
Albemarle Corporation Joins S&P 5…… Dividend Aristocrats Index,28/01/2020,ALB
"Goodman Financial CORP Buys II-VI Inc, Albemarle Corp, Host Hotels & Resorts Inc, Sells ...",27/01/2020,ALB
New Dividend Aristocrats For 2020,26/01/2020,ALB
"Albemarle Corporation to release fourth quarter —…–9 earnings results on Wednesday, Feb. ...",22/01/2020,ALB
Stocks With Rising Relative Strength: Albemarle,22/01/2020,ALB
Albemarle Corporation Included in —…—… Bloomberg Gender-Equality Index,21/01/2020,ALB
Albemarle Corp (ALB) EVP & CFO Scott Tozier Sold $–.— million of Shares,17/01/2020,ALB
Albemarle Set to Gain on Lithium Demand Amid Pricing Woes,16/01/2020,ALB
"Deane Retirement Strategies, Inc. Buys Vanguard FTSE Europe ETF, Health Care Select Sector SPDR ...",15/01/2020,ALB
Here's Why You Should Hold Onto Albemarle (ALB) Stock for Now,06/01/2020,ALB
Investing Is Hard Enough: Here Is How to Avoid Making Obvious Mistakes,18/12/2019,ALB
Albemarle Corporation (ALB) Investor Presentation - Slideshow,12/12/2019,ALB
Albemarle CEO sees strong long-term lithium demand,12/12/2019,ALB
Albemarle Hosts Investor Day and Provides Update on Long-term Strategy,12/12/2019,ALB
4 Undervalued Companies To Look At In December,10/12/2019,ALB
November 2019 Dividend Portfolio Update,08/12/2019,ALB
Joe Lowry (Aka 'Mr. Lithium') On The State Of The Lithium Industry,08/12/2019,ALB
"Netflix, Cisco And Chewy On The Marquee (Stocks To Watch Podcast)",08/12/2019,ALB
Dividend Champion And Contender Highlights: Week Of December 8,07/12/2019,ALB
"Stocks To Watch: Netflix, Cisco And Chewy On The Marquee",07/12/2019,ALB
Why Is Albemarle (ALB) Down 10.8% Since Last Earnings Report?,06/12/2019,ALB
Staying Away From Albemarle And Its Weak Dividend Coverage,01/12/2019,ALB
5 Black Friday Dividend Deals You Won't Want To Miss,30/11/2019,ALB
November Portfolio Update - Prefs And Finance,29/11/2019,ALB
Lithium's Comeback Isn't Far: Time To Nibble Into Albemarle,27/11/2019,ALB
Lithium Miners News For The Month Of November 2019,26/11/2019,ALB
Dividend Champions Analysis: Add Lincoln Electric To Your Watch List,21/11/2019,ALB
Albemarle Corporation 2019 Q3 - Results - Earnings Call Presentation,14/11/2019,ALB
"Albemarle cut to Sell at Citi, latest in string of downgrades",13/11/2019,ALB
"United Bank Buys SPDR Barclays –-' Month T-Bill ETF, CyrusOne Inc, Albemarle Corp, Sells ...",13/11/2019,ALB
Albemarle Is Making The Right Moves,13/11/2019,ALB
First big downturn for lithium producers,13/11/2019,ALB
"Escalating protests sink Chilean stocks, currency",12/11/2019,ALB
"FUKOKU MUTUAL LIFE INSURANCE Co Buys Vanguard High Dividend Yield Index Fund, McDonald's Corp, ...",12/11/2019,ALB
New Strong Sell Stocks for November 12th,12/11/2019,ALB
Superior Economic Return Potential Makes Piedmont Lithium A Prime Takeover Candidate,11/11/2019,ALB
"Wafra Investment Advisory Group Inc Buys Mohawk Industries Inc, Ulta Beauty Inc, Digital ...",08/11/2019,ALB
'Overvalued' Albemarle cut to Sell equivalent at J.P. Morgan,08/11/2019,ALB
Albemarle Corporation (ALB) CEO Luke Kissam on Q3 2019 Results - Earnings Call Transcript,07/11/2019,ALB
"Albemarle warns of lithium oversupply, price weakness through next year",07/11/2019,ALB
Monthly Portfolio Update: October 2019,07/11/2019,ALB
"Baillie Gifford & Co Buys Pinduoduo Inc, EOG Resources Inc, Broadridge Financial Solutions ...",07/11/2019,ALB
Abstain From Getting LIT During The Drunken EV Rage,07/11/2019,ALB
Albemarle (ALB) Beats Q3 Earnings Estimates,06/11/2019,ALB
"Albemarle EPS beats by $0.03, misses on revenue",06/11/2019,ALB
"Meridian Management Co Buys iShares Intermediate Government/Credit Bond ETF, iShares 7-–… ...",06/11/2019,ALB
New Strong Sell Stocks for November 6th,06/11/2019,ALB
14 Great High-Yield Stocks For A Rich Retirement,06/11/2019,ALB
The Most Undervalued And Overvalued Dividend Champions - November 2019,05/11/2019,ALB
Swapping Apple For Apple - October Dividend Portfolio Update,04/11/2019,ALB
Albemarle (ALB) to Report Q3 Earnings: What's in the Offing?,04/11/2019,ALB
An Uber Exciting Week (Stocks To Watch Podcast),03/11/2019,ALB
Stocks To Watch: An Uber Exciting Week,02/11/2019,ALB
"Albemarle/Mineral Resources completes Wodgina JV, closes mine",01/11/2019,ALB
4 Stocks in Focus on Electric Vehicle Revolution,31/10/2019,ALB
Albemarle declares $0.3675 dividend,29/10/2019,ALB
Albemarle double downgraded to Underperform from Buy at BofA Merrill,28/10/2019,ALB
Gibraltar Industries and FTS International among Energy/Materials gainers; Dril-Quip and Valaris among losers,25/10/2019,ALB
Lithium Miners News For The Month Of October 2019,25/10/2019,ALB
Wall Street Breakfast: China Seeks Removal Of U.S. Tariffs In Return For Ag Buys,25/10/2019,ALB
Albemarle Corporation Announces Preliminary Third Quarter —…–9 Financial Results and ...,24/10/2019,ALB
Albemarle cuts 2019 guidance on lithium price weakness,24/10/2019,ALB
Albemarle's Lithium Business To Benefit From Consumer Expectations For Longer EV Range,24/10/2019,ALB
"Goldman analyst sees 'compelling value' in Buy-rated Albemarle, Livent",23/10/2019,ALB
Rio Tinto to produce lithium from waste rock in California,22/10/2019,ALB
Tianqi Lithium's Q3 loss spooks publicly traded rivals,22/10/2019,ALB
Are You Looking for a High-Growth Dividend Stock? Albemarle (ALB) Could Be a Great Choice,21/10/2019,ALB
Dividend Champions Analysis: A Lot Of Banks With Over 3% Yields,16/10/2019,ALB
Forecasting Future Results Is The Key To Successful Stock Investing: Part 2,16/10/2019,ALB
Forecasting The Future,15/10/2019,ALB
The EV Metal Miners' Downturn Looks To Have Bottomed Or Will Likely Bottom In 2019 Or Early 2020,13/10/2019,ALB
"Albemarle Corporation to release third quarter —…–9 earnings results on Wednesday, Nov. ...",10/10/2019,ALB
The Most Undervalued And Overvalued Dividend Champions - October 2019,06/10/2019,ALB
Monthly Portfolio Update: September 2019,06/10/2019,ALB
"Kempner Capital Management Inc. Buys DuPont de Nemours Inc, Albemarle Corp, Service Properties ...",04/10/2019,ALB
Q3 2019 Dividend Portfolio Update: New September Dividend Record,04/10/2019,ALB
Dividend Champion And Contender Highlights: Week Of September 29,28/09/2019,ALB
Lithium Miners News For The Month Of September 2019,22/09/2019,ALB
The Software Sell-Off,16/09/2019,ALB
Why You Should Keep Albemarle (ALB) Stock in Your Portfolio,16/09/2019,ALB
A Dividend Growth Analysis Of The Dividend Champions,15/09/2019,ALB
Albemarle Corporation (ALB) Presents At Credit Suisse 32nd Annual Basic Materials Conference - Slideshow,12/09/2019,ALB
"Expansion halted at Tianqi's Australia lithium plant; Albemarle, SQM rise",10/09/2019,ALB
Materials Sector (XLB) – Earnings Estimates - Revisions,10/09/2019,ALB
Albemarle's Dividend Growth Is Fueled By Its Lithium Expansion Plans,10/09/2019,ALB
100-Stock Dividend Portfolio Update For August 2019,09/09/2019,ALB
Dividend Champion And Contender Highlights: Week Of September 8,07/09/2019,ALB
Albemarle (ALB) Down 14.3% Since Last Earnings Report: Can It Rebound?,06/09/2019,ALB
The Most Undervalued And Overvalued Dividend Champions - September 2019,03/09/2019,ALB
"The Lithium Market Is Challenging, But Albemarle Is A Buy",03/09/2019,ALB
Is Albemarle (ALB) a Suitable Stock for Value Investors?,02/09/2019,ALB
Why Albemarle (ALB) is a Top Dividend Stock for Your Portfolio,02/09/2019,ALB
Here's Why You Should Hold Onto Albemarle (ALB) Stock Now,28/08/2019,ALB
Lithium Miners News For The Month Of August 2019,26/08/2019,ALB
"How To Be A Great Investor, Part 3: Properly Assess Strategy",26/08/2019,ALB
"SQM forecasts continued lithium oversupply, sending tickers sharply lower",22/08/2019,ALB
"Wills Financial Group, Inc. Buys Cisco Systems Inc, Palo Alto Networks Inc, Consolidated Edison ...",20/08/2019,ALB
Why Albemarle (ALB) is a Great Dividend Stock Right Now,16/08/2019,ALB
Albemarle: Delayed Expansion Won't Be Enough To Put An End To The Lithium Bear Market,15/08/2019,ALB
Road To Financial Independence: Highlights Of July 2019,14/08/2019,ALB
Livent Is Susceptible To More Downside,14/08/2019,ALB
Albemarle: The Key Risk,13/08/2019,ALB
"Nicholas Co Inc Buys Coca-Cola Co, Alcon Inc, Fastenal Co, Sells East West Bancorp Inc, ...",13/08/2019,ALB
Livent Corporation: An Excellent Vehicle To Participate In Tomorrow's World,12/08/2019,ALB
Albemarle Corporation (ALB) CEO Luke Kissam on Q2 2019 Results - Earnings Call Transcript,08/08/2019,ALB
Albemarle Corporation 2019 Q2 - Results - Earnings Call Slides,08/08/2019,ALB
Albemarle Corporation 2019 Q2 - Results - Earnings Call Slides,08/08/2019,ALB
"Albemarle (ALB) Tops Q2 Earnings Estimates, Ups FY19 EPS View",08/08/2019,ALB
"Gratus Capital LLC Buys Alphabet Inc, Royal Dutch Shell PLC, Albemarle Corp, Sells 'M Co, ...",07/08/2019,ALB
Albemarle (ALB) Q2 Earnings and Revenues Top Estimates,07/08/2019,ALB
"Albemarle EPS beats by $0.12, misses on revenue",07/08/2019,ALB
"Spf Beheer Bv Buys Booking Holdings Inc, Dollar General Corp, Albemarle Corp, Sells ...",07/08/2019,ALB
Albemarle (ALB) to Report Q2 Earnings: What's in the Cards?,05/08/2019,ALB
The Most Undervalued And Overvalued Dividend Champions - August 2019,04/08/2019,ALB
"Fast Growing, Silver Telluride Market Know about the Prominent Trends and Opportunities ...",04/08/2019,ALB
ClearBridge Global Growth Strategy Portfolio Manager Commentary Q2 2019,02/08/2019,ALB
Albemarle to get 60% stake in MinRes's Wodgina mine in deal revision,01/08/2019,ALB
"Capital Management Corp Buys Tessco Technologies Inc, Mobile Mini Inc, Schlumberger, Sells ...",31/07/2019,ALB
Are You Looking for a High-Growth Dividend Stock? Albemarle (ALB) Could Be a Great Choice,31/07/2019,ALB
"Svenska Handelsbanken AB (publ) Buys Welbilt Inc, Eli Lilly and Co, Service Corp International, ...",30/07/2019,ALB
Lithium Miners News For The Month Of July 2019,26/07/2019,ALB
Lithium Stocks When The Sentiment Is Negative - Albemarle,25/07/2019,ALB
Albemarle declares $0.3675 dividend,24/07/2019,ALB
"Old National Bancorp Buys Vanguard Mega Cap Value, SPDR Select Sector Fund - Energy Select ...",15/07/2019,ALB
This is Why Albemarle (ALB) is a Great Dividend Stock,15/07/2019,ALB
The Little Portfolio That Beats The Market - Update,10/07/2019,ALB
LIT: Oversupply Concerns Continue To Weigh On Lithium Market Sentiment,10/07/2019,ALB
My Road To Financial Independence: 103-Stocks Portfolio June Review,09/07/2019,ALB
The Best Dividend Stocks To Buy During The Rate Cut Rally,08/07/2019,ALB
Can Albemarle (ALB) Keep the Earnings Surprise Streak Alive?,08/07/2019,ALB
Piedmont Lithium Making Progress In Albemarle's And Livent's Backyard,05/07/2019,ALB
The Best Dividend Stocks To Buy In A Potentially Volatile July,01/07/2019,ALB
The Most Undervalued And Overvalued Dividend Champions - July 2019,01/07/2019,ALB
The Best Dividend Stocks To Buy When The Market Is At An All-Time High,26/06/2019,ALB
Lithium Miners News For The Month Of June 2019,25/06/2019,ALB
1 Of These 4 Stocks Is My Next Retirement Portfolio Buy,24/06/2019,ALB
Dividend Champion And Contender Highlights: Week Of June 23,22/06/2019,ALB
POSCO pulls out of proposed Chilean battery material plant,21/06/2019,ALB
Albemarle - More Than Just Lithium,20/06/2019,ALB
Wall Street Green on Wednesday,19/06/2019,ALB
5 Future Dividend Aristocrats To Buy Today,19/06/2019,ALB
"One EV Revolution, 4 Likely Victors",18/06/2019,ALB
2 New Companies I Just Bought For My Retirement Portfolio,17/06/2019,ALB
Albemarle outlines plan to lift Chilean lithium output by 30%,12/06/2019,ALB
Albemarle: Unique Total Return Opportunity For The Patient Investor,12/06/2019,ALB
Albemarle says will not participate in LME lithium contract,11/06/2019,ALB
Dividend Champion And Contender Highlights: Week Of June 9,10/06/2019,ALB
Primecap Management Buys More Albemarle Corp,07/06/2019,ALB
Tracking Larry Robbins' Glenview Capital Management Portfolio - Q1 2019 Update,06/06/2019,ALB
Will Market Drop Extend To June? (Wall Street Breakfast Podcast),03/06/2019,ALB
Wall Street Breakfast: Will Market Drop Extend To June?,03/06/2019,ALB
Albemarle: Strong Lithium Growth Potential Lies Ahead,03/06/2019,ALB
Introducing The Dividend 30,29/05/2019,ALB
The Best Dividend Stocks To Buy In This Volatile Market,28/05/2019,ALB
Why Albemarle (ALB) is a Top Dividend Stock for Your Portfolio,27/05/2019,ALB
Electric Vehicles: The Driver Behind The Amplify Advanced Battery Metals And Materials ETF,26/05/2019,ALB
Lithium Miners News For The Month Of May 2019,26/05/2019,ALB
"Walmart's 5260, Computex And Healthcare Headwinds (Stocks To Watch Podcast)",26/05/2019,ALB
"Stocks To Watch: Walmart's 5260, Computex And Healthcare Headwinds",25/05/2019,ALB
"SQM downgraded at BMO on lithium rebound concerns, earnings trajectory",24/05/2019,ALB
Lithium Industry M&A Update,22/05/2019,ALB
Why I Invested 10% Of My Retirement Portfolio Into 7 Dividend Blue Chips,21/05/2019,ALB
Key Takeaways From Livent's Q1 2019 Earnings Release,21/05/2019,ALB
New Sources of Lithium Needed Outside of Chile to Meet Rising Demand,21/05/2019,ALB
The Best Dividend Stocks To Buy In Today's Economy,21/05/2019,ALB
"Ashburton (Jersey) Ltd Buys AT&T Inc, Allergan PLC, Vanguard S&P 5……, Sells HDFC ...",20/05/2019,ALB
Lithium Segment Review For Albemarle Q1 2019,17/05/2019,ALB
The People's Republic Of China Is Destined To Decline,15/05/2019,ALB
"Cheap EVs On The Way In Europe, While Luxury Brands Start Taking EV Market Seriously",14/05/2019,ALB
"The Benefits Of Tactical Asset Allocation, With Lawrence Fuller (Podcast)",14/05/2019,ALB
The Best Dividend Stocks To Buy In This Risky Market,13/05/2019,ALB
How My Retirement Portfolio Will Profit From The Trade War,13/05/2019,ALB
Is This High-Yield Lithium Stock a Buy?,10/05/2019,ALB
Greenbushes lithium mine receives expansion approval,10/05/2019,ALB
Albemarle Corporation (ALB) CEO Luke Kissam on Q1 2019 Results - Earnings Call Transcript,09/05/2019,ALB
Albemarle says new project to boost its Chilean lithium output by 30%,09/05/2019,ALB
Albemarle Corporation 2019 Q1 - Results - Earnings Call Slides,09/05/2019,ALB
Global Markets Suffer As U.S.-China Dispute Intensifies (Wall Street Breakfast Podcast),09/05/2019,ALB
Global Markets Suffer As U.S.-China Dispute Intensifies (Wall Street Breakfast Podcast),09/05/2019,ALB
Albemarle's (ALB) Earnings & Revenues Top Estimates in Q1,09/05/2019,ALB
Wall Street Breakfast: Global Markets Suffer As U.S.-China Dispute Intensifies,09/05/2019,ALB
Albemarle (ALB) Surpasses Q1 Earnings and Revenue Estimates,08/05/2019,ALB
Albemarle forecasts 8%-14% full-year revenue rise,08/05/2019,ALB
Albemarle declares $0.3675 dividend,08/05/2019,ALB
Notable earnings after Wednesday's close,07/05/2019,ALB
Albemarle Q1 2019 Earnings Preview,07/05/2019,ALB
Should You Buy Albemarle (ALB) Ahead of Earnings?,07/05/2019,ALB
Dividend Champion Spotlight: Albemarle Corporation,06/05/2019,ALB
Albemarle Corporation: A Deeply Undervalued Dividend Aristocrat,06/05/2019,ALB
The Most Undervalued And Overvalued Dividend Champions - May 2019,06/05/2019,ALB
Albemarle (ALB) to Report Q1 Earnings: What's in the Offing?,06/05/2019,ALB
Energy Metals Expert Chris Berry Gives An Update,02/05/2019,ALB
5 Mega Investment Trends To 2025 And The Main Players,02/05/2019,ALB
Lithium Supply/Demand Forecasts. Why Are The Analysts Ignoring The Facts?,02/05/2019,ALB
What's in Store for International Flavors' (IFF) Q1 Earnings?,02/05/2019,ALB
3 Undervalued Dividend Aristocrats I Just Added To My Retirement Portfolio,01/05/2019,ALB
Dividend Champions For May 2019,01/05/2019,ALB
"Additional Lithium Mines Still Needed to Satisfy Rising Battery Storage, EV Demand",30/04/2019,ALB
10 Dividend Blue Chips I'm Looking To Add To My Retirement Portfolio,29/04/2019,ALB
"Professional Advisory Services Inc Buys S&P Global Inc, ResMed Inc, Capital One Financial ...",29/04/2019,ALB
The Best Dividend Stocks To Buy In May,29/04/2019,ALB
"Gs Investments, Inc. Buys Constellation Brands Inc, CVS Health Corp, Albemarle Corp, Sells ...",26/04/2019,ALB
"Atlanta Capital Group Buys Charles Schwab Corp, Arista Networks Inc, Vanguard High Dividend ...",26/04/2019,ALB
Hard-Rock Mining: A Game Changer In The Lithium Sector,25/04/2019,ALB
Lithium Miners News For The Month Of April 2019,25/04/2019,ALB
Is This A Gamechanger For The Lithium Industry?,25/04/2019,ALB
US Stocks Advance Tuesday,23/04/2019,ALB
"Aldebaran Financial Inc. Buys SPDR Portfolio Total Stock Market, Vanguard Real Estate, Invesco ...",23/04/2019,ALB
"SQM sees lithium demand rising this year, prices falling",23/04/2019,ALB
Albemarle: A Safer Alternative To Invest Into The Lithium Trend,22/04/2019,ALB
Piedmont Lithium Limited: Targeting A Vertically Integrated Lithium Project In The World's 2nd Largest Auto Market,18/04/2019,ALB
Will Albemarle (ALB) Beat Estimates Again in Its Next Earnings Report?,18/04/2019,ALB
The Outlook For Albemarle Calls For Investor Patience,16/04/2019,ALB
ChartMasterPro: Q1 2019 Trade Review,14/04/2019,ALB
Here's Why You Should Hold Onto Albemarle (ALB) Stock for Now,12/04/2019,ALB
12 Exceptional Investments in the Process Industries Sector,10/04/2019,ALB
"Report: Developing Opportunities within Albemarle, Stratasys, Pure Storage, Tenaris S. ...",10/04/2019,ALB
The Most Undervalued And Overvalued Dividend Champions - April 2019,08/04/2019,ALB
Global X Lithium & Battery Tech ETF: Why This ETF Is A Buy-And-Hold,07/04/2019,ALB
U.S. to push for EV supply chain strategy,05/04/2019,ALB
Albemarle Expects Lithium Volume Shift to Hurt Q1 Results,02/04/2019,ALB
Dividend Champions For April 2019,31/03/2019,ALB
Albemarle sees below consensus Q1 earnings due to lithium volume shift,28/03/2019,ALB
Lithium Miners News For The Month Of March 2019,27/03/2019,ALB
Why Is Albemarle (ALB) Down 4.2% Since Last Earnings Report?,22/03/2019,ALB
Chemical Diversified Stock Outlook: Near-Term Prospects Dim,20/03/2019,ALB
Albemarle (ALB) Shares Up 12% YTD: What's Driving the Stock?,19/03/2019,ALB
Albemarle: New Dividend Aristocrat With ~20% Upside And Attractive Long-Term Growth Story,18/03/2019,ALB
2019 Lithium Themes To Watch Out For,08/03/2019,ALB
43 Upcoming Dividend Increases - Are You Kidding Me?,08/03/2019,ALB
"Dividend Increases: February 25-March 1, 2019 (Part 2: Remaining Sectors)",06/03/2019,ALB
Automotive Industry Current And Long-Term Future Outlook,04/03/2019,ALB
Tracking Larry Robbins' Glenview Capital Management Portfolio - Q4 2018 Update,04/03/2019,ALB
Busy Week For Dividend Increases,04/03/2019,ALB
Defense Firms General Dynamics And Raytheon Among A Light Month Of Dividend Increases In March,03/03/2019,ALB
Albemarle (ALB) Presents At Bank of America Merrill Lynch Global Agriculture and Materials Conference - Slideshow,01/03/2019,ALB
"Albemarle Corp (ALB) Files –…-K for the Fiscal Year Ended on December '–, —…–8",27/02/2019,ALB
Galaxy Resources: Flush With Cash And Ready To Rock N Roll,27/02/2019,ALB
"Albemarle Hikes Quarterly Dividend, Boosts Shareholder Value",27/02/2019,ALB
Albemarle declares $0.3675 dividend,26/02/2019,ALB
Lithium Miners News For The Month Of February 2019,25/02/2019,ALB
"Company News For Feb 22, 2019",22/02/2019,ALB
Albemarle (ALB) in Focus: Stock Moves 7.8% Higher,22/02/2019,ALB
Albemarle Corporation (ALB) CEO Luke Kissam on Q4 2018 Results - Earnings Call Transcript,22/02/2019,ALB
TimkenSteel and Harsco among Energy/Materials gainers; Pioneer Energy Services and SM Energy among losers,21/02/2019,ALB
"ALB, NAK, HTZ among premarket gainers",21/02/2019,ALB
Albemarle Corporation 2018 Q4 - Results - Earnings Call Slides,20/02/2019,ALB
Albemarle (ALB) Tops Q4 Earnings and Revenue Estimates,20/02/2019,ALB
"VIPS, ALB and CAR among notable movers",20/02/2019,ALB
"Albemarle +5% after beating Q4 expectations, issuing upside guidance",20/02/2019,ALB
"Albemarle beats by $0.06, beats on revenue",20/02/2019,ALB
"Feltz Wealth PLAN Inc. Buys iShares Edge MSCI Min Vol USA, Zai Lab, Invesco QQQ Trust Series ...",20/02/2019,ALB
"Retailers Ross Stores, TJX Companies Expected To Lead Dividend Increases In Second Half Of February",18/02/2019,ALB
Can Albemarle (ALB) Maintain Earnings Beat Streak in Q4?,18/02/2019,ALB
"Spotlight On Walmart, Samsung And CAGNY (Stocks To Watch Podcast)",17/02/2019,ALB
Reflections On Nemaska's Bombshell,17/02/2019,ALB
"Stocks To Watch: Spotlight On Walmart, Samsung And CAGNY",16/02/2019,ALB
Top 5 Lithium Producers And Other Growing Producers To Consider,14/02/2019,ALB
