,headline,date,snippet,source
956,Lithium producer Livent's IPO priced at $17/share - bookrunner,10/10/2018,public offering of lithiumproducer Livent Corp was priced at $17 per the ticker 'LTHM'.Livent holds the lithium business of pesticides maker,reuters
957,SQM controlling shareholder moves to block stake sale to China's Tianqi,10/10/2018,lithium producer SQM on Wednesdayfiled suit with Chile's of the miner to China'sTianqi Lithium Corp.The lawsuit alleges,reuters
958,Chile studying possible lithium trade on LME -mines minister,10/10/2018,"By Fabian CamberoOct 10 (Reuters) - Chile has called for lithium.At present, lithium producers negotiate contracts withbuyers",reuters
959,Dollar shortage 'short-term problem' for miners in Zimbabwe: minister,10/10/2018,the potential to be a major lithium supplier.Foreign investor,reuters
960,"LMEWEEK-Dollar shortage ""short-term problem"" for miners in Zimbabwe- minister",10/10/2018,the potential to be a majorlithium supplier.Foreign investor interest,reuters
961,"LMEWEEK-Poland's KGHM focused on balance sheet, not dividends",10/10/2018,rare earths and lithium - as well as thecopper and silver,reuters
962,ERG bets on cobalt from Congo in quest for growth,09/10/2018,","" Sobotka said.ORGANIC GROWTHCobalt is a key ingredient in the lithium for cobalt, lithium, copper and aluminum in coming years, and ERG planned",reuters
963,LMEWEEK-ERG bets on cobalt from Congo in quest for growth,09/10/2018,"GROWTHCobalt is a key ingredient in the lithium-ion batteries in the electric car industry would reshapedemand for cobalt, lithium, copper",reuters
964,METALS-London aluminium near one-week low as supply woes abate,08/10/2018,aims to find new copper markets and expandits lithium industry,reuters
965,Albemarle shares drop after Chile rejects hike in lithium quota,08/10/2018,the company's quota to sell lithium produced from its Salar de Albemarle's March request to increase its quota to sell lithium products,reuters
966,LMEWEEK-Chile eyes new copper markets to shield economy from trade war,08/10/2018,lithium reserves* Says copper price down on U.S.-China trade war to find new coppermarkets and expand its lithium industry as it seeks,reuters
967,Albemarle shares drop after media report on Chile lithium quota,08/10/2018,refused to increase the company's lithiumproduction quota to the world's largest lithium producer's aimto increase output of the light,reuters
968,RPT-COLUMN-Battle lines drawn for London Metal Exchange: Andy Home,07/10/2018,"-ferrous contracts.The eagerly awaited lithium contract, a grab",reuters
969,S.Korea's SK Innovation to invest $354 mln in EV battery parts plant in China,06/10/2018,(EV) market.The plant will make separators for lithium ion batteries,reuters
970,Chile regulator refuses to raise Albemarle lithium output quota: newspaper,06/10/2018,) refused to increase the lithium production quota for U.S.-based of Metallic Lithium Equivalent based on a declared improvement,reuters
971,Chile regulator refuses to raise Albemarle lithium output quota -newspaper,06/10/2018,(CCHEN) refused to increase the lithium productionquota for U.S.-based tons of Metallic Lithium Equivalent based ona declared improvement,reuters
972,Trump says Pentagon to produce lithium sea-water batteries,05/10/2018,there was a shortfall in the U.S. defense industrial base relating to lithium. capabilities to manufacture products such as lithium sea-water batteries,reuters
973,RPT-Bolivia to pick new junior partner on lithium in coming weeks -official,05/10/2018,juniorpartner in the coming weeks to help industrialize its lithium.The other offers to work with Bolivia to tap twolithium-rich salt,reuters
974,Bolivia to pick new junior partner on lithium in coming weeks -official,05/10/2018,its lithiumdeposits from among seven companies that submitted to agovernment official.The other offers to work with Bolivia to tap twolithium,reuters
975,COLUMN-Battle lines drawn for London Metal Exchange: Andy Home,05/10/2018,"lithium contract, a grab for theelectric vehicle space",reuters
976,"LMEWEEK-LME launches new contracts with steel, alumina best placed to succeed",05/10/2018,"plans to launch a contract forlithium, another important metal for EVs",reuters
977,"METALS-London aluminium steady, eyes biggest weekly gain since April",05/10/2018,"to potential shortages.* LITHIUM: Chile's antitrust court approved,allowing the Chinese miner to purchase a nearly one-quarterstake in lithium",reuters
978,Pentagon sees China as 'growing risk' to U.S. defense industry,04/10/2018,U.S. manufacturing capabilities in things like lithium sea-water,reuters
979,"China's Tianqi can buy stake in lithium firm SQM, rules Chile court",04/10/2018,"miner to purchase a nearly one-quarter stake in lithium producer SQM regulators of any future, lithium-related deal struck with either SQM",reuters
980,China's Tianqi can purchase stake in lithium producer SQM -Chile antitrust court,04/10/2018,the Chinese miner to purchase a one-quarterstake in lithium producer SQM,reuters
981,China's Ganfeng Lithium prices HK listing at bottom of range - source,04/10/2018,"By Julia FiorettiHONG KONG, Oct 4 (Reuters) - China's top lithium producerGanfeng Lithium, a supplier to carmakers such asTesla and BMW",reuters
982,REFILE-Chile weighs arbitration with top lithium producer Albemarle,03/10/2018,"that oversees lithium mining in the country´s Atacamasalt flat will decide.-based miner coveted rights to extractlithium from the Salar, the world´s",reuters
983,Australia expects resource exports to hit record $182 billion in 2018-2019,02/10/2018,", the department offered an outlook for lithium, used to make lithium production.Australia's exports of spodumene, the raw material",reuters
984,RPT-UPDATE 1-Electric cars cast growing shadow on profits,02/10/2018,"also bring some relief. Butlithium-ion batteries, which claim 40 percent",reuters
985,Australia expects resource exports to hit record $182 bln in 2018-2019,01/10/2018,"to be major producer of battery-grade lithium in2020sBy Melanie Burton, the department offered an outlook forlithium, used to make batteries",reuters
986,Electric cars cast growing shadow on profits,01/10/2018,Economies of scale should also bring some relief. But lithium-ion,reuters
987,China battery firms set up $700 million nickel joint venture in Indonesia,28/09/2018,lithium battery maker Contemporary Amperex Technology Ltd (CATL,reuters
988,China battery firms set up $700 mln nickel joint venture in Indonesia,28/09/2018,The companies joining GEM include units of top Chineselithium battery,reuters
989,"METALS-Shanghai aluminium slips, heads for worst month since March",27/09/2018,"* LITHIUM: Albemarle Corp, the world's largestlithium producer, aims",reuters
990,Albemarle eyes future as pure-play lithium market leader,27/09/2018,"largest lithium producer, aims to eventually end its dependenceon two in an interview.Tesla Inc and other automakers have helped makelithium one",reuters
991,Foreign-backed miner hopes to begin Chilean lithium project in 2020,27/09/2018,Blancoexpects to begin construction on its lithium mining project level. It is ahighly prized deposit in the lithium triangle,reuters
992,"Brees nears NFL passing mark; Saints meet Manning, Giants",27/09/2018,"the lithium batteries out of his clock on the wall.At 37, New York",reuters
993,Chilean environmental authority approves largest desalination plant in Latin America,27/09/2018,"deposits of lithium, the ultra-light metal used in electric car batteries",reuters
994,Philippine inventor aims to cut travel times with passenger drone,26/09/2018,for the components of the single-seater powered by six lithium-ion,reuters
995,Exclusive: Portugal to launch tender of lithium exploration licenses this year,25/09/2018,intends to launch a tender of lithium exploration licenses by the end an expected surge in global demand for lithium as electric car sales grow. He,reuters
996,CANADA STOCKS-TSX higher as crude prices rise,24/09/2018,AuroraCannabis and Nemaska Lithium.* The TSX posted one new 52-week,reuters
997,"RPT-COLUMN-Nickel's ""electric premium"" crushed by trade tensions: Andy Home",18/09/2018,of a step-change inusage thanks to nickel's input into the lithium-ion,reuters
998,U.S. gives rare earths reprieve in revised $200 billion China tariff list,18/09/2018,"in steelmaking and lithium-ion batteries, also won a reprieve.Tungsten",reuters
999,"COLUMN-Nickel's ""electric premium"" crushed by trade tensions: Andy Home",18/09/2018,to nickel's input into the lithium-ion batterytechnology,reuters
1000,REFILE-U.S. gives rare earths reprieve in revised $200 bln China tariff list,18/09/2018,"andlithium-ion batteries, also won a reprieve.Tungsten, used to harden",reuters
1001,Solid demand to underpin lithium as price slides in 2018,17/09/2018,By Zandi ShabalalaLONDON (Reuters) - An oversupply of lithium has boosted prices for components of lithium-ion batteries including,reuters
1002,GRAPHIC-Solid demand to underpin lithium as price slides in 2018,17/09/2018,* Lithium prices decline in 2018: https://tmsnrt.rs/2N3g6cF* Lithium (Reuters) - An oversupply of lithium thisyear has nearly halved prices,reuters
1003,METALS-Base metal prices drop as spectre of new U.S. tariffs looms,17/09/2018,for copper and lithium minersoperating in the country to bolster,reuters
1004,METALS-Base metal prices slump as new U.S. tariff threat looms,16/09/2018,royalty payment for copper and lithium minersoperating,reuters
1005,"Chilean lawmakers study extra tax for copper, lithium mines",14/09/2018,"a proposalfor an additional royalty payment for copper and lithium oflithium.""The payments must be made annually by the respective",reuters
1006,China's squeezed 'teapots' eye petchem path to riches,14/09/2018,that makes electrolytes used in lithium batteries for electric vehicles,reuters
1007,"METALS-London copper slips, but headed for weekly gain as trade talks eyed",13/09/2018,between the United States andChina.* LITHIUM: Chilean lithium miner SQM,reuters
1008,Chile's lithium miner SQM asks court to reject Tianqi agreement,13/09/2018,By Fabian CamberoSept 13 (Reuters) - Chilean lithium miner SQM give it a coveted stake in one of the world’s topproducers of lithium,reuters
1009,"Japan's Sumitomo to focus on battery material supply to Panasonic, Toyota",13/09/2018,in Panasonic's lithium-ion battery that powers Tesla's Model 3 and Model X,reuters
1010,"Kidman, SQM may have to forfeit lithium mine after Australian gov't ruling",13/09/2018,"Holland lithium project after arecommendation by a unit of the West that since it onlyfound lithium after the period was up, it should",reuters
1011,France's Saft targets new generation battery production from 2020,12/09/2018,alliance to begin mass production of new generation lithium-ion in February to develop high-density liquidelectrolyte lithium-ion and solid,reuters
1012,"Savannah boosts Portugal lithium estimate, shares rise",10/09/2018,"' in European lithiumLONDON, Sept 10 (Reuters) - Savannah Resources said onMonday its Portuguese lithium resources were more than 40",reuters
1013,Chilean regulator says agreement reached with Tianqi on SQM stake sale,08/09/2018,FNE said on Friday it had reached an agreement with Tianqi Lithium Corp that would allow the Chinese miner to purchase a stake in top lithium,reuters
1014,Tianqi Lithium says will comply with Chilean regulator on SQM investment,07/09/2018,"BEIJING, Sept 8 (Reuters) - China's Tianqi Lithiumsaid on Saturday-trust regulator FNE regardingTianqi's purchase of a stake in lithium",reuters
1015,Zimbabwe's Mnangagwa names ex-banker Mthuli Ncube finance minister,07/09/2018,"and Mnangagwa has said the sector, which is attracting investors in lithium",reuters
1016,China to increase export tax rebates on 397 products,07/09/2018,"rebate rates for light-emitting diodes (LEDs), lithium batteries, multi",reuters
1017,Suzuki to start testing EV prototype in India from October: chairman,07/09/2018,of lithium-ion batteries for automobiles at its plant in western India from,reuters
1018,Suzuki to start testing EV prototype in India from Oct - chairman,07/09/2018,"-selling automaker, Maruti SuzukiLtd, would start production of lithium",reuters
1019,Exclusive: Lithium producer Albemarle eyes buying rival if IPO stumbles - source,05/09/2018,", the world's largest lithium producer, could buy FMC Corp's  division if the smaller rival's initial public offering stumbles",reuters
1020,South Korea's POSCO to invest $40 billion over next five years,03/09/2018,"won in new business sectors, including lithium batteries. In late August, POSCO sealed a deal to buy lithium mining rights",reuters
1021,S.Korea's POSCO plans to invest $40.4 bln over next five years,03/09/2018,", another 10 trillion wonin new business sectors including lithium batteries.In late August, POSCO sealed a deal to buy lithium miningrights",reuters
1022,Chile expects $65.75 billion investment in mining industry over 10 years,31/08/2018,"two new lithium mining projects, three copper and one gold, totalling",reuters
1023,Chile expects $65.75 bln investment in mining industry over 10 years,31/08/2018,", it referenced two new lithium miningprojects, three copper and one gold",reuters
1024,China's Ganfeng Lithium files for Hong Kong listing,30/08/2018,"HONG KONG, Aug 31 (Reuters) - China's Ganfeng Lithium Co Ltdhas for lithium as electric cars becomemore mainstream.Ganfeng",reuters
1025,RPT-FOCUS-Inside Albemarle's quest to reinvent the lithium market,30/08/2018,") - As global demand for lithium hitsoverdrive, Albemarle Corp demand more purified versions of lithium that canhelp boost electricity",reuters
1026,Inside Albemarle's quest to reinvent the lithium market,30/08/2018,"By Ernest Scheyder(Reuters) - As global demand for lithium hits to Tesla Inc, increasingly demand more purified versions of lithium",reuters
1027,FOCUS-Inside Albemarle's quest to reinvent the lithium market,30/08/2018,By Ernest ScheyderAug 30 (Reuters) - As global demand for lithium of lithium that canhelp boost electricity storage and increase a battery's,reuters
1028,"In Chilean desert, global thirst for lithium is fueling a 'water war'",29/08/2018,"of the world's current supply of lithium, the ultra-light metal used Corfo, which helps oversee lithium extraction in the Salar, hopes",reuters
1029,"REFILE-In Chilean desert, global thirst for lithium is fueling a 'water war'",29/08/2018,"current supply of lithium, the ultra-light metal used inelectric car helpsoversee lithium extraction in the Salar, hopes to provide",reuters
1030,Australia shares end up on hopes of easing trade tensions; glitch halts NZ,28/08/2018,to buy lithium mining rights inArgentina from the company.The rest,reuters
1031,Australian shares rise on hopes global trade gloom is easing; NZ edges up,27/08/2018,steelmaker POSCO signed a deal tobuy lithium mining rights owned,reuters
1032,POSCO buys lithium mining rights in Argentina from Australia's Galaxy,27/08/2018,Korean steelmaker POSCO has sealed a deal to buy lithium mining rights the Australian miner's funds to dig a lithium mine on neighbouring ground.POSCO,reuters
1033,Chile's SQM expects lithium prices to dip in second half,24/08/2018,) - Chilean lithium miner SQM saidit forecast lithium prices dropping lithium concentratebeing converted in China for use in car and cell phone,reuters
1034,RPT-Tipping point? Inflation creep at Australia's mines to erode margins,24/08/2018,"a source ofbattery materials like lithium, cobalt and nickel.BHP",reuters
1035,"CORRECTED-RPT-COLUMN-U.S. disrupts aluminium supply chain, but not where it counts: Andy Home",24/08/2018,they need for thelithium-ion batteries that will drive the electric,reuters
1036,"CORRECTED-COLUMN-U.S. disrupts aluminium supply chain, but not where it counts: Andy Home",24/08/2018,for thelithium-ion batteries that will drive the electric vehicle,reuters
1037,Tipping point? Inflation creep at Australia's mines to erode margins,24/08/2018,"of battery materials like lithium, cobalt and nickel. For a graphic",reuters
1038,Exclusive: Chile says to clamp down on water rights in lithium-rich Salar de Atacama,23/08/2018,"the lithium-rich Salar de Atacama salt flats, home to top lithium miners the area of the salt flat where the lithium miners operate was not currently",reuters
1039,China's Tianqi Lithium files for $1 billion Hong Kong listing: sources,20/08/2018,"Lithium Corp <002466.SZ> is looking to raise up to $1 billion in lithium prices, two people close to the deal told Reuters.The company",reuters
1040,"METALS-London copper ticks above $6,000 a tonne as dollar slips",20/08/2018,"by robust oil and base metals prices. * LITHIUM: China's Tianqi Lithium stock marketflotation, despite this year's fall in lithium prices, two",reuters
1041,China's Tianqi Lithium seeks up to $1 billion in Hong Kong listing - sources,20/08/2018,"HONG KONG, Aug 20 (Reuters/IFR) - China's Tianqi LithiumCorp, despite this year's fall inlithium prices, two people close",reuters
1042,METALS-London copper rises on hopes of U.S.-China trade progress,20/08/2018,"copper mine, easing supply concerns.* BATTERIES: China's largest lithium",reuters
1043,METALS-London copper up on hopes of U.S. China trade progress,20/08/2018,* BATTERIES: China's largest lithium battery makerContemporary Amperex,reuters
1044,METALS-London copper climbs on hopes of U.S. China trade progress,19/08/2018,lithium battery makerContemporary Amperex Technology Ltd plans to begin,reuters
1045,China's CATL to start producing next-gen low-cobalt batteries in 2019: source,17/08/2018,lithium battery maker Contemporary Amperex Technology Ltd (CATL) plans stabilizes and extends the life of lithium-ion rechargeable batteries,reuters
1046,China's CATL to start producing next-gen low-cobalt batteries in 2019 -source,17/08/2018,"largest lithium batterymaker Contemporary Amperex Technology Ltd (CATL, which stabilises and extends thelife of lithium-ion rechargeable",reuters
1047,RPT-COLUMN-Nickel is dancing to a new electric (vehicle) beat: Andy Home,15/08/2018,vehicle (EV) revolution. Both are keyinputs to most types of lithium-ion,reuters
1048,Nickel is dancing to a new electric (vehicle) beat: Andy Home,15/08/2018,to most types of lithium-ion battery.It may seem premature for nickel,reuters
1049,COLUMN-Nickel is dancing to a new electric (vehicle) beat: Andy Home,15/08/2018,) revolution. Both are keyinputs to most types of lithium-ion battery.It may,reuters
1050,China's Ganfeng buys SQM's stake in lithium project for $87.5 mln,13/08/2018,"lithium producers, said on Monday that itagreed to sell its 50 Lithium for$87.5 million.The deal also stipulates that Ganfeng",reuters
1051,"Peru president expects lithium, uranium mining laws passed in 6 months",10/08/2018,"six months needed to tap a new lithium and uraniumdeposit, removing of high-grade lithium resources and 124 million pounds ofuranium",reuters
1052,Australian miners steam ahead with lithium exploration,09/08/2018,"are ramping up exploration for lithium even as prices dip, betting on renewed miners' enthusiasm for lithium projects appears undimmed by sliding",reuters
1053,Chile's SQM says to overtake Albemarle as world's top lithium producer by 2022,08/08/2018,"producer of lithium by 2022, boosting its production capacity that year at a Santiago forum on lithium that capacity increases at its Chile",reuters
1054,Albemarle boosts stock buyback to $500 million; shares jump,08/08/2018,"producer of the electric car battery ingredient lithium, said belief that demand for battery-grade lithium will continue to spike",reuters
1055,"CORRECTED-Wages, activity pick up in Australia's iron ore heartland",07/08/2018,for lithium. It is focused ondriving down costs to offset emerging signs,reuters
1056,"METALS-Copper gains as dollar rally wanes, nickel at 1-week high",07/08/2018,if it hoped to avoid a strike.* LITHIUM: Chile's exports of lithium carbonate,reuters
1057,Albemarle quarterly profit nearly triples on strong lithium sales,07/08/2018,"(Reuters) - Albemarle Corp, the world's largest producer of lithium",reuters
1058,Chile lithium exports more than double in July from previous year,07/08/2018,"SANTIAGO, Aug 7 (Reuters) - Chile's exports of lithiumcarbonate producers of lithium, jumped 51 percent in the firstseven months",reuters
1059,"BHP boosts nickel mining, exploration investment amid electric vehicle boom",07/08/2018,"nickel, manganese and cobalt (NMC) lithium-ion batteries typically employ",reuters
1060,Indian company to produce thermal batteries from next year,06/08/2018,"storage devices, whichit says last longer than lithium ion batteries",reuters
1061,Nissan agrees to sell car battery unit to China's Envision Group,03/08/2018,"), as it looks beyond its unit to procure low-cost, high performing lithium",reuters
1062,China M&A picks up – for now,03/08/2018,"example, privately owned TianqiLithium is raising a US$3.5bn term loan yMinera de Chile, the world's second-largest lithium producer.Other",reuters
1063,Battery boom skeptics seen driving short holdings in lithium miners,03/08/2018,"in lithium miners SQM, Albemarle, Galaxy and Orocobre has ballooned there’s a bit of oversupply, the price of lithium could fall,"" said Darko",reuters
1064,GRAPHIC-Battery boom sceptics seen driving short holdings in lithium miners,03/08/2018,"of shares inlithium miners SQM, Albemarle, Galaxyand Orocobre has balloonedthere’s a bit of oversupply, the price of lithium could fall,""said Darko",reuters
1065,FMC says lithium pricing rising on strong electric car demand,02/08/2018,"its lithium division as a publicly traded company later thisyear worries about oversupply in the lithiumsector, with several new",reuters
1066,Belgium's Umicore plans to ramp up EV battery recycling capacity: CEO,02/08/2018,cash-settled contracts for lithium and cobalt by the London Metal,reuters
1067,Belgium's Umicore plans to ramp up EV battery recycling capacity - CEO,02/08/2018,to launch cash-settled contractsfor lithium and cobalt by the London,reuters
1068,FMC's quarterly profit nearly doubles as lithium sales jump,01/08/2018,"lithium division as a publicly traded companylater this year, posted assets from DowDuPont Inc, as wellas surging lithium sales.(Reporting",reuters
1069,Battery chemical surplus sparks plunge in cobalt price,31/07/2018,"the life of lithium-ion rechargeable batteries. However, such a shift unable to restock until they were paid by their customers in the lithium",reuters
1070,"RPT-COLUMN-BHP, Rio deals show lack of options beyond shareholder returns: Russell",31/07/2018,"metals likelithium and cobalt, it's likely that eventually investors",reuters
1071,GRAPHIC-Battery chemical surplus sparks plunge in cobalt price,31/07/2018,"and extends the life oflithium-ion rechargeable batteries. However in thelithium-ion battery sector.""It could be a few months between refiners",reuters
1072,"How U.S. tariffs on China minerals could hurt industry, consumers",31/07/2018,"as anode material for lithium-ion batteries, natural graphite",reuters
1073,"COLUMN-BHP, Rio deals show lack of options beyond shareholder returns: Russell",31/07/2018,headlong into new mining areas such as battery metals likelithium,reuters
1074,"GRAPHIC-How U.S. tariffs on China minerals could hurt industry, consumers",31/07/2018,"as anode material forlithium-ion batteries, natural graphite",reuters
1075,Chile says lithium miner Albemarle slow to respond on contract details,30/07/2018,government said on Monday that lithium miner Albemarle had been slow.The contract allows Albemarle to produce lithium on land owned,reuters
1076,"New MH370 probe shows controls manipulated, but mystery remains unsolved",30/07/2018,"in the on-board cargo, which included items like lithium batteries",reuters
1077,Part-owner of Chile lithium producer SQM sells $275 mln bond,27/07/2018,"stake in lithium producer SQM, said it sold bonds in the local market producers of lithium, akey mineral for electric car batteries. Ponce",reuters
1078,Brazil mining reforms stalled by impasse over new agency,27/07/2018,"and is at the discretion of the Senate.Ana Cabral-Gardner, co-chairman of Sigma Lithium Resources Corp, which mines lithium in Brazil, said enactment",reuters
1079,CORRECTED-CEO of Chilean lithium miner SQM resigns,26/07/2018,"Jara and Aislinn LaingSANTIAGO, July 25 (Reuters) - Chilean lithium lithium producers forthree years and with the company for 30 years",reuters
1080,CORRECTED-Outgoing Albemarle executive to join Chilean cobalt miner,26/07/2018,"Albemarle's lithium business since2015, will join Genlith's Chilean.Mitchell's exit from Albemarle, the world's largest lithiumproducer",reuters
1081,China launches pilot EV battery recycling schemes,25/07/2018,"lithium battery waste could reach around 170,000 tonnes by 2020",reuters
1082,Japan aluminum industry worried about U.S. automobile import tariffs,25/07/2018,for aluminum foils used in package of automotive lithium-ion battery,reuters
1083,Japan aluminium industry worried about U.S. automobile import tariffs,25/07/2018,foils used in package of automotivelithium-ion battery is also,reuters
1084,Tianqi board backs major expansion at Australian lithium mine,25/07/2018,MELBOURNE (Reuters) - Tianqi Lithium Corp said its board has approved the planned expansion of lithium production at the Greenbushes mine,reuters
1085,Exclusive: Albemarle lithium chief to exit at end of July - memo,24/07/2018,"overseeing the company's massive lithium operations, a key supplier is the world's largest lithium producer and its annual lithium sales have",reuters
1086,Japan takes steps to ensure stable cobalt supply for automakers,24/07/2018,"of cobalt, a key component of lithium-ion batteries used in electric cars",reuters
1087,India cuts sales tax across sectors to ease pain of traders and consumers,21/07/2018,"on lithium ion batteries was cut from 28 percent to 18 percent.""The decision",reuters
