,headline,date,snippet,source
1745,Nissan to sell its electric battery business to GSR Capital,08/08/2017,"Y Minera (SQM), one of the world's biggest lithium producers, Reuters, making battery and lithium producers attractive assets for Chinese",reuters
1746,"Chileans want change, says presidential hopeful Guillier",08/08/2017,"lithium to foreign companies prepared to invest in next-generation lithium technology within Chile as something he was watching ""with a lot",reuters
1747,"REUTERS SUMMIT-Chileans want change, says presidential hopeful Guillier",08/08/2017,cheaper lithium to foreign companies prepared to investin next-generation lithium technology within Chile as somethinghe was watching,reuters
1748,BRIEF-Electrovaya says to receive C$3.8 mln from Sustainable Development Technology Canada,08/08/2017,-lasting lithium ionceramic batteries for commercial vehicles​Source,reuters
1749,Chile short-lists seven companies for value-added lithium projects,08/08/2017,"companies to develop value-added lithium projects in the country, state ""lithium triangle,"" home to more than half the known global reserves",reuters
1750,Mazda announces breakthrough in long-coveted engine technology,08/08/2017,reported that it would start producing a lithium battery that would,reuters
1751,BRIEF- Nissan Motor says business transfer and to sell unit,08/08/2017,"lithium-ion battery business concerned product development,technology",reuters
1752,Nikkei falls after exporters drop but steel shares hit 5-month high,08/08/2017,the company willbegin mass-producing as early as in 2020 a lithium,reuters
1753,Nikkei falls on weak financials but steel shares hit 5-month high,07/08/2017,as in 2020 a newlithium-ion battery that would double the range of electric,reuters
1754,GS Yuasa to double EV range with new battery from 2020: Nikkei,07/08/2017,as early as in 2020 a new lithium-ion battery that would double the range,reuters
1755,GS Yuasa to double EV range with new battery from 2020 - Nikkei,07/08/2017,-producing as early as in 2020 a new lithium-ionbattery that would double,reuters
1756,Chile expects sharp increase in mine investment over 10 years,07/08/2017,"of lithium, which is currently experiencing a boomdue in part to its",reuters
1757,Lithium processors prepare to meet demand in era of electric car,07/08/2017,of processed lithium - an essential element for batteries used for battery-grade lithium compounds is expected to skyrocket in the next,reuters
1758,REFILE-Lithium processors prepare to meet demand in era of electric car,07/08/2017,(Reuters) - Producers of processed lithium -an essential element shortfall.Demand for battery-grade lithium compounds is expected,reuters
1759,BRIEF-Lithium Exploration Group in discussions to restructure all convertible debt,04/08/2017,Aug 4 (Reuters) - Lithium Exploration Group Inc* Lithium Exploration,reuters
1760,Asian battery makers eye nickel top-up as cobalt price bites,03/08/2017,are prompting Asia's top battery makers to tweak the recipe for lithium) lithium-ion batteries typically employ a ratio of 60 percent nickel,reuters
1761,BRIEF-Power Metals and MGX Minerals form partnership over lithium portfolio,02/08/2017,Minerals Inc form accretivepartnership over lithium portfolio* XMG,reuters
1762,BRIEF-FMC Q2 adjusted earnings per share $0.48,01/08/2017,"ReutersI/B/E/S* FMC Lithium reported q2 segment revenue of $74 million 1, 2017​* Says FMC Lithium segment revenue for full year of 2017",reuters
1763,BRIEF-Wealth signs letter agreement to acquire interest in ‘Seven Salars’ lithium project in Chile,01/08/2017,to acquire interest in‘Seven Salars’ lithium project in Chile,reuters
1764,BRIEF-LSC Lithium announces private placement & operational changes,28/07/2017,July 28 (Reuters) - LSC Lithium Corp* LSC Lithium announces private,reuters
1765,"KKR to set up auto parts JV with South Korea's LS Group, buy materials business",27/07/2017,lithium-ion batteries used in electric vehicles. KKR will own a 47,reuters
1766,KKR to acquire auto assets from S. Korea's LS Group for $943 mln,27/07/2017,foils for large capacity lithium-ionbatteries used in electric vehicles,reuters
1767,BUZZ-Japan mining industry head says unclear if copper rally will continue,27/07/2017,"demand forlithium-ion batteries used to power EVs is expected to tightensupply of lithium, nickel and cobalt - Nakazato* Britain",reuters
1768,BRIEF-Southern Lithium announces non-brokered private placement,26/07/2017,July 26 (Reuters) - Southern Lithium Corp* Southern Lithium announces non-brokered private placement* Southern Lithium Corp - Will issue,reuters
1769,BRIEF-Nemaska Lithium receives final milestone payment from Johnson Matthey,26/07/2017,July 26 (Reuters) - Nemaska Lithium Inc* Nemaska Lithium receives of battery grade lithiumhydroxide from phase 1 plant* Johnson Matthey,reuters
1770,Brazil hikes mining royalties to ease budget deficit,25/07/2017,"environment, said Ana Cabral-Gardner, a board member at miner Sigma Lithium",reuters
1771,BRIEF-LSC Lithium reports CEO resignation,25/07/2017,July 25 (Reuters) - LSC Lithium Corp:* LSC Lithium announces CEO resignation and appointment ofinterim CEO* LSC Lithium Corp,reuters
1772,"Toyota set to sell long-range, fast-charging electric cars in 2022: paper",25/07/2017,"), which use lithium-ion batteries, need 20-30 minutes to recharge even utility vehicle and use lithium-ion batteries.Other automakers",reuters
1773,BRIEF-Nouveau Monde signs non-binding LOI with Hunan Zhongke Shinzoom Co,25/07/2017,materials to lithium batterymanufacturers in north america* Nouveau,reuters
1774,"Toyota set to sell long-range, fast-charging electric cars in 2022 -paper",24/07/2017,"quickly than lithium ion batteries, Japan's top automaker would lithium-ion batteries, which power mostEVs today.Other automakers",reuters
1775,CANADA STOCKS-Futures edge higher as oil rallies,24/07/2017,"ratingto ""neutral"" from ""underperform""Lithium Americas Corp: National",reuters
1776,BRIEF-Henan Yicheng New Energy and unit receive special funds for transformation and upgrading use,21/07/2017,graphite negative electrode material forlithium ion battery project* Says its unit receives supporting fund of 8.7 million yuanfor lithium,reuters
1777,Lithium supply pipeline is filling but will it be enough? Andy Home,20/07/2017,"lithium, and lithium in the right chemical composition, to support lithium prices went ballistic and the rest of the world outside what",reuters
1778,CORRECTED-RPT-COLUMN-Lithium supply pipeline is filling but will it be enough? Andy Home,20/07/2017,"in South America.Simply put, will there be enough lithium, and lithium in theright chemical composition, to support exponentially growing",reuters
1779,CORRECTED-COLUMN-Lithium supply pipeline is filling but will it be enough? Andy Home,20/07/2017,"in South America.Simply put, will there be enough lithium, and lithium in theright chemical composition, to support exponentially growing",reuters
1780,BRIEF-Rock Tech lithium welcomes Peter Kausch to its board,18/07/2017,July 18 (Reuters) - Rock Tech Lithium Inc* Rock Tech Lithium,reuters
1781,BRIEF-Electrovaya completes first commercial delivery of replacement Forklift lithium ion ceramic batteries,18/07/2017,commercial delivery ofreplacement Forklift lithium ion ceramic,reuters
1782,BRIEF-Guangzhou Pearl River Industrial Development signs agreement with China Molybdenum,17/07/2017,resources such as cobalt and lithiumSource text in Chinese: https,reuters
1783,BRIEF-Electrovaya sells lithium ion cells to European electric vehicle producer,13/07/2017,July 13 (Reuters) - Electrovaya Inc* Electrovaya sells lithium ion order* Has sold Euro 1 million of lithium ion cells for electric,reuters
1784,BRIEF-Millennial Lithium announces commencement of co's phase 1 drill program in Argentina,12/07/2017,"July 12 (Reuters) - Millennial Lithium Corp:* Announces commencement of co's phase 1 drill program at9,000 hectare cruz lithium project",reuters
1785,China could field nearly half of new electric car models by 2020: study,12/07/2017,to have nearly two-thirds of the world's manufacturing capacity for lithium,reuters
1786,China could field nearly half of new electric car models by 2020 - study,12/07/2017,"for lithium-ion batteries by 2021, and is investing to supportcurrent",reuters
1787,BRIEF-Guangdong Zhengye Technology sees H1 FY 2017 net profit up 303.56 pct to 333.56 pct,11/07/2017,of lithiumbattery business as well as contribution from subsidiaries,reuters
1788,AES and Siemens create joint-venture for energy storage,11/07/2017,"Fluence, will sell the lithium-ion battery technologies currently sold",reuters
1789,Tesla wades into Australia's battle over energy future: Russell,10/07/2017,", if successful, the 100 MW of Tesla lithium-ion batteries will be able",reuters
1790,Chile receives 12 bids for value-added lithium projects,10/07/2017,"countries have applied to manufacture lithium-linked products in Chile of South America's ""lithium triangle,"" home to more than half",reuters
1791,RPT-COLUMN-Tesla wades into Australia's battle over energy future: Russell,10/07/2017,"of Tesla lithium-ionbatteries will be able to provide power to some 30,000",reuters
1792,COLUMN-Tesla wades into Australia's battle over energy future: Russell,10/07/2017,"Certainly, if successful, the 100 MW of Tesla lithium-ionbatteries",reuters
1793,"Tesla wins giant battery contract in Australia, has 100-day deadline",07/07/2017,", trumped dozens of competing proposals to build the gigantic lithium elaborating.It will be the largest lithium-ion battery storage project",reuters
1794,"Exclusive: Glencore makes large cobalt deal, securing EV battery supplies for VW",06/07/2017,"ingredient in the lithium-ion batteries used to power electric vehicles (EVs a graphic on projected growth of lithium-ion batteries, click http://tmsnrt.rs",reuters
1795,METALS-London copper steadies near one-week low as dollar eases,05/07/2017,"lithium producers,according to two sources with knowledge of the matter",reuters
1796,RPT-COLUMN-Psstwanna buy some cobalt? Just don't tell the auto guys!: Andy Home,05/07/2017,"of the hottestcommodities in town?No, it's not lithium. That's sohappened to lithium prices a year or so ago.The linkage is both metals",reuters
1797,Psstwanna buy some cobalt? Just don't tell the auto guys!: Andy Home,05/07/2017,"commodities in town? No, it's not lithium. That's so much last year's to lithium prices a year or so ago. The linkage is both metals' evolution",reuters
1798,BRIEF-Lithium Americas provides Cauchari-Olaroz development update,05/07/2017,"July 5 (Reuters) - Lithium Americas Corp* Lithium Mmericas provides stage of 25,000 tonnes per annum oflithium carbonate production capacity",reuters
1799,COLUMN-Psstwanna buy some cobalt? Just don't tell the auto guys!: Andy Home,05/07/2017,"of the hottestcommodities in town?No, it's not lithium. That's sohappened to lithium prices a year or so ago.The linkage is both metals",reuters
1800,BRIEF-Macarthur Minerals withdraws prospectus for ASX IPO of Macarthur Australia,05/07/2017,"will continue toadvance Macarthur Australia Lithium And Iron Ore Projects, aswell as its Nevada lithium projectsSource text for Eikon:Further company coverage:",reuters
1801,Exclusive: China's GSR eyes substantial stake in $9 billion Chilean lithium miner SQM - sources,05/07/2017,"biggest lithium producers, according to two sources with knowledge of established lithium miners globally and a Chinese investment would go hand",reuters
1802,"BRIEF-Southern Lithium is granted permit to drill Cruz Property, Salta Argentina",04/07/2017,July 4 (Reuters) - Southern Lithium Corp :* Southern Lithium,reuters
1803,Fitch Affirms Panasonic's Ratings at 'BBB'; Outlook Stable,03/07/2017,"(such as, lithium-ion battery)- EBIT margin to stay around 4%-5% in the short",reuters
1804,BRIEF-LSC Lithium acquires Lithea and its salar de pozuelos tenements in Northern Argentina,30/06/2017,June 30 (Reuters) - LSC Lithium Corp:* LSC Lithium acquires lithea Lithium Corp says aggregate purchase price was paid byissuance of 31.2,reuters
1805,BRIEF-Lithium Americas Says Gary Cohn appointed independent director,30/06/2017,June 30 (Reuters) - Lithium Americas Corp* Lithium americas appoints independent director* Lithium americas appoints independent director,reuters
1806,BRIEF-Lithium X to buy Aberdeen interest to consolidate Sal De Los Angeles project ownership,29/06/2017,June 29 (Reuters) - Lithium X Energy Corp:* Lithium X to acquire project* Lithium X Energy - ‍signed agreement with Aberdeen,reuters
1807,Nornickel bets on battery materials as electric car sales rise,29/06/2017,"to make lithium-ion batteries, in Europe, as the car industry's push",reuters
1808,BRIEF-Aberdeen agrees to sell remaining plasa investment to Lithium X,29/06/2017,"to sell remaining plasa investment toLithium X* Aberdeen International - In consideration for acquiring50% of plasa held by co, Lithium X",reuters
1809,CORRECTED-German stocks - Factors to watch on June 28,28/06/2017,Nickel on supplies of raw materials needed for makinglithium-ion batteries,reuters
1810,Russia's Nornickel in talks to supply materials for BASF's battery plans,27/06/2017,BASFn.DE> to supply raw materials needed in the process for making lithium for metals needed for lithium-ion batteries production as the car industry's,reuters
1811,Australia backs lithium mine to spur battery push,27/06/2017,"(Reuters) - The Australian government will invest in a lithium mine in Western Australia, which will produce lithium concentrate, a key",reuters
1812,REFILE-Cobalt 27 aims to tap electric car revolution with $150 mln IPO,23/06/2017,"in lithium-ion batteries used to power electricvehicles, which this year.""Commodity markets in the lithium battery supply chain would",reuters
1813,Canada's First Cobalt braves political risk to pile in to Congo,23/06/2017,"""Demand for the metal, a key component in the lithium-ionbatteries",reuters
1814,BRIEF-Nemaska Lithium obtains receipt for its offering of 47.6 mln shares,22/06/2017,June 22 (Reuters) - Nemaska Lithium Inc-* Nemaska Lithium,reuters
1815,BRIEF-Standard Lithium raises $7.4 million in oversubscribed financing,22/06/2017,June 22 (Reuters) - Standard Lithium Ltd:* Standard Lithium raises,reuters
1816,BRIEF-Uranium Resources continues lithium business expansion,20/06/2017,"continues lithium business expansion* Uranium Resources says acquired third lithium explorationproject, through staking of 9,270 acres of federal",reuters
1817,Politics of Death: Body count mounts in worldwide wars over land,19/06/2017,"'tech metals', including lithium, cobalt, cadmium and rhodium.Generally. In the first months of 2016, lithium prices trebled after electric car",reuters
1818,BRIEF-Nanfang Black Sesame to invest 300 mln yuan in lithium battery firm with partners,19/06/2017,to invest 300 million yuan ($44.02 million)in lithium battery firm,reuters
1819,China removes 27 restrictions for foreign investment in free-trade zones,16/06/2017,"such as precious metals and lithium mining, as well as internet",reuters
1820,Australian lithium miner Neometals plans U.S listing,15/06/2017,(Reuters) - Australian lithium minerNeometals plans to list in New of lithium producers are volatile becauseof uncertainty surrounding supply,reuters
1821,"Demand, not supply, is the great unknown for lithium and cobalt: Andy Home",15/06/2017,Battery materials such as lithium and cobalt are already bubbling difficult. VOLATILITY AHEADMetals such as cobalt and lithium find,reuters
1822,BRIEF-Cervantes and European Lithium sign Paynes Find Gold Project deal,14/06/2017,entered into with EuropeanLithium announced on 22nd Dec 2016 has been,reuters
1823,"RPT-COLUMN-Demand, not supply, is the great unknown for lithium and cobalt: Andy Home",14/06/2017,ofmultiple metals over the coming years.Battery materials such as lithium difficult.VOLATILITY AHEADMetals such as cobalt and lithium find,reuters
1824,"COLUMN-Demand, not supply, is the great unknown for lithium and cobalt: Andy Home",14/06/2017,Battery materials such as lithium and cobalt are alreadybubbling such as cobalt and lithium find themselves on thefront-line,reuters
1825,BRIEF-Standard Lithium receives orders of $6.5 mln for financing,14/06/2017,June 14 (Reuters) - Standard Lithium Ltd* Standard Lithium receives orders of $6.5 million forfinancing* Standard Lithium ‍received,reuters
1826,BRIEF-Nemaska Lithium announces bought deal public offering of common shares,12/06/2017,June 12 (Reuters) - Nemaska Lithium Inc* Nemaska lithium announces update* Nemaska lithium inc - underwriters have agreed to purchase,reuters
1827,Miners eye Europe's largest lithium deposit in Czech Republic,08/06/2017,"for lithium could start in the Czech Republic in two years, exploiting Europe's percent of the global lithium stock, according to the Czech Geological",reuters
1828,"BRIEF-Lithium Americas appoints Wang Xiaoshen, Jonathan Evans as independent directors",08/06/2017,June 8 (Reuters) - Lithium Americas Corp:* Lithium Americas Corp directors* Lithium Americas Corp says Wang was appointed to board,reuters
1829,RPT-Renault plans foray into energy market with mega battery,08/06/2017,"to benefit from the creationof a market for used lithium-ion batteries and Vattenfall, in which the luxuryautomaker will deliver up to 1,000 lithium-ion",reuters
1830,Czech Republic - Factors To Watch on June 8,08/06/2017,=========================NEWS=================================== LITHIUM: Mining for lithium could start in the CzechRepublic in two years,reuters
1831,RPT-Miners eye Europe's largest lithium deposit in Czech Republic,08/06/2017,"of global lithium resources* European Metals aims to start mining in 2019* Lithium demand seen surging, mainly due to electric cars",reuters
1832,U.S. might expand laptop ban to 71 airports: Homeland Security,07/06/2017,on Wednesday said lithium ion batteries on airplanes can be a problem was diverted to Michigan because of a lithium battery fire from,reuters
1833,U.S. might expand laptop ban to 71 airports -Homeland Security,07/06/2017,on Wednesday said lithium ion batteries on airplanes canbe a problem wasdiverted to Michigan because of a lithium battery fire from apassenger laptop in the airplane cabin.,reuters
1834,Risk of heart defect in babies of women on lithium is less than thought,07/06/2017,"By Gene Emery(Reuters Health) - One risk of taking lithium of Medicine.""Lithium was not significantly associated with cardiac",reuters
1835,Renault plans foray into energy market with mega battery,07/06/2017,"the creation of a market for used lithium-ion batteries that can no longer will deliver up to 1,000 lithium-ion batteries to the Swedish utility",reuters
1836,Laptop ban tied to fear of direct detonation: United CEO,05/06/2017,Travel Association's annual meeting said the risk of lithium batteries,reuters
1837,Laptop ban tied to fear of direct detonation -United CEO,05/06/2017,Association's annual meeting said the risk of lithium batteries,reuters
1838,BRIEF-NRG Metals to acquire Hombre Muerto North Lithium Project adjacent to Lithium Production,05/06/2017,the hombre muerto northlithium project adjacent to lithium production,reuters
1839,BRIEF-Wealth Minerals signs LOI with Atacama Lithium Chile for option to buy mining project,05/06/2017,"geophysical results at LagunaVerde lithium project, Chile* Signed LOI with Atacama Lithium Chile SPA in connectionwith grant of option",reuters
1840,"BRIEF-Fdg Kinetic says unit, Chongqing New Energy Vehicles Financial Leasing enter finance lease agreement",05/06/2017,June 5 (Reuters) - Fdg Kinetic Ltd* Fdg Kinetic (Chongqing) Lithium,reuters
1841,BRIEF-Volt Energy acquires Lac Saint Simon lithium property,05/06/2017,"Simon lithium property* For purchase of 100% of Lac Saint Simon lithium property,Volt will issue 2.5 million common shares to PUF",reuters
1842,"RPT-Laptop ban, protectionism hang over booming air travel industry",02/06/2017,European regulators in citing thefire risks of having many lithium,reuters
1843,"Laptop ban, protectionism hang over booming air travel industry",02/06/2017,"many lithium-powered devices in the hold.""We recognize the (security",reuters
1844,BRIEF-Liberty One Lithium appoints Patrick Whibley to board,30/05/2017,May 30 (Reuters) - Liberty One Lithium Corp* Liberty One Lithium,reuters
1845,New projects spur rebound in Chilean mining jobs - recruiter,29/05/2017,"The country also mines gold,molybdenum, lithium and other minerals Quebrada Blanca phase two, said Cruz.The lithium boom in Chile has also",reuters
1846,India's electric vehicles push likely to benefit Chinese car makers,23/05/2017,($180 million) to set up a lithium ion battery plant in India which,reuters
1847,"U.S., EU meet on aviation security as Europe braces for laptop ban",23/05/2017,numbers of devices with lithium-ion batteries in the hold.The EU fears,reuters
1848,BRIEF-Macarthur Minerals locates further lithium in Nevada,23/05/2017,locates further lithium in Nevada inthe basin adjacent to Clayton Valley with surface grades up to187 ppm lithium and provides an update,reuters
1849,BRIEF-Millennial enters into property option agreement with Liberty One Lithium,23/05/2017,May 23 (Reuters) - Millennial Lithium Corp* Millennial enters,reuters
1850,"CORRECTED-BRIEF-Flux Power Holdings Q3 revenue $306,000 (May 15)",22/05/2017,Holdings Inc* Flux Power doubles sales of lithium-ion forklift batteries,reuters
1851,Germany must invest to keep up in electric cars: Merkel,22/05/2017,million euros in its second factory there for lithium batteries about the latest lithium cells which could allow cars to travel up,reuters
1852,Germany must invest to keep up in electric cars - Merkel,22/05/2017,around 500 million euros inits second factory there for lithium briefed about the latest lithiumcells which could allow cars to travel,reuters
1853,BRIEF-Magnis Resources says lithium-ion battery manufacturing planned in New York,21/05/2017,15gwh lithium-ion batterymanufacturing plant will make use of existing of a joint manufacturing establishmentagreement for a 15gwh lithium,reuters
1854,"CANADA STOCKS-TSX rises, energy leads broad rally as oil climbs",19/05/2017,stake in the Chilean lithiumproducer.Canadian National Railway Co,reuters
1855,"CANADA STOCKS-TSX rises broadly as banks, resources lead rally",19/05/2017,in the Chilean lithiumproducer.Canadian National Railway Co rose 1.1,reuters
1856,SQM governance changes no signal of Potash Corp interest in bigger stake: CEO,18/05/2017,"lithium producer SQM, which give shareholder Potash Corp of Saskatchewan at the global supplier of lithium, a move that will see controlling",reuters
1857,Potash CEO says SQM governance changes no signal of Potash interest in raising stake-CEO,18/05/2017,"NEW YORK, May 18 (Reuters) - Governance changes at Chilelithium",reuters
1858,"Daimler, Vivint Solar in exclusive deal on U.S. home batteries",18/05/2017,"is small, but growing rapidly as the costs of lithium-ion batteries fall",reuters
1859,SQM says to expand lithium production as demand grows,18/05/2017,to expand its production of critical rechargeablebattery ingredient lithiumreserves in the so-called 'lithium triangle' in Chile andArgentina,reuters
1860,"U.S., EU to meet next week in Washington to discuss aviation threats",17/05/2017,with lithium-ion batteries in the hold. EU officials have also asked,reuters
1861,Airlines group urges alternatives to extending electronics ban,17/05/2017,numbers of devices with lithium-ion batteries in the hold. EU officials have would also avoid the concentration of lithium battery-powered devices,reuters
1862,Expansion of ban on larger electronics on airlines likely: U.S,16/05/2017,' concerns is the fire risk from placing hundreds of devices with lithium to ensure lithium batteries stored in holds do not explode in midair,reuters
1863,MINOR METALS-Vanadium prices hit 4-year high on supply crunch,16/05/2017,lithiumbatteries in terms of grid storage.There is a current shift,reuters
1864,"U.S., EU to meet on airline security on Wednesday: EU Commission",15/05/2017,"placing hundreds of devices with lithium-ion batteries in the hold lithium batteries, whether in cargo or personal belongings or built",reuters
1865,Swiss stocks - Factors to watch on May 15,15/05/2017,"System, a modular, Lithium-ion batterysystem designed to reduce marine",reuters
1866,"U.S., EU set meeting on airline security, electronic devices",12/05/2017,"from poorly deactivated lithium-ion batteries.The EU said ""presents an increased safety risk to the aircraft, due to the lithium",reuters
1867,Bushveld says vanadium mine buy transformational in rising market,12/05/2017,"of batteries, which advocates say has advantages over lithium for grid storage have thrown their weight behind vanadium rather than lithium",reuters
1868,BRIEF-Lithium battery materials provider Ningbo Shanshan elects chairman,12/05/2017,May 12 (Reuters) - Ningbo Shanshan Co Ltd* Says board elects Zhuang Wei as chairmanSource text in Chinese: http://bit.ly/2pETNKGFurther,reuters
1869,U.S. airlines meet with Homeland Security on expanding laptop ban,12/05/2017,and is reviewing how to ensure lithium batteries stored in luggage do,reuters
1870,EU demands urgent talks with Washington over airline laptop ban,11/05/2017,by increasing the risk of fire from poorly deactivated lithium-ion,reuters
1871,Thursday Morning Briefing,11/05/2017,"countries, but is reviewing how to ensure lithium batteries stored",reuters
1872,BRIEF-Pure Energy enters agreements with Lithium X,11/05/2017,"agreements with Lithium X to expandClayton Valley properties and receive to investment, LithiumX will acquire units at a price of $0.56 per",reuters
