headline,date,stock
Chemical Industry on Solid Footing: Stocks Worth a Look,2017-11-09 00:00:00,ALB
"Harvey Capital Management Inc Buys DowDuPont Inc, Albemarle Corp, Oracle Corp, Sells Otonomy ...",2017-11-08 00:00:00,ALB
Beyond Tesla: 2 Lithium Stocks to Buy Now,2017-11-07 00:00:00,ALB
More Stable Li-ion Batteries Could Mean Even Greater Demand for Lithium,2017-11-07 00:00:00,ALB
"Strategic Financial Services, Inc, Buys iShares Core MSCI EAFE, iShares Intermediate ...",2017-11-06 00:00:00,ALB
Can Albemarle (ALB) Beat Q3 Earnings on Lithium Strength?,2017-11-06 00:00:00,ALB
"Grandfield & Dodd, Llc Buys Weyerhaeuser Co, US Bancorp, M&T Bank Corp, Sells Emerson ...",2017-11-03 00:00:00,ALB
"David Carlson Buys Biogen Inc, Broadcom, Albemarle Corp, Sells Charter Communications Inc, ...",2017-10-30 00:00:00,ALB
"Tom Gayner Buys Goldman Sachs Group Inc, Tyson Foods Inc, Albemarle Corp, Sells Exxon Mobil ...",2017-10-27 00:00:00,ALB
"Glenview State Bank Trust Dept. Buys DowDuPont Inc, Magellan Midstream Partners LP, Albemarle ...",2017-10-26 00:00:00,ALB
Air Products (APD) Q4 Earnings & Revenues Top Estimates,2017-10-26 00:00:00,ALB
"BHP Billiton Reports Q1 Operational Results, Reaffirms View",2017-10-18 00:00:00,ALB
"Guild Investment Management, Inc. Buys YY Inc, iShares Russell —………, Royal Caribbean ...",2017-10-17 00:00:00,ALB
A Red Friday for US Stock Markets,2017-10-06 00:00:00,ALB
Albemarle (ALB) Up 28% in 3 Months: What's Driving the Stock?,2017-10-05 00:00:00,ALB
Why Is Albemarle (ALB) Down 3.5% Since the Last Earnings Report?,2017-09-07 00:00:00,ALB
"AGF Investments America Inc. Buys Medtronic PLC, Danaher Corp, Cummins Inc, Sells Mobileye NV, ...",2017-08-09 00:00:00,ALB
"Svenska Handelsbanken AB (publ) Buys UnitedHealth Group Inc, Proto Labs Inc, Albemarle Corp, ...",2017-08-08 00:00:00,ALB
Albemarle (ALB) Q2 Earnings Preview: What's in the Cards?,2017-08-03 00:00:00,ALB
"New Jersey Better Educational Savings Trust Buys Biogen Inc, Allergan PLC, United Rentals Inc, ...",2017-08-02 00:00:00,ALB
"Domtar Corp (UFS) Q2 Earnings Beat Estimates, Stock Up 2.2%",2017-07-31 00:00:00,ALB
"Tom Gayner Buys Blackstone Group LP, Tyson Foods Inc, Albemarle Corp, Sells Schlumberger",2017-07-28 00:00:00,ALB
"Verus Financial Partners, Inc. Buys Vanguard Total Stock Market, Sells Albemarle Corp, Cintas ...",2017-07-28 00:00:00,ALB
"Pillar Pacific Capital Management Llc Buys Weibo Corp, Symantec Corp, Facebook Inc, Sells ...",2017-07-27 00:00:00,ALB
"Zacks Industry Outlook Highlights: Dow Chemical, DuPont, Syngenta, Albemarle and Monsanto",2017-07-26 00:00:00,ALB
Chemical Industry in Fine Shape: Stocks to Bet on Right Now,2017-07-25 00:00:00,ALB
7 Reasons that Make Chemours (CC) a Solid Choice Right Now,2017-07-14 00:00:00,ALB
Albemarle Touches New 52-Week High on Solid Prospects,2017-07-13 00:00:00,ALB
Dow Chemical to Sell Certain Corn Seed Assets for $1.1B,2017-07-12 00:00:00,ALB
"Albemarle Corp (ALB) Chairman, President & CEO Luther C Iv Kissam Sold $5.5 million of Shares",2017-07-11 00:00:00,ALB
6 Reasons to Add Koppers (KOP) Stock to Your Portfolio,2017-07-11 00:00:00,ALB
"PolyOne Buys Mesa, Expands Color & Additives Offerings",2017-07-11 00:00:00,ALB
Beyond Tesla: 2 Lithium Stocks to Buy Now,2017-07-10 00:00:00,ALB
"Top Analyst Reports for Procter & Gamble, Verizon & Citigroup",2017-07-07 00:00:00,ALB
Eastman Chemical vs Albemarle: Which Stock Is a Better Pick?,2017-07-07 00:00:00,ALB
"KAMES CAPITAL plc Buys Burlington Stores Inc, LCI Industries Inc, Lam Research Corp, Sells TJX ...",2017-07-07 00:00:00,ALB
7 Outperforming Stocks With Rising Prices,2017-06-27 00:00:00,ALB
Stocks Pare Losses But Still Close Lower; Nike Drags Dow,2017-06-15 00:00:00,ALB
5 Investor Bets On An Electric Car Boom,2017-06-13 00:00:00,ALB
Beyond Tesla: 2 Lithium Stocks to Buy Now,2017-06-07 00:00:00,ALB
Tom Gayner Gains 4 New Stocks in –st Quarter,2017-05-01 00:00:00,ALB
"KAMES CAPITAL plc Buys Ansys, Zions Bancorp, Tetra Tech, Sells Bank of Americaoration, PACCAR, ...",2017-04-27 00:00:00,ALB
Stocks That Are Beating the Market,2017-04-12 00:00:00,ALB
5 Companies Reach Yearly Highs,2017-04-11 00:00:00,ALB
"National Pension Service Buys SBA Communications, Waste Connections, Huntington Bancshares, ...",2017-04-11 00:00:00,ALB
"Spiros Segalas Buys JPMorgan Chase, Parker Hannifin, Texas Instruments, Sells American Tower, ...",2017-03-31 00:00:00,ALB
Lithium Suppliers Can't Keep Up With Skyrocketing Demand,2017-03-23 00:00:00,ALB
Lithium X: Insider Buying Well-Timed,2017-03-20 00:00:00,ALB
Albemarle (ALB) Investor Presentation - Slideshow,2017-03-16 00:00:00,ALB
Time To Top Up On The Junior Lithium Miners,2017-03-10 00:00:00,ALB
Fed Could Hike 4 Times - Cramer's Mad Money (3/8/17),2017-03-09 00:00:00,ALB
Methanex (MEOH) Declares New Share Repurchase Program,2017-03-08 00:00:00,ALB
Air Products Declares Pricing Milestone at Fueling Stations,2017-03-07 00:00:00,ALB
Global EV Sales Off To An Interesting Start For 2017,2017-03-06 00:00:00,ALB
Will Albemarle (ALB) Continue to Surge Higher?,2017-03-06 00:00:00,ALB
Valuation Dashboard: Energy And Materials - Update,2017-03-05 00:00:00,ALB
"Chemical Industry Off to a Good Start, 4 Stocks to Buy Now",2017-03-03 00:00:00,ALB
PPG Industries Completes Waterborne Coatings Production Line,2017-03-03 00:00:00,ALB
Air Products (APD) Wins Long-Term Hydrogen Supply Contract,2017-03-02 00:00:00,ALB
Four 10%+ Dividend Increases In Second Half Of February And One More Expected In March,2017-03-01 00:00:00,ALB
PPG Industries to Showcase High Transfer Efficiency Coatings,2017-03-01 00:00:00,ALB
Albemarle Corporation (ALB) Shows Strength: Stock Up 9.8%,2017-03-01 00:00:00,ALB
Energy/Materials - Top 5 Gainers / Losers as of 2:00 pm,2017-02-28 00:00:00,ALB
Albemarle (ALB) Q4 2016 Results - Earnings Call Transcript,2017-02-28 00:00:00,ALB
Albemarle +10% after Q4 beat; guides 2017 revenues above consensus,2017-02-28 00:00:00,ALB
Albemarle Corporation 2016 Q4 - Results - Earnings Call Slides,2017-02-28 00:00:00,ALB
"Albemarle (ALB) Tops Earnings, Revenue Estimates in Q4",2017-02-28 00:00:00,ALB
"Albemarle beats by $0.05, beats on revenue",2017-02-27 00:00:00,ALB
Albemarle Corporation (ALB) Flat on Expected Quarterly Earnings,2017-02-27 00:00:00,ALB
Lithium Miner News For The Month Of February 2017,2017-02-27 00:00:00,ALB
"28 Dividend Increases: February 20-24, 2017 (Part 2: The Remaining Sectors)",2017-02-27 00:00:00,ALB
Notable earnings after Monday's close,2017-02-26 00:00:00,ALB
Albemarle declares $0.32 dividend,2017-02-24 00:00:00,ALB
Valuation Complicates An Otherwise Interesting Story At W.R. Grace,2017-02-23 00:00:00,ALB
A Weaker Australian Dollar Is Likely To Lift Australian Lithium Miners Higher,2017-02-22 00:00:00,ALB
One 20% Dividend Increase Expected Among 8 Announcements In 2nd Half Of February,2017-02-20 00:00:00,ALB
"Point7— Asia (Singapore) Pte. Ltd. Buys Hess, Air Products & Chemicals, Albemarle, Sells ...",2017-02-16 00:00:00,ALB
Is the Lithium Sector Still Apealing?,2017-02-15 00:00:00,ALB
Is the Lithium Sector Still Appealing?,2017-02-15 00:00:00,ALB
Dividend Contenders: 35 Increases Expected By The End Of April,2017-02-13 00:00:00,ALB
LIT Investors: Don't Forget Your Lithium Pills,2017-02-13 00:00:00,ALB
Is This The Top Commodity Play For 2017?,2017-02-13 00:00:00,ALB
"Wal-Mart, Cisco, Coca-Cola predicted to hike payouts next week - Bloomberg",2017-02-10 00:00:00,ALB
The Chinese Electric Vehicle Boom May Soon Accelerate,2017-02-09 00:00:00,ALB
Celanese (CE) to Acquire Nilit's Nylon Compounding Business,2017-02-06 00:00:00,ALB
Lithium Miner News For The Month Of January 2017,2017-01-27 00:00:00,ALB
"BARING ASSET MANAGEMENT Ltd Buys Alibaba Group Holding Ltd, Schlumberger Ltd, Itau Unibanco ...",2017-01-27 00:00:00,ALB
This Dividend Growth Chemical Manufacturer On A Bullish Breakout,2017-01-24 00:00:00,ALB
Goldman Calls Lithium The New Gasoline: Galaxy Resources Is A Buy-On-Weakness Play,2017-01-24 00:00:00,ALB
Eastman Chemical (EMN) Q4 Earnings: What's in the Cards?,2017-01-23 00:00:00,ALB
Dividend Contenders: 43 Increases Expected By The End Of March,2017-01-20 00:00:00,ALB
Pilbara Minerals: Don't Miss This Junior Miner At The Dawn Of The Age Of Lithium,2017-01-20 00:00:00,ALB
DuPont (DD) Q4 Preview: Another Earnings Beat in Store?,2017-01-20 00:00:00,ALB
Lithium Americas Is Looking Good And Is Now Significantly De-Risked,2017-01-19 00:00:00,ALB
"The Zacks Analyst Blog Highlights: Kronos Worldwide, Ingevity, LyondellBasell Industries NV, Celanese Corporation and Albemarle",2017-01-19 00:00:00,ALB
5 Chemical Growth Stocks to Enrich Your Portfolio in 2017,2017-01-18 00:00:00,ALB
Tesla's Lithium Supply - Update,2017-01-18 00:00:00,ALB
International Flavors Completes Fragrance Resources Buyout,2017-01-18 00:00:00,ALB
Albemarle upgraded at Baird amid growing lithium market,2017-01-17 00:00:00,ALB
RIO Tinto (RIO) Reports Robust Production Results in Q4,2017-01-17 00:00:00,ALB
POSCO's (PKX) Growth Initiatives Look Good: Time to Buy?,2017-01-17 00:00:00,ALB
The Two Hottest Commodities Of 2017,2017-01-12 00:00:00,ALB
"Robecosam Ag Buys Air Products & Chemicals Inc, Microsemi Corp, Silicon Laboratories Inc, ...",2017-01-10 00:00:00,ALB
"PPG, Axalta cut at Citi on more defensive outlook for chemical/ag sector",2017-01-09 00:00:00,ALB
Valuation Dashboard: Energy And Materials - Update,2017-01-05 00:00:00,ALB
Top 12 Lithium Miners To Create Your Own Lithium ETF,2017-01-05 00:00:00,ALB
Neo Lithium Corp Has Great Potential,2017-01-04 00:00:00,ALB
Albemarle gets OK to expand lithium operations in Chile,2017-01-04 00:00:00,ALB
Lithium Miner News For The Month Of December 2016,2016-12-27 00:00:00,ALB
Resource Sector Digest: Yamana Gold Says It's All About 'Realizing' Value,2016-12-27 00:00:00,ALB
9 Stocks Steven Cohen Continues to Buy,2016-12-15 00:00:00,ALB
"Zacks Industry Outlook Highlights: Dow Chemical, DuPont, Albemarle, FMC and Westlake Chemical",2016-12-09 00:00:00,ALB
The Lithium Market Will Grow To 20 Times Its Current Size In The Next 15 Years,2016-12-07 00:00:00,ALB
Oil Stocks Rally To New Highs On OPEC Deal; Dow's United Tech Reverses,2016-11-30 00:00:00,ALB
"Lthium output will keep pace with electric vehicle growth, Albemarle CEO says",2016-11-28 00:00:00,ALB
Lithium Miners News For The Month Of November 2016,2016-11-28 00:00:00,ALB
Pilbara Minerals Could Be The Next Greenbushes Lithium Blockbuster,2016-11-21 00:00:00,ALB
Electric Vehicles Set To Electrify The Market In 2017,2016-11-10 00:00:00,ALB
Albemarle (ALB) Q3 2016 Results - Earnings Call Transcript,2016-11-08 00:00:00,ALB
Albemarle Corporation 2016 Q3 - Results - Earnings Call Slides,2016-11-08 00:00:00,ALB
"Albemarle beats by $0.10, beats on revenue",2016-11-07 00:00:00,ALB
Notable earnings after Monday's close,2016-11-06 00:00:00,ALB
Albemarle declares $0.305 dividend,2016-11-03 00:00:00,ALB
"Copper, Zinc And Lithium - Fresh Value, The Boom And The Pull Back",2016-11-01 00:00:00,ALB
Albemarle: Expect Shares To Trade Horizontally Till Year-End,2016-11-01 00:00:00,ALB
Lithium Miners News For The Month Of October 2016,2016-10-28 00:00:00,ALB
Best And Worst Performing Stocks 2016 YTD,2016-10-25 00:00:00,ALB
"As Lithium Scramble Continues, Here Are — Players to Watch",2016-10-20 00:00:00,ALB
"Fusion And Energy? Despite Private Support, It's Always Too Early To Tell",2016-10-20 00:00:00,ALB
Kraton Hugs Support As It Climbs Toward Buy Point,2016-10-11 00:00:00,ALB
Lithium Miners News For The Month Of September 2016,2016-09-27 00:00:00,ALB
Soil Survey Shows Strong Lithium Results at the Nevada Energy Metals Black Rock Desert Project,2016-09-23 00:00:00,ALB
The Rush Is On For Argentine Lithium Assets,2016-09-22 00:00:00,ALB
The World In 2020 And What Companies To Own,2016-09-16 00:00:00,ALB
China's top lithium producer proposes deal for stake in Chile's SQM,2016-09-09 00:00:00,ALB
"Albemarle's Lithium And Overall Product Mix, Makes It Well-Positioned For The Long Term",2016-09-09 00:00:00,ALB
Should You Buy Into The Lithium Mania?,2016-09-06 00:00:00,ALB
Oroplata Resources (ORRP) Takes Shape as a Potential Lithium Acquisition Target,2016-09-06 00:00:00,ALB
Shale Gas 2.0: An Explosive Expansion Of The U.S. Chemicals Trade,2016-09-02 00:00:00,ALB
Lithium Miners News For The Month Of August 2016,2016-08-30 00:00:00,ALB
"Lithium ETF Captures Key Element Of Mobile Tech, Electric Cars",2016-08-26 00:00:00,ALB
An Update On Lithium And The Pure Play Lithium Miners,2016-08-11 00:00:00,ALB
Combining Different Momentum Factors,2016-08-09 00:00:00,ALB
Albemarle Corporation 2016 Q2 - Results - Earnings Call Slides,2016-08-04 00:00:00,ALB
Albemarle (ALB) Luke C. Kissam on Q2 2016 Results - Earnings Call Transcript,2016-08-04 00:00:00,ALB
Valuation Dashboard: Energy And Materials - Update,2016-08-03 00:00:00,ALB
Albemarle beats by $0.09,2016-08-03 00:00:00,ALB
Notable earnings after Wednesday's close,2016-08-02 00:00:00,ALB
Mining Technology Trends Reveal Investment Opportunities In The Electric Vehicle Market,2016-07-26 00:00:00,ALB
Lithium in focus with Gigafactory event on tap,2016-07-22 00:00:00,ALB
Chinese Electric Vehicles Continue To Boom,2016-07-21 00:00:00,ALB
Lithium Extraction Techniques - A Look At The Latest Technologies And The Companies Involved,2016-07-14 00:00:00,ALB
Critical Elements - A Lithium Miner With An Exceptional Buying Opportunity,2016-07-12 00:00:00,ALB
Albemarle declares $0.30 dividend,2016-07-11 00:00:00,ALB
"State Street Global Advisors SPDR S&P Dividend ETF SDY: These Times, They Are A-Changin'",2016-07-06 00:00:00,ALB
Lithium X Has The X Factor,2016-07-05 00:00:00,ALB
Galaxy Resources: An Emerging Leader In The Lithium Industry,2016-07-05 00:00:00,ALB
"Brexit Isn't The Biggest Concern, It's Inflation And Deflation's Double-Edged-Sword",2016-07-01 00:00:00,ALB
The Lithium Boom - An Analysis Of Future Demand Vs. Supply,2016-06-27 00:00:00,ALB
Brexocalypse - 3 Ways To Protect Your Portfolio Today,2016-06-24 00:00:00,ALB
"Albemarle, Fortive to join S&P 500",2016-06-23 00:00:00,ALB
1 Year With Seeking Alpha,2016-06-23 00:00:00,ALB
American Lithium in the Thick of the White Gold Rush of Lithium in Nevada,2016-06-22 00:00:00,ALB
Galaxy Resources - An Excellent Way To Invest Into The Lithium Miners,2016-06-22 00:00:00,ALB
Albemarle - Investors Rightfully Applaud Chemetall Divestiture,2016-06-20 00:00:00,ALB
Resource Sector Digest: Don't Count On Tesla To Sustain The Lithium Hype!,2016-06-19 00:00:00,ALB
Orocobre - Leading The Lithium Pure Play Miners In The Lithium Boom,2016-06-17 00:00:00,ALB
BASF to buy Albemarle's Chemetall surface treatment unit for $3.2B,2016-06-17 00:00:00,ALB
ProShares S&P MidCap 400 Dividend Aristocrats: A Crown Jewel?,2016-06-15 00:00:00,ALB
Top 5 Lithium Miners To Consider,2016-06-13 00:00:00,ALB
"Lithium Americas: A Well-Valued, Near-Term Lithium Producer",2016-06-10 00:00:00,ALB
"Whether We Want It Or Not, We All Need A Break",2016-05-26 00:00:00,ALB
Examining the Current State of Health Care and Skin Care Stocks,2016-05-23 00:00:00,ALB
"The Lithium-Ion Battery Trifecta - Selecting The Best Lithium, Cobalt And Graphite Miners",2016-05-23 00:00:00,ALB
Albemarle: Best Lithium Investment Right Now,2016-05-16 00:00:00,ALB
Bloomberg: Albemarle considers sale of $3B surface treatment unit,2016-05-13 00:00:00,ALB
Apple And Disney Have Staying Power - Cramer's Mad Money (5/11/16),2016-05-12 00:00:00,ALB
Albemarle (ALB) Luther C. Kissam on Q1 2016 Results - Earnings Call Transcript,2016-05-11 00:00:00,ALB
Albemarle declares $0.305 dividend,2016-05-10 00:00:00,ALB
Notable earnings after Tuesday's close,2016-05-09 00:00:00,ALB
26 Stocks For May 2016,2016-05-02 00:00:00,ALB
The Scramble For Lithium Is On As Prices Double,2016-04-13 00:00:00,ALB
Are There Any Deals Among The Dividend Contenders?,2016-04-12 00:00:00,ALB
Top Expert Resource Stock Picks from PDAC 2016,2016-04-08 00:00:00,ALB
Lithium Miners Are Booming As Lithium Spot Prices Rise - Which Lithium Companies Should I Buy?,2016-04-07 00:00:00,ALB
23 Stocks For April 2016,2016-04-01 00:00:00,ALB
Goldman Calls Lithium The New Gasoline - Get In Before It's Too Late Or Stay Out?,2016-03-24 00:00:00,ALB
"With The Lows Behind Us, There Are New Market Leaders And Opportunities Emerging",2016-03-21 00:00:00,ALB
"Reuters: Interest grows in South America's ""lithium triangle""",2016-03-15 00:00:00,ALB
Albemarle Is Not Expensive After The Recent Chilean Approval,2016-03-15 00:00:00,ALB
19 Dividend Increase Announcements In February And 4 More Expected In March,2016-03-02 00:00:00,ALB
21 Stocks For March 2016,2016-03-01 00:00:00,ALB
"19 Dividend Increases, February 22-February 26, 2016",2016-02-28 00:00:00,ALB
Albemarle declares $0.305 dividend,2016-02-26 00:00:00,ALB
Electric Car War Sends Lithium Prices Sky High,2016-02-25 00:00:00,ALB
Albemarle (ALB) Luke C. Kissam on Q4 2015 Results - Earnings Call Transcript,2016-02-18 00:00:00,ALB
"Albemarle beats by $0.20, beats on revenue",2016-02-17 00:00:00,ALB
Notable earnings after Wednesday's close,2016-02-16 00:00:00,ALB
Dividend Contenders: 35 Increases Expected In The Next 11 Weeks,2016-02-14 00:00:00,ALB
Albemarle gets Chile approval to boost lithium production,2016-02-03 00:00:00,ALB
23 Stocks For February 2016,2016-02-02 00:00:00,ALB
"16 Scheduled Dividend Increases For February, And January Announcement Recap",2016-02-01 00:00:00,ALB
Dividend Contenders: Better Choice Than Dividend Aristocrats?,2016-01-24 00:00:00,ALB
"Oil Will Come Roaring Back, But Lithium Might Still Be A Better Bet",2016-01-21 00:00:00,ALB
Dividend Contenders: 50 Increases Expected By The End Of March,2016-01-16 00:00:00,ALB
What Investors Need To Know About Lithium Ion Batteries,2016-01-14 00:00:00,ALB
My Top Chemicals Stocks For 2016,2015-12-31 00:00:00,ALB
"John Burbank Has Big Losses on E-Commerce China, Sohu.com, Autohome",2015-12-29 00:00:00,ALB
"Macquarie Infrastructure Leads Strategic Dividend Dogs With 6.9% Yield, 54.9% Upside, And 58.8% Net As Of December 2016",2015-12-21 00:00:00,ALB
Albemarle: A Clever Way To Play The Tesla Revolution,2015-12-17 00:00:00,ALB
Albemarle selling pair of businesses to J.M. Huber,2015-12-16 00:00:00,ALB
Albemarle: M&A Confusion Drives ~60% Upside,2015-12-06 00:00:00,ALB
25 Stocks For December 2015,2015-12-01 00:00:00,ALB
28 Stocks For December 2015,2015-12-01 00:00:00,ALB
"Albemarle Tops EPS Estimate, Misses On Revenue",2015-11-05 00:00:00,ALB
"Albemarle Tops EPS Estimate, Misses On Revenue",2015-11-05 00:00:00,ALB
DuPont Inks Multi-Year Contract with QCCP for Enzyme Supply,2015-10-20 00:00:00,ALB
"Albemarle (ALB) Shares March Higher, Can It Continue?",2015-10-19 00:00:00,ALB
Potash Corp Cut to Strong Sell: Should You Dump It?,2015-10-16 00:00:00,ALB
Celanese Hikes Prices for Acetyl Intermediate Products,2015-10-16 00:00:00,ALB
Air Products Unveils InuMax Advanced Retinol Solution,2015-10-16 00:00:00,ALB
Syngenta (SYT) Q3 Results Hurt by Currency & Credit Woes,2015-10-15 00:00:00,ALB
"PPG Industries' (PPG) Q3 Earnings Meet, Profits Rise",2015-10-15 00:00:00,ALB
Albemarle added to Conviction Buy List at Goldman Sachs,2015-10-09 00:00:00,ALB
"It's Game Over, Tesla Wins",2015-09-28 00:00:00,ALB
Tesla Vs. The Lithium Oligopoly,2015-09-25 00:00:00,ALB
Albemarle (ALB) to Beef Up Battery Grade Lithium Production,2015-09-18 00:00:00,ALB
Albemarle (ALB) Looks Good: Stock Adds 5.7% in Session,2015-09-16 00:00:00,ALB
"Stocks Open Up, But Not Much; Albemarle, Chevron, Sucampo Rise",2015-09-15 00:00:00,ALB
David's High Velocity Solution For A Buy And Hold SWAN Portfolio,2015-09-10 00:00:00,ALB
26 Stocks For September 2015,2015-09-01 00:00:00,ALB
Albemarle Shifting Corporate Headquarters to Charlotte,2015-08-26 00:00:00,ALB
Albemarle's (ALB) Chemetall Unveils Water-Based Penetrant,2015-08-20 00:00:00,ALB
"Zacks Industry Outlook Highlights: PPG Industries, Albemarle, CF Industries, LyondellBasell Industries and Celanese",2015-08-19 00:00:00,ALB
What's Supporting the Bullish Case for Chemical Stocks?,2015-08-18 00:00:00,ALB
"Thinking Outside The Commodity Box: Benchmark's Investment Primer For Lithium, Cobalt And Graphite",2015-08-14 00:00:00,ALB
International Flavors (IFF) Q2 Earnings: What's in Store? - Analyst Blog,2015-08-07 00:00:00,ALB
Albemarle (ALB) Luke C. Kissam on Q2 2015 Results - Earnings Call Transcript,2015-08-06 00:00:00,ALB
"Albemarle beats by $0.02, beats on revenue",2015-08-05 00:00:00,ALB
Notable earnings after Wednesday's close,2015-08-04 00:00:00,ALB
Will Century Aluminum (CENX) Miss Q2 Earnings Estimates? - Analyst Blog,2015-08-04 00:00:00,ALB
Will CF Industries (CF) Disappoint Q2 Earnings Estimates? - Analyst Blog,2015-08-03 00:00:00,ALB
Will Challenges in Agriculture Dent Mosaic (MOS) Earnings? - Analyst Blog,2015-08-03 00:00:00,ALB
Will FMC Corp's (FMC) Q2 Earnings Surprise Estimates? - Analyst Blog,2015-08-03 00:00:00,ALB
Will Trimble Navigation's (TRMB) Q2 Earnings Disappoint? - Analyst Blog,2015-07-31 00:00:00,ALB
What to Expect from ON Semiconductor (ON) Q2 Earnings? - Analyst Blog,2015-07-31 00:00:00,ALB
"Air Products (APD) Beats on Q3 Earnings, Ups FY15 View - Analyst Blog",2015-07-30 00:00:00,ALB
Methanex's (MEOH) Q2 Earnings & Revenues Miss Estimates - Analyst Blog,2015-07-30 00:00:00,ALB
Albermarle Corp.: Play The Distributed Generation Transformation,2015-07-30 00:00:00,ALB
"Praxair (PX) Q2 Earnings Meet Estimates, Revenues Lag - Analyst Blog",2015-07-29 00:00:00,ALB
Eastman Chemical (EMN) Jumps: Stock Up 6.8% - Tale of the Tape,2015-07-29 00:00:00,ALB
"Airgas (ARG) Q1 Earnings Beat, Updates FY16 Guidance - Analyst Blog",2015-07-28 00:00:00,ALB
"DuPont's Earnings Miss on Agriculture Weakness, Cuts View - Analyst Blog",2015-07-28 00:00:00,ALB
"LyondellBasell Q2 Earnings Trounce Estimates, Sales Trail - Analyst Blog",2015-07-28 00:00:00,ALB
Will Yamana Gold (AUY) Surprise This Earnings Season? - Analyst Blog,2015-07-28 00:00:00,ALB
Will Potash Corp's (POT) Q2 Earnings Post a Surprise? - Analyst Blog,2015-07-28 00:00:00,ALB
Is CVR Partners (UAN) Likely to Disappoint Earnings in Q2? - Analyst Blog,2015-07-28 00:00:00,ALB
Can Air Products (APD) Sustain Its Earnings Streak in Q3? - Analyst Blog,2015-07-28 00:00:00,ALB
"Eastman Chemical Beats on Q2 Earnings, Misses Revenues - Analyst Blog",2015-07-28 00:00:00,ALB
Albermarle Corp Is Worth A Look,2015-07-27 00:00:00,ALB
What to Expect from Lam Research's (LRCX) Q4 Earnings - Analyst Blog,2015-07-27 00:00:00,ALB
Will Garmin's (GRMN) Q2 Earnings Disappoint Estimates? - Analyst Blog,2015-07-27 00:00:00,ALB
Will Cliffs Natural (CLF) Beat Earnings Estimates in Q2? - Analyst Blog,2015-07-27 00:00:00,ALB
Will Praxair (PX) Lag Q2 Earnings Estimates on Forex Woes? - Analyst Blog,2015-07-27 00:00:00,ALB
Will Airgas (ARG) Disappoint Q1 Earnings on Cost Concerns? - Analyst Blog,2015-07-27 00:00:00,ALB
Univar (UNVR) to Report Q2 Earnings: What to Expect? - Analyst Blog,2015-07-27 00:00:00,ALB
Methanex Corp (MEOH) Crumbles; Stock Falls by 5.3% - Tale of the Tape,2015-07-27 00:00:00,ALB
DuPont (DD) Q2 Preview: Will a Strong Dollar Hit Earnings? - Analyst Blog,2015-07-24 00:00:00,ALB
Is Another Earnings Beat Coming for LyondellBasell (LYB)? - Analyst Blog,2015-07-24 00:00:00,ALB
Will Eastman Chemical (EMN) Beat Q2 Earnings Estimates? - Analyst Blog,2015-07-24 00:00:00,ALB
New Strong Buy Stocks for July 22nd - Tale of the Tape,2015-07-22 00:00:00,ALB
Albemarle Rationalizing Capacity at New Johnsonville Plant - Analyst Blog,2015-07-14 00:00:00,ALB
Albemarle (ALB) Enters Oversold Territory - Tale of the Tape,2015-07-10 00:00:00,ALB
Albemarle declares $0.29 dividend,2015-07-09 00:00:00,ALB
Albemarle Starts Commissioning of Lithium Carbonate Plant - Analyst Blog,2015-07-09 00:00:00,ALB
Calgon Carbon -8% after Supreme Court ruling on mercury emissions,2015-06-29 00:00:00,ALB
What's in Store for Monsanto (MON) this Earnings Season? - Analyst Blog,2015-06-22 00:00:00,ALB
MRC Global Rides On Growth Curve with New SABIC Deal - Analyst Blog,2015-06-18 00:00:00,ALB
Why Albemarle Corporation (ALB) Stock Might be a Great Pick - Tale of the Tape,2015-06-17 00:00:00,ALB
Monsanto in Trouble as France Puts Ban on Roundup Sale - Analyst Blog,2015-06-16 00:00:00,ALB
How To Ride The Lithium Battery Boom: JGL Partners' Jonathan Lee,2015-06-03 00:00:00,ALB
Methanex Enters into Unified Communications Deal with BT - Analyst Blog,2015-05-21 00:00:00,ALB
PPG Industries Unveils Metal Coatings Color Selector Tool - Analyst Blog,2015-05-21 00:00:00,ALB
Celanese to Hike Prices of Potassium Sorbate & Sorbic Acid - Analyst Blog,2015-05-21 00:00:00,ALB
Is This the Right Time to Buy Sherwin-Williams (SHW) Stock? - Analyst Blog,2015-05-20 00:00:00,ALB
Dow Chemical to Exhibit Packaging Solutions at Chinaplas - Analyst Blog,2015-05-20 00:00:00,ALB
Is Celanese (CE) Worth Adding to Your Portfolio? - Analyst Blog,2015-05-19 00:00:00,ALB
Cabot Corporation Down to Strong Sell on Weak Q2 Results - Analyst Blog,2015-05-19 00:00:00,ALB
Albemarle Buys Chemal's Aluminum Finishing Businesses - Analyst Blog,2015-05-18 00:00:00,ALB
"Praxair Hikes Gas Prices, Inks Gas Supply Contract in India - Analyst Blog",2015-05-18 00:00:00,ALB
Zacks Rank #1 Additions for Monday - Tale of the Tape,2015-05-18 00:00:00,ALB
Praxair Wins Oxygen Supply Contract from Beijing Drainage - Analyst Blog,2015-05-13 00:00:00,ALB
Albemarle (ALB) Luther C. Kissam on Q1 2015 Results - Earnings Call Transcript,2015-05-07 00:00:00,ALB
David Vs. Goliath: Small-Cap Tech To Save Giant Coal,2015-05-07 00:00:00,ALB
"Albemarle beats by $0.46, misses on revenue",2015-05-06 00:00:00,ALB
Albemarle declares $0.29 dividend,2015-05-05 00:00:00,ALB
Notable earnings after Wednesday's close,2015-05-05 00:00:00,ALB
"Alternative Coal Stocks or Coal Technology Plays (ADES, ALB, CCC, FTEK & MEEC)",2015-04-23 00:00:00,ALB
"Zacks Industry Outlook Highlights: PPG Industries, Albemarle, Air Products and Chemicals, Celanese and LyondellBasell Industries - Press Releases",2015-04-21 00:00:00,ALB
