headline,date,stock
"Dividend Increases: February 25-March 1, 2019 (Part 2: Remaining Sectors)",2019-03-06 00:00:00,ALB
Automotive Industry Current And Long-Term Future Outlook,2019-03-04 00:00:00,ALB
Tracking Larry Robbins' Glenview Capital Management Portfolio - Q4 2018 Update,2019-03-04 00:00:00,ALB
Busy Week For Dividend Increases,2019-03-04 00:00:00,ALB
Defense Firms General Dynamics And Raytheon Among A Light Month Of Dividend Increases In March,2019-03-03 00:00:00,ALB
Albemarle (ALB) Presents At Bank of America Merrill Lynch Global Agriculture and Materials Conference - Slideshow,2019-03-01 00:00:00,ALB
"Albemarle Corp (ALB) Files –…-K for the Fiscal Year Ended on December '–, —…–8",2019-02-27 00:00:00,ALB
Galaxy Resources: Flush With Cash And Ready To Rock N Roll,2019-02-27 00:00:00,ALB
"Albemarle Hikes Quarterly Dividend, Boosts Shareholder Value",2019-02-27 00:00:00,ALB
Albemarle declares $0.3675 dividend,2019-02-26 00:00:00,ALB
Lithium Miners News For The Month Of February 2019,2019-02-25 00:00:00,ALB
"Company News For Feb 22, 2019",2019-02-22 00:00:00,ALB
Albemarle (ALB) in Focus: Stock Moves 7.8% Higher,2019-02-22 00:00:00,ALB
Albemarle Corporation (ALB) CEO Luke Kissam on Q4 2018 Results - Earnings Call Transcript,2019-02-22 00:00:00,ALB
TimkenSteel and Harsco among Energy/Materials gainers; Pioneer Energy Services and SM Energy among losers,2019-02-21 00:00:00,ALB
"ALB, NAK, HTZ among premarket gainers",2019-02-21 00:00:00,ALB
Albemarle Corporation 2018 Q4 - Results - Earnings Call Slides,2019-02-20 00:00:00,ALB
Albemarle (ALB) Tops Q4 Earnings and Revenue Estimates,2019-02-20 00:00:00,ALB
"VIPS, ALB and CAR among notable movers",2019-02-20 00:00:00,ALB
"Albemarle +5% after beating Q4 expectations, issuing upside guidance",2019-02-20 00:00:00,ALB
"Albemarle beats by $0.06, beats on revenue",2019-02-20 00:00:00,ALB
"Feltz Wealth PLAN Inc. Buys iShares Edge MSCI Min Vol USA, Zai Lab, Invesco QQQ Trust Series ...",2019-02-20 00:00:00,ALB
"Retailers Ross Stores, TJX Companies Expected To Lead Dividend Increases In Second Half Of February",2019-02-18 00:00:00,ALB
Can Albemarle (ALB) Maintain Earnings Beat Streak in Q4?,2019-02-18 00:00:00,ALB
"Spotlight On Walmart, Samsung And CAGNY (Stocks To Watch Podcast)",2019-02-17 00:00:00,ALB
Reflections On Nemaska's Bombshell,2019-02-17 00:00:00,ALB
"Stocks To Watch: Spotlight On Walmart, Samsung And CAGNY",2019-02-16 00:00:00,ALB
Top 5 Lithium Producers And Other Growing Producers To Consider,2019-02-14 00:00:00,ALB
Albemarle (ALB) Reports Next Week: Wall Street Expects Earnings Growth,2019-02-13 00:00:00,ALB
Livent's China caution clouds lithium industry outlook,2019-02-12 00:00:00,ALB
Albemarle (ALB) Stock Sinks As Market Gains: What You Should Know,2019-02-11 00:00:00,ALB
Albemarle: Focused On Accretive Lithium Expansion,2019-02-06 00:00:00,ALB
"Albemarle downgraded at Citigroup, preferring Livent for lithium exposure",2019-02-05 00:00:00,ALB
Oversold Lithium Could Be About To Rally,2019-01-29 00:00:00,ALB
"Albemarle: By Far The Worst Performer In My Portfolio, Yet I Am Hopeful",2019-01-29 00:00:00,ALB
Albemarle reaches agreement with Chile in lithium dispute,2019-01-24 00:00:00,ALB
Lithium Miners News For The Month Of January 2019,2019-01-24 00:00:00,ALB
Albemarle's Stronghold In Specialty Chemicals Is Evident,2019-01-17 00:00:00,ALB
Chile nuclear watchdog may probe fraud over lithium exports - Reuters,2019-01-15 00:00:00,ALB
"Albemarle, Livent downgraded at Nomura on price data point outlook",2019-01-15 00:00:00,ALB
"Albemarle -6% as Berenberg downgrades, seeing start of fundamental shift",2019-01-03 00:00:00,ALB
Albemarle Initiates Earthworks at Kemerton Lithium Site,2019-01-03 00:00:00,ALB
Wild Stock Market Swings (Wall Street Breakfast Podcast),2018-12-28 00:00:00,ALB
Wall Street Breakfast: Wild Stock Market Swings,2018-12-28 00:00:00,ALB
Chile to delay arbitration with Albemarle - Reuters,2018-12-28 00:00:00,ALB
Lithium Miners News For The Month Of December 2018,2018-12-24 00:00:00,ALB
Lithium troubles for Albemarle in Chile?,2018-12-24 00:00:00,ALB
US Chemical Industry Rebounds in November As Output Rises,2018-12-20 00:00:00,ALB
Albemarle Enters Oversold Territory,2018-12-18 00:00:00,ALB
Albemarle & Mineral Resources Ink Deal to Form Lithium JV,2018-12-18 00:00:00,ALB
Time To Connect The Dots (Stocks To Watch Podcast),2018-12-16 00:00:00,ALB
Stocks To Watch: Time To Connect The Dots,2018-12-15 00:00:00,ALB
Albemarle (ALB) Well Placed on Lithium Expansion Actions,2018-12-14 00:00:00,ALB
Chemicals Start Q4 on Soft Note with Sluggish October Growth,2018-12-14 00:00:00,ALB
"Albemarle, Australia's Mineral Resources reach $1.15B lithium JV deal",2018-12-14 00:00:00,ALB
Portfolio Update: Stocks Getting Slammed As Dividends Shine Bright,2018-12-11 00:00:00,ALB
Will New Technologies Replace Lithium Brine Solar Evaporation Ponds?,2018-12-10 00:00:00,ALB
France's 'Gilets Jaunes' And The Future Of The Global Energy Industry,2018-12-08 00:00:00,ALB
Is Albemarle A Bargain After Its 30% Plunge This Year?,2018-12-06 00:00:00,ALB
Why Should You Add Albemarle (ALB) Stock to Your Portfolio?,2018-12-05 00:00:00,ALB
The Best Lithium Stocks: Industry Investment Analysis From Mining To Batteries,2018-11-26 00:00:00,ALB
Chile's Corfo says will file arbitration suit against Albemarle by Dec. 15,2018-11-26 00:00:00,ALB
Lithium Miners News For The Month Of November 2018,2018-11-26 00:00:00,ALB
Tracking Larry Robbins' Glenview Capital Management Portfolio - Q3 2018 Update,2018-11-24 00:00:00,ALB
Tracking Robert Karr's Joho Capital Portfolio - Q3 2018 Update,2018-11-22 00:00:00,ALB
Albemarle (ALB) Inks Exclusivity Deal with Mineral Resources,2018-11-22 00:00:00,ALB
Albermarle to pay $1.15B for 50/50 lithium mine JV in Western Australia,2018-11-21 00:00:00,ALB
Albemarle (ALB) Launches XPLORE & First Grade KF 787 PULSAR,2018-11-16 00:00:00,ALB
"Probity Advisors, Inc. Buys iShares –-' Year Credit Bond ETF, SPDR Series Trust Portfolio ...",2018-11-14 00:00:00,ALB
Reuters: Chilean regulators reject Albemarle's plans to boost lithium output,2018-11-13 00:00:00,ALB
Albermarle gets environmental OK for A$1B Australia lithium plant,2018-11-09 00:00:00,ALB
Albemarle Corporation 2018 Q3 - Results - Earnings Call Slides,2018-11-08 00:00:00,ALB
Albemarle (ALB) Q3 2018 Results - Earnings Call Transcript,2018-11-08 00:00:00,ALB
Albemarle stops Chile expansion plans amid lithium tech scrutiny,2018-11-08 00:00:00,ALB
"Albemarle (ALB) Q3 Earnings Top Estimates, Revenues Lag",2018-11-08 00:00:00,ALB
Alemarle -2.5% as unexpected shutdowns at lithium plants hurt Q3 results,2018-11-07 00:00:00,ALB
Albemarle (ALB) Surpasses Q3 Earnings Estimates,2018-11-07 00:00:00,ALB
Notable earnings after Wednesday's close,2018-11-06 00:00:00,ALB
Energy And Materials Dashboard - Update,2018-11-06 00:00:00,ALB
Can Albemarle (ALB) Beat Earnings in Q3 on Lithium Strength?,2018-11-05 00:00:00,ALB
Albemarle (ALB) Gains As Market Dips: What You Should Know,2018-11-02 00:00:00,ALB
Albemarle declares $0.335 dividend,2018-10-30 00:00:00,ALB
Lithium Miners News For The Month Of October 2018,2018-10-26 00:00:00,ALB
The Trade Desk Will Be Under Pressure - Cramer's Lightning Round (10/22/18),2018-10-23 00:00:00,ALB
Livent: Alive And Well?,2018-10-18 00:00:00,ALB
Chile eyes international arbitration over Albemarle contract,2018-10-17 00:00:00,ALB
"Brunch, Craft Beer & Investing: Embracing Volatility & Managing Risk",2018-10-16 00:00:00,ALB
Sale Of Chemical & Mining Co. Of Chile Inc. Stake Suspended - What It Means For Nutrien,2018-10-15 00:00:00,ALB
Is a Beat in the Cards for Celanese (CE) in Q3 Earnings?,2018-10-15 00:00:00,ALB
Will Higher Costs Dent PPG Industries' (PPG) Q3 Earnings?,2018-10-15 00:00:00,ALB
Cal-Maine Foods to Acquire Assets of Featherland Egg Farms,2018-10-11 00:00:00,ALB
"Albemarle -4% as rival adds key hire, Vertical Group analyst says",2018-10-09 00:00:00,ALB
Report: Chile regulator refuses to raise Albemarle's lithium output quota,2018-10-08 00:00:00,ALB
"Road To Financial Independence: Best September Ever, Investing Into Technology Stocks Amid Mounting Trade Woes",2018-10-08 00:00:00,ALB
5 Chemical Stocks That Are Poised for Solid Upside in Q4,2018-10-05 00:00:00,ALB
"China's Tianqi can buy 25% stake in SQM, Chilean antitrust court rules",2018-10-04 00:00:00,ALB
"Spiros Segalas Buys Alphabet, Tesla",2018-10-04 00:00:00,ALB
Chile considers arbitration with lithium producer Albemarle,2018-10-04 00:00:00,ALB
Livent Files Proposed Terms For $380 Million IPO,2018-10-01 00:00:00,ALB
"Harbor Capital Appreciation Fund Buys AstraZeneca PLC, Alphabet Inc, Alphabet Inc, Sells FedEx ...",2018-09-28 00:00:00,ALB
Albemarle CEO foresees future as pure-play lithium market leader,2018-09-27 00:00:00,ALB
Lithium Miners News For The Month Of September 2018,2018-09-24 00:00:00,ALB
Wall Street at Record Highs,2018-09-21 00:00:00,ALB
Wall Street Jumps Wednesday,2018-09-19 00:00:00,ALB
5 Reasons to Add Albemarle (ALB) Stock to Your Portfolio Now,2018-09-19 00:00:00,ALB
Tianqi And SQM Lithium: Resolution Of A Deal Both Need,2018-09-17 00:00:00,ALB
Top Dividend Growth Stocks By Sector,2018-09-12 00:00:00,ALB
Why Is Albemarle (ALB) Down 2.4% Since Last Earnings Report?,2018-09-06 00:00:00,ALB
Reuters: Albemarle may buy FMC's lithium operations if IPO stumbles,2018-09-05 00:00:00,ALB
"Road To Financial Independence: Growing Dividends, Endless Opportunities But Limited Capital",2018-09-03 00:00:00,ALB
Energy Metals Expert Chris Berry Gives An Industry Update With Matt Bohlsen Of Trend Investing,2018-08-31 00:00:00,ALB
FMC's Livent IPO Is Critical For Lithium Investors,2018-08-31 00:00:00,ALB
Livent files for IPO,2018-08-27 00:00:00,ALB
Lithium Miners News For The Month Of August 2018,2018-08-24 00:00:00,ALB
Reuters: Chile plans clampdown on water rights in lithium-rich area,2018-08-23 00:00:00,ALB
Tracking Robert Karr's Joho Capital Portfolio - Q2 2018 Update,2018-08-20 00:00:00,ALB
The Lithium Collapse Is Creating Opportunity,2018-08-19 00:00:00,ALB
The U.S. Must Rely On Innovative Domestic Startups To Reduce Dependency On Imported Lithium,2018-08-15 00:00:00,ALB
Trump's Shift Into Overdrive Could Bury America's EV Space,2018-08-13 00:00:00,ALB
S&P 500: It's All In The Numbers And The Numbers Never Lie,2018-08-12 00:00:00,ALB
"Reuters: Peru president sees lithium, uranium laws passed in six months",2018-08-10 00:00:00,ALB
"Fiduciary Financial Services Of The Southwest Inc Buys Annaly Capital Management Inc, NVIDIA ...",2018-08-10 00:00:00,ALB
SQM says will pass Albemarle as world's no. 1 lithium producer by 2022,2018-08-09 00:00:00,ALB
Albemarle (ALB) Looks Good: Stock Adds 6.4% in Session,2018-08-09 00:00:00,ALB
Albemarle: Up On Better Than Expected Q2 Results,2018-08-08 00:00:00,ALB
Albemarle (ALB) Q2 2018 Results - Earnings Call Transcript,2018-08-08 00:00:00,ALB
Wall Street Mostly Higher Wednesday,2018-08-08 00:00:00,ALB
Albemarle +6% after following strong Q2 with added $250M stock buyback,2018-08-08 00:00:00,ALB
Albemarle Corporation 2018 Q2 - Results - Earnings Call Slides,2018-08-08 00:00:00,ALB
"Albemarle (ALB) Tops Q2 Earnings Estimates, Raises FY18 View",2018-08-08 00:00:00,ALB
"Albemarle +3% after beating Q2 earnings estimate, raising guidance",2018-08-07 00:00:00,ALB
"Albemarle beats by $0.08, beats on revenue",2018-08-07 00:00:00,ALB
"Dividend Portfolio Review: Busy Earnings Season, Heavy Buying, Growing Dividends",2018-08-07 00:00:00,ALB
Notable earnings after Tuesday's close,2018-08-06 00:00:00,ALB
"Chemical Stock Earnings to Watch on Aug 7: ALB, IFF, VSM",2018-08-06 00:00:00,ALB
FMC: Diversified With A Great Upside That Provides Lithium For A Hungry World,2018-07-30 00:00:00,ALB
Albemarle declares $0.335 dividend,2018-07-26 00:00:00,ALB
Lithium Miners News For The Month Of July 2018,2018-07-25 00:00:00,ALB
"Albemarle names Norris as new lithium chief, replacing Mitchell",2018-07-25 00:00:00,ALB
Piedmont Lithium: On Track To Become The Next U.S. Producer,2018-07-23 00:00:00,ALB
Germans Promise The Earth To Build Lithium And Magnesium Hydroxide Plants And Further Develop The Lithium Downstream In Bolivia,2018-07-22 00:00:00,ALB
"Baillie Gifford & Co Buys Spotify Technology SA, Apache Corp, Jefferies Financial Group ...",2018-07-17 00:00:00,ALB
4 Chemical Stocks Poised to Outshine Q2 Earnings Estimates,2018-07-17 00:00:00,ALB
Tesla's China Factory Resolves Neodymium Risk To Model 3 Production,2018-07-15 00:00:00,ALB
Buy PayPal Up To $98 - Cramer's Lightning Round (7/10/18),2018-07-11 00:00:00,ALB
Dividend Portfolio Review: Top 2 Dividend Income For June,2018-07-10 00:00:00,ALB
Albemarle: Long-Term Lithium And Electric Vehicle Play,2018-07-05 00:00:00,ALB
US Stock Markets High on Tuesday,2018-07-03 00:00:00,ALB
Albemarle +4% as Goldman Sachs calls lithium selloff overdone,2018-07-03 00:00:00,ALB
A Review Of The North American EV Metal Miners,2018-07-03 00:00:00,ALB
Albemarle: Cyclical Value? Or Super-Cyclical Trap?,2018-07-02 00:00:00,ALB
Lithium Miners News For The Month Of June 2018,2018-06-25 00:00:00,ALB
Gilead Sciences Is Too Cheap To Ignore - Cramer's Lightning Round (6/22/18),2018-06-25 00:00:00,ALB
"Albemarle, Sinopec sign Heads of Agreement for catalytic hydrocracking",2018-06-21 00:00:00,ALB
Albemarle: Lithium Cooled But Volume Will Grow,2018-06-20 00:00:00,ALB
Dividend Portfolio Review: New Dividend Record,2018-06-18 00:00:00,ALB
Albemarle: Lithium And Non-Lithium Business Move Together,2018-06-15 00:00:00,ALB
"Detailed Research: Economic Perspectives on Och-Ziff Capital Management Group, Axalta Coating, ...",2018-06-13 00:00:00,ALB
Fed Prepares To Hike Interest Rates (Wall Street Breakfast Podcast),2018-06-13 00:00:00,ALB
Wall Street Breakfast: Fed Day Comes Round Again,2018-06-13 00:00:00,ALB
Lithium revival across the U.S.,2018-06-13 00:00:00,ALB
Piedmont Lithium: Should You Buy This Nasdaq-Listed U.S. Explorer?,2018-06-06 00:00:00,ALB
The ECB Will End Its QE Program; India's Central Bank Raised Rates (Wall Street Breakfast Podcast),2018-06-06 00:00:00,ALB
Wall Street Breakfast: ECB Steps Toward Exiting QE,2018-06-06 00:00:00,ALB
"Honeywell, Dover among companies exiting Iran presence before sanctions",2018-06-05 00:00:00,ALB
Lithium's Chinese Connection,2018-06-04 00:00:00,ALB
Lithium Investing: Production Remains Concentrated Despite Significant Rise In Exploration Activity,2018-05-31 00:00:00,ALB
"Tesla Sees An Undersupply Of Lithium, But Why Don't You?",2018-05-29 00:00:00,ALB
Lithium Investment: Balancing Battery Demand Against Innovative Production And Supply,2018-05-28 00:00:00,ALB
Lithium Miners News For The Month Of May 2018,2018-05-27 00:00:00,ALB
US Stocks Red Thursday,2018-05-24 00:00:00,ALB
Is Albemarle (ALB) Stock a Solid Choice Right Now?,2018-05-24 00:00:00,ALB
Lithium Stocks to be Boosted by Chinese EV Demand Growth,2018-05-23 00:00:00,ALB
Insights From The IMJI Lithium Subsector Index,2018-05-20 00:00:00,ALB
Albemarle (ALB) Presents At Barclays Electronic Chemicals Conference - Slideshow,2018-05-15 00:00:00,ALB
Wall Street Rallies on Thursday,2018-05-10 00:00:00,ALB
Albemarle Corporation 2018 Q1 - Results - Earnings Call Slides,2018-05-10 00:00:00,ALB
Albemarle (ALB) Q1 2018 Results - Earnings Call Transcript,2018-05-10 00:00:00,ALB
Albemarle (ALB) Q1 Earnings Top Estimates on Lithium Strength,2018-05-10 00:00:00,ALB
"Albemarle beats by $0.09, beats on revenue",2018-05-09 00:00:00,ALB
Notable earnings after Wednesday's close,2018-05-08 00:00:00,ALB
Albemarle declares $0.335 dividend,2018-05-08 00:00:00,ALB
Will Lithium Unit Help Albemarle (ALB) Beat Earnings in Q1?,2018-05-07 00:00:00,ALB
"Dividend Asset Capital, Llc Buys Medtronic PLC, International Business Machines Corp, United ...",2018-05-02 00:00:00,ALB
"David Carlson Buys Diamondback Energy, Closes ' Positions",2018-05-02 00:00:00,ALB
Analyst Calling For Tesla Stock Plunging To $84 Reinforces My View On Lithium,2018-05-02 00:00:00,ALB
"Elfun Trusts Buys The Cooper Inc, Applied Materials Inc, Diamondback Energy Inc, Sells Amgen ...",2018-05-01 00:00:00,ALB
Lithium Miners News For The Month Of April 2018,2018-04-27 00:00:00,ALB
Lithium Prices Remain Strong In Q1 2018,2018-04-25 00:00:00,ALB
Backing Blackstone For A Decade - Cramer's Lightning Round (4/23/18),2018-04-24 00:00:00,ALB
Will Chile's Lithium Blockade Send Chinese Buyers to Argentina?,2018-04-20 00:00:00,ALB
Why Albemarle Corporation's Outlook Is Still Strong Despite Recent Slump,2018-04-18 00:00:00,ALB
Lithium miner SQM says industry needs $10B-$12B investment over decade,2018-04-18 00:00:00,ALB
Meet the electric/autonomous vehicle ETF,2018-04-17 00:00:00,ALB
"Plancorp, LLC Buys Vanguard Short-Term Bond, Salesforce. ...",2018-04-16 00:00:00,ALB
Lithium Investing: Capital Continues To Flow Into Lithium Assets As Demand Rises,2018-04-16 00:00:00,ALB
2019 Dividend Aristocrat Newcomers,2018-04-16 00:00:00,ALB
Albemarle +2% as Citigroup upgrades to Buy,2018-04-13 00:00:00,ALB
Oroplata (ORRP): The Unknown Lithium Stock That Could See 400% Gains in 2018,2018-04-12 00:00:00,ALB
Road To Financial Independence: My March 89-Stock Portfolio Review,2018-04-11 00:00:00,ALB
Why Lithium Is About To Replace Oil,2018-04-08 00:00:00,ALB
Albemarle Closes Sale of Part of Performance Catalysts Unit,2018-04-04 00:00:00,ALB
Expect Positive Surprises On President Trump's Trade Policies,2018-04-03 00:00:00,ALB
Lithium Investing: Focus On Advanced Explorers And Early Stage Production Companies,2018-04-03 00:00:00,ALB
Should Value Investors Pick Albemarle (ALB) Stock Now?,2018-04-03 00:00:00,ALB
Dividend Sensei's Portfolio Update 29: Hope For The Best But Plan For The Worst,2018-04-03 00:00:00,ALB
5 S&P 500 Stocks on the Forefront of Q1 Slump,2018-03-29 00:00:00,ALB
Albemarle (ALB) Down 16.3% Since Earnings Report: Can It Rebound?,2018-03-29 00:00:00,ALB
QMC Completes 3D Modeling for The Irgon Lithium Mine,2018-03-28 00:00:00,ALB
QMC Identifies Huge Lithium Anomaly,2018-03-26 00:00:00,ALB
Lithium Miners News For The Month Of March 2018,2018-03-26 00:00:00,ALB
"Bought Albemarle In 2 Stages, Looking At Adding More As Lithium Negativity Continues",2018-03-23 00:00:00,ALB
4 ETFs to Join The Sustainable Investing Trend,2018-03-22 00:00:00,ALB
Toshiba Unveils New Super Fast Charging Lithium Battery Upping the Stakes for Li-on Market,2018-03-22 00:00:00,ALB
"Are Chemical & Mining Co. Of Chile, FMC Corp., And Albemarle Buys Right Now?",2018-03-21 00:00:00,ALB
"Zacks Industry Outlook Highlights: DowDuPont, Albemarle and Monsanto",2018-03-15 00:00:00,ALB
Chemical Industry Looking Up: Stocks Warranting a Look,2018-03-14 00:00:00,ALB
"Albemarle (ALB) Presents At JP Morgan Aviation, Transportation & Industrials Conference - Slideshow",2018-03-14 00:00:00,ALB
Road To Financial Independence: My February 88-Stock Portfolio Review With Big Apple Purchase,2018-03-13 00:00:00,ALB
Chile OKs increase in lithium quota for Albemarle,2018-03-09 00:00:00,ALB
"Upcoming Dividends: 83 Companies, 35 Increases, 17 Double-Digit Increases",2018-03-08 00:00:00,ALB
Time To Buy Some Lithium Miners,2018-03-08 00:00:00,ALB
"Hard Rock Lithium Can Quickly Bridge 50,000-tonne Lithium Supply Gap",2018-03-05 00:00:00,ALB
Quick Note On Recent Lithium Majors' Earnings,2018-03-02 00:00:00,ALB
"33 Dividend Increases: February 19-23, 2018 (Part 2: Consumer Discretionary And Materials Sectors)",2018-03-02 00:00:00,ALB
Buy JPMorgan - Cramer's Lightning Round (3/1/18),2018-03-02 00:00:00,ALB
"SQM, Albemarle continue this week's slide following earnings, supply concerns",2018-03-01 00:00:00,ALB
"At Least 2, Possibly 3 Double-Digit Payout Increases Expected In March",2018-03-01 00:00:00,ALB
Albemarle (ALB) Q4 2017 Results - Earnings Call Transcript,2018-02-28 00:00:00,ALB
Energy/Materials - Top Gainers / Losers as of 2:00 pm (2/28/2018),2018-02-28 00:00:00,ALB
Albemarle Corporation 2017 Q4 - Results - Earnings Call Slides,2018-02-28 00:00:00,ALB
Albemarle's (ALB) Q4 Earnings & Revenues Top Estimates,2018-02-28 00:00:00,ALB
Why Lithium ETF Plunged to Start the Week?,2018-02-27 00:00:00,ALB
"Albemarle +2% after beating on earnings, revenues",2018-02-27 00:00:00,ALB
"Albemarle beats by $0.13, beats on revenue",2018-02-27 00:00:00,ALB
The Rise Of EVs: Capturing Value From The Megatrend,2018-02-27 00:00:00,ALB
Notable earnings after Tuesday's close,2018-02-26 00:00:00,ALB
Energy/Materials - Top Gainers / Losers as of 2:00 pm (2/26/2018),2018-02-26 00:00:00,ALB
Lithium Miners News For The Month Of February 2018,2018-02-26 00:00:00,ALB
"Lithium prices -45% by 2021, Morgan Stanley says in cutting Albemarle, SQM",2018-02-26 00:00:00,ALB
Albemarle a Buy at Argus on strong lithium demand,2018-02-23 00:00:00,ALB
2 Early Lithium Companies With Management To Succeed,2018-02-23 00:00:00,ALB
Albemarle declares $0.335 dividend,2018-02-23 00:00:00,ALB
Tracking Ole Andreas Halvorsen's Viking Global Portfolio - Q4 2017 Update,2018-02-22 00:00:00,ALB
Can Albemarle (ALB) Beat Q4 Earnings on Lithium Strength?,2018-02-22 00:00:00,ALB
Smackdown: How a Rapid Extraction Process is Reinventing the Lithium Industry,2018-02-21 00:00:00,ALB
Multiple Double-Digit Payout Increases In The First 2 Weeks Of February,2018-02-20 00:00:00,ALB
Road To Financial Independence: My January 88-Stock Portfolio Review,2018-02-14 00:00:00,ALB
Lithium Investing: Investors Look To Argentina's Low Cost Brines For High Returns,2018-02-14 00:00:00,ALB
"Global X Management CO LLC Buys Albemarle Corp, NVIDIA Corp, Intuitive Surgical Inc, Sells ...",2018-02-08 00:00:00,ALB
AIS Resources Is Racing Towards Lithium Production In Northern Argentina,2018-02-07 00:00:00,ALB
"Tesla, The New Atacama Debutante",2018-02-06 00:00:00,ALB
Lithium Investing: Asia Makes Bold Investments To Secure Supply,2018-02-05 00:00:00,ALB
"Albemarle upped to Buy at UBS, which sees lithium demand tripling by 2025",2018-01-30 00:00:00,ALB
Trump Leading The Charge To Increase Lithium Supply In The U.S.,2018-01-30 00:00:00,ALB
"Twin Capital Management Inc Buys FMC Corp, Tapestry Inc, Marriott International Inc, Sells ...",2018-01-29 00:00:00,ALB
Lithium Miners News For The Month Of January 2018,2018-01-28 00:00:00,ALB
What To Make Of Albemarle's Selloff? A Buying Opportunity,2018-01-25 00:00:00,ALB
Lithium Investing: SQM And The Changing Supply Landscape,2018-01-22 00:00:00,ALB
Game Plan For The Week - Cramer's Mad Money (1/19/18),2018-01-22 00:00:00,ALB
Lithium producers routed after Chile regulator rules on SQM,2018-01-18 00:00:00,ALB
Energy/Materials - Top Gainers / Losers as of 2:00 pm (1/18/2018),2018-01-18 00:00:00,ALB
Premarket Losers as of 9:05 am (1/18/2018),2018-01-18 00:00:00,ALB
"Chile's Corfo, SQM reach agreement in lithium dispute",2018-01-18 00:00:00,ALB
Lithium Investing: 2018 Key Trends In The Lithium Mining Markets,2018-01-17 00:00:00,ALB
Lithium miners mixed a day after big losses,2018-01-17 00:00:00,ALB
"Lithium stocks slide amid Asian supply, SQM's Corfo talks",2018-01-16 00:00:00,ALB
Dividend Contenders: 47 Increases Expected In The Next 11 Weeks,2018-01-16 00:00:00,ALB
Road To Financial Independence: My December 88-Stock Portfolio Review,2018-01-15 00:00:00,ALB
A Warning Sign Of High Dividend Growth Stocks,2018-01-12 00:00:00,ALB
3 Brine Lithium Developers Picked Following A Relative Value Analysis,2018-01-12 00:00:00,ALB
2018 Stationary Storage Outlook: Home Battery Storage Systems Fully Charged,2018-01-11 00:00:00,ALB
Orocobre Provides Update On Expansion Plans In Argentina And Japan,2018-01-11 00:00:00,ALB
6 Well Valued Lithium Miners To Buy Now,2018-01-10 00:00:00,ALB
Marvell Technology Can Go To $30 - Cramer's Lightning Round (1/9/18),2018-01-10 00:00:00,ALB
Make Your Own High-Risk/High-Reward Lithium ETF,2018-01-09 00:00:00,ALB
Stocks To Watch: Albemarle Sees RS Rating Rise To 82,2018-01-09 00:00:00,ALB
Top 5 Stock Picks To Consider For 2018,2018-01-09 00:00:00,ALB
CES Officially Starts; EV Stock Plays To Watch: Investing Action Plan,2018-01-08 00:00:00,ALB
Lithium Miners News For The Month Of December 2017,2017-12-25 00:00:00,ALB
Albemarle (ALB) Stock Up 25% in 6 Months: Here's Why,2017-12-21 00:00:00,ALB
W.R. Grace (GRA) Updates On Acquisition Of Polyolefin Catalyst - Slideshow,2017-12-15 00:00:00,ALB
"My Journey To Financial Independence: 86-Stock November Portfolio Update - Buying Apple, AbbVie And BMW",2017-12-15 00:00:00,ALB
Albemarle to Sell Portion of Performance Catalysts Unit,2017-12-15 00:00:00,ALB
Grace to buy Albemarle's polyolefin catalysts business,2017-12-15 00:00:00,ALB
U.S. Chemical Industry Set to Ride High: 5 Stocks for 2018,2017-12-13 00:00:00,ALB
Albemarle (ALB) Down 9.6% Since Earnings Report: Can It Rebound?,2017-12-11 00:00:00,ALB
73 Dividend Growth Stocks Going Ex-Dividend Next Week,2017-12-08 00:00:00,ALB
Albemarle (ALB) Shares Up 48% YTD: What's Driving the Stock?,2017-12-07 00:00:00,ALB
"Tesla, lithium stocks lower after Reuters defects report",2017-11-29 00:00:00,ALB
Electric Vehicle Market Powered Up To Accelerate,2017-11-29 00:00:00,ALB
Lithium Miners News For The Month Of November 2017,2017-11-27 00:00:00,ALB
Tracking Stephen Mandel's Lone Pine Capital Portfolio - Q3 2017 Update,2017-11-24 00:00:00,ALB
Lithium: Wrapping Up And Elaborating On My Tweets In The Last 24 Hours,2017-11-24 00:00:00,ALB
Lithium Stock Face Off: Is ALB More Attractive Than FMC?,2017-11-22 00:00:00,ALB
Tracking Ole Andreas Halvorsen's Viking Global Portfolio - Q3 2017 Update,2017-11-21 00:00:00,ALB
"Susquehanna International Group, Llp Buys Apple Inc, Boeing Co, Arista Networks Inc, Sells ...",2017-11-20 00:00:00,ALB
Li-Ion Battery Market Surge Will Put Further Demand on Lithium Suppliers,2017-11-20 00:00:00,ALB
"Aldebaran Financial Inc. Buys Albemarle Corp, Centene Corp, Paragon Commercial Corp, Sells ...",2017-11-17 00:00:00,ALB
Fundamentals Support Strong Lithium Pricing In 2018,2017-11-17 00:00:00,ALB
"Zacks Industry Outlook Highlights: DowDuPont, Albemarle, Monsanto, Westlake Chemical and Kraton",2017-11-10 00:00:00,ALB
