headline,date,stock
Albemarle Corporation to Participate in Deutsche Bank's Virtual ––th Annual Global ...,2020-06-02 00:00:00,ALB
Albemarle Corporation to Participate in Virtual Electric Vehicle Supply Chain Festival from ...,2020-05-21 00:00:00,ALB
"Perseverance Asset Management International Buys Pinduoduo Inc, Weibo Corp, NetEase Inc, Sells ...",2020-05-14 00:00:00,ALB
Dow Jones Falls Over 5…… Points on Wednesday,2020-05-13 00:00:00,ALB
"GHP Investment Advisors, Inc. Buys Miller Industries, Albemarle Corp, SPDR Series Trust ...",2020-05-13 00:00:00,ALB
"Svenska Handelsbanken AB (publ) Buys Abbott Laboratories, Baxter International Inc, Albemarle ...",2020-05-12 00:00:00,ALB
"AGF Investments America Inc. Buys MSCI Inc, Stantec Inc, Ball Corp, Sells Westinghouse Air ...",2020-05-08 00:00:00,ALB
Albemarle Corporation Announces Dividend,2020-05-05 00:00:00,ALB
"Legacy Capital Partners, Inc. Buys Apple Inc, Colgate-Palmolive Co, Albemarle Corp, Sells ...",2020-05-05 00:00:00,ALB
"B & T Capital Management DBA Alpha Capital Managem Buys SPDR S&P 5……, iShares ...",2020-05-05 00:00:00,ALB
"Johnston Asset Management Corp Buys Boston Scientific Corp, Albemarle Corp, Prologis Inc, Sells ...",2020-05-04 00:00:00,ALB
"Kanawha Capital Management Llc Buys Truist Financial Corp, iShares Core S&P Small-Cap, SPDR ...",2020-05-04 00:00:00,ALB
Albemarle (ALB) to Post Q1 Earnings: What's in the Offing?,2020-05-04 00:00:00,ALB
"KAMES CAPITAL plc Buys Haemonetics Corp, Microsoft Corp, Biogen Inc, Sells EOG Resources Inc, ...",2020-04-30 00:00:00,ALB
"Whitener Capital Management, Inc. Buys McDonald's Corp, Rockwell Automation Inc, Intel Corp, ...",2020-04-24 00:00:00,ALB
"Tompkins Financial Corp Buys iShares MSCI USA ESG Select, Adobe Inc, Essential Utilities Inc, ...",2020-04-22 00:00:00,ALB
"Albemarle Announces J. Kent Masters Elected Chairman, President and Chief Executive Officer",2020-04-20 00:00:00,ALB
Albemarle (ALB) Gains on Lithium Expansions Amid Pricing Woes,2020-04-14 00:00:00,ALB
Albemarle Shows Improved Relative Price Performance; Still Shy Of Benchmark,2020-04-13 00:00:00,ALB
"Albemarle Corporation to release first quarter —…—… earnings results on Wednesday, May ...",2020-04-09 00:00:00,ALB
Coronavirus Casts a Pall Over Diversified Chemical Industry,2020-04-09 00:00:00,ALB
"Blackhawk Capital Partners LLC. Buys First Trust Capital Strength ETF, First Trust VL Dividend, ...",2020-04-03 00:00:00,ALB
Albemarle (ALB) Gains But Lags Market: What You Should Know,2020-03-26 00:00:00,ALB
Albemarle Corporation to Participate in Virtual Fireside Chat with David Begleiter at Deutsche Bank,2020-03-23 00:00:00,ALB
Stock Upgrades: Albemarle Shows Rising Relative Strength,2020-03-18 00:00:00,ALB
Why You Should Keep Albemarle (ALB) Stock in Your Portfolio,2020-03-18 00:00:00,ALB
Albemarle Announces New Investor Relations Leadership,2020-03-16 00:00:00,ALB
Albemarle Corporation to Attend Goldman Sachs Chemicals Intensity Days Conference,2020-03-12 00:00:00,ALB
Albemarle Demonstrates Green Building Leadership with LEED Gold Certification,2020-03-12 00:00:00,ALB
"Berman Capital Advisors, LLC Buys Appian Corp, ViacomCBS Inc, iShares Core S&P 5……, ...",2020-03-04 00:00:00,ALB
Albemarle (ALB) Announces Hike of 5% in Quarterly Dividend,2020-03-02 00:00:00,ALB
Albemarle Corporation Announces Dividend,2020-02-28 00:00:00,ALB
Albemarle Corporation to Attend J.P. Morgan Industrials Conference,2020-02-27 00:00:00,ALB
Coronavirus Casts a Pall Over Chemical Industry: Here's How,2020-02-27 00:00:00,ALB
' Fast-Growing CapEx Stocks,2020-02-24 00:00:00,ALB
Ten Plagues,2020-02-23 00:00:00,ALB
Albemarle (ALB) Surges: Stock Moves 5.6% Higher,2020-02-21 00:00:00,ALB
"Albemarle (ALB) Q4 Earnings & Sales Miss, View Disappoints",2020-02-20 00:00:00,ALB
"Shapiro Capital Management Co Inc Buys Albemarle Corp, SPDR S&P 5……, Urban Outfitters ...",2020-02-17 00:00:00,ALB
"Wills Financial Group, Inc. Buys American Campus Communities Inc, Zoetis Inc, The Walt Disney ...",2020-02-17 00:00:00,ALB
Albemarle (ALB) to Report Q4 Earnings: What's in the Cards?,2020-02-14 00:00:00,ALB
"AGF Investments America Inc. Buys Cummins Inc, Ansys Inc, Albemarle Corp, Sells Monolithic ...",2020-02-13 00:00:00,ALB
"Washington Capital Management Inc Buys ViacomCBS Inc, The Kroger Co, Truist Financial Corp, ...",2020-02-07 00:00:00,ALB
"Rock Point Advisors, LLC Buys ViacomCBS Inc, Albemarle Corp, SunPower Corp, Sells PGT ...",2020-02-06 00:00:00,ALB
"Albemarle Chairman and CEO, Luke Kissam, Will Retire for Health Reasons, Effective June —…—…",2020-02-05 00:00:00,ALB
Albemarle Shows Market Leadership With Jump To 90 RS Rating,2020-02-05 00:00:00,ALB
Baird Downgrades Albemarle To Neutral After 24% Year-To-Date Rally,2020-02-05 00:00:00,ALB
"Oil firms up on production cut hopes, Nasdaq at record highs",2020-02-05 00:00:00,ALB
US Stocks Rally on Tuesday,2020-02-04 00:00:00,ALB
"Gs Investments, Inc. Buys McKesson Corp, Henry Schein Inc, iShares MSCI EAFE ETF, Sells Celgene ...",2020-02-04 00:00:00,ALB
HP and Progressive Show Value and Momentum,2020-02-03 00:00:00,ALB
Weighing the Week Ahead: Coronavirus – Cause for Analysis or Paralysis?,2020-02-02 00:00:00,ALB
"Lowe Brockenbrough & Co Inc Buys Truist Financial Corp, Albemarle Corp, Alico Inc, Sells ...",2020-01-31 00:00:00,ALB
"Growth Prospects in the PBN Rods Market —…—…| AXT(US), Stanford Advanced Materials(US), ...",2020-01-31 00:00:00,ALB
Albemarle Corporation Recognized by Wildlife Habitat Council for Environmental Excellence,2020-01-29 00:00:00,ALB
"John G Ullman & Associates Inc Buys Albemarle Corp, Xerox Holdings Corp, International ...",2020-01-29 00:00:00,ALB
Dividend Aristocrats In Focus: Albemarle Corporation,2020-01-29 00:00:00,ALB
Albemarle Corporation Joins S&P 5…… Dividend Aristocrats Index,2020-01-28 00:00:00,ALB
"Goodman Financial CORP Buys II-VI Inc, Albemarle Corp, Host Hotels & Resorts Inc, Sells ...",2020-01-27 00:00:00,ALB
New Dividend Aristocrats For 2020,2020-01-26 00:00:00,ALB
"Albemarle Corporation to release fourth quarter —…–9 earnings results on Wednesday, Feb. ...",2020-01-22 00:00:00,ALB
Stocks With Rising Relative Strength: Albemarle,2020-01-22 00:00:00,ALB
Albemarle Corporation Included in —…—… Bloomberg Gender-Equality Index,2020-01-21 00:00:00,ALB
Albemarle Corp (ALB) EVP & CFO Scott Tozier Sold $–.— million of Shares,2020-01-17 00:00:00,ALB
Albemarle Set to Gain on Lithium Demand Amid Pricing Woes,2020-01-16 00:00:00,ALB
"Deane Retirement Strategies, Inc. Buys Vanguard FTSE Europe ETF, Health Care Select Sector SPDR ...",2020-01-15 00:00:00,ALB
Here's Why You Should Hold Onto Albemarle (ALB) Stock for Now,2020-01-06 00:00:00,ALB
Investing Is Hard Enough: Here Is How to Avoid Making Obvious Mistakes,2019-12-18 00:00:00,ALB
Albemarle Corporation (ALB) Investor Presentation - Slideshow,2019-12-12 00:00:00,ALB
Albemarle CEO sees strong long-term lithium demand,2019-12-12 00:00:00,ALB
Albemarle Hosts Investor Day and Provides Update on Long-term Strategy,2019-12-12 00:00:00,ALB
4 Undervalued Companies To Look At In December,2019-12-10 00:00:00,ALB
November 2019 Dividend Portfolio Update,2019-12-08 00:00:00,ALB
Joe Lowry (Aka 'Mr. Lithium') On The State Of The Lithium Industry,2019-12-08 00:00:00,ALB
"Netflix, Cisco And Chewy On The Marquee (Stocks To Watch Podcast)",2019-12-08 00:00:00,ALB
Dividend Champion And Contender Highlights: Week Of December 8,2019-12-07 00:00:00,ALB
"Stocks To Watch: Netflix, Cisco And Chewy On The Marquee",2019-12-07 00:00:00,ALB
Why Is Albemarle (ALB) Down 10.8% Since Last Earnings Report?,2019-12-06 00:00:00,ALB
Staying Away From Albemarle And Its Weak Dividend Coverage,2019-12-01 00:00:00,ALB
5 Black Friday Dividend Deals You Won't Want To Miss,2019-11-30 00:00:00,ALB
November Portfolio Update - Prefs And Finance,2019-11-29 00:00:00,ALB
Lithium's Comeback Isn't Far: Time To Nibble Into Albemarle,2019-11-27 00:00:00,ALB
Lithium Miners News For The Month Of November 2019,2019-11-26 00:00:00,ALB
Dividend Champions Analysis: Add Lincoln Electric To Your Watch List,2019-11-21 00:00:00,ALB
Albemarle Corporation 2019 Q3 - Results - Earnings Call Presentation,2019-11-14 00:00:00,ALB
"Albemarle cut to Sell at Citi, latest in string of downgrades",2019-11-13 00:00:00,ALB
"United Bank Buys SPDR Barclays –-' Month T-Bill ETF, CyrusOne Inc, Albemarle Corp, Sells ...",2019-11-13 00:00:00,ALB
Albemarle Is Making The Right Moves,2019-11-13 00:00:00,ALB
First big downturn for lithium producers,2019-11-13 00:00:00,ALB
"Escalating protests sink Chilean stocks, currency",2019-11-12 00:00:00,ALB
"FUKOKU MUTUAL LIFE INSURANCE Co Buys Vanguard High Dividend Yield Index Fund, McDonald's Corp, ...",2019-11-12 00:00:00,ALB
New Strong Sell Stocks for November 12th,2019-11-12 00:00:00,ALB
Superior Economic Return Potential Makes Piedmont Lithium A Prime Takeover Candidate,2019-11-11 00:00:00,ALB
"Wafra Investment Advisory Group Inc Buys Mohawk Industries Inc, Ulta Beauty Inc, Digital ...",2019-11-08 00:00:00,ALB
'Overvalued' Albemarle cut to Sell equivalent at J.P. Morgan,2019-11-08 00:00:00,ALB
Albemarle Corporation (ALB) CEO Luke Kissam on Q3 2019 Results - Earnings Call Transcript,2019-11-07 00:00:00,ALB
"Albemarle warns of lithium oversupply, price weakness through next year",2019-11-07 00:00:00,ALB
Monthly Portfolio Update: October 2019,2019-11-07 00:00:00,ALB
"Baillie Gifford & Co Buys Pinduoduo Inc, EOG Resources Inc, Broadridge Financial Solutions ...",2019-11-07 00:00:00,ALB
Abstain From Getting LIT During The Drunken EV Rage,2019-11-07 00:00:00,ALB
Albemarle (ALB) Beats Q3 Earnings Estimates,2019-11-06 00:00:00,ALB
"Albemarle EPS beats by $0.03, misses on revenue",2019-11-06 00:00:00,ALB
"Meridian Management Co Buys iShares Intermediate Government/Credit Bond ETF, iShares 7-–… ...",2019-11-06 00:00:00,ALB
New Strong Sell Stocks for November 6th,2019-11-06 00:00:00,ALB
14 Great High-Yield Stocks For A Rich Retirement,2019-11-06 00:00:00,ALB
The Most Undervalued And Overvalued Dividend Champions - November 2019,2019-11-05 00:00:00,ALB
Swapping Apple For Apple - October Dividend Portfolio Update,2019-11-04 00:00:00,ALB
Albemarle (ALB) to Report Q3 Earnings: What's in the Offing?,2019-11-04 00:00:00,ALB
An Uber Exciting Week (Stocks To Watch Podcast),2019-11-03 00:00:00,ALB
Stocks To Watch: An Uber Exciting Week,2019-11-02 00:00:00,ALB
"Albemarle/Mineral Resources completes Wodgina JV, closes mine",2019-11-01 00:00:00,ALB
4 Stocks in Focus on Electric Vehicle Revolution,2019-10-31 00:00:00,ALB
Albemarle declares $0.3675 dividend,2019-10-29 00:00:00,ALB
Albemarle double downgraded to Underperform from Buy at BofA Merrill,2019-10-28 00:00:00,ALB
Gibraltar Industries and FTS International among Energy/Materials gainers; Dril-Quip and Valaris among losers,2019-10-25 00:00:00,ALB
Lithium Miners News For The Month Of October 2019,2019-10-25 00:00:00,ALB
Wall Street Breakfast: China Seeks Removal Of U.S. Tariffs In Return For Ag Buys,2019-10-25 00:00:00,ALB
Albemarle Corporation Announces Preliminary Third Quarter —…–9 Financial Results and ...,2019-10-24 00:00:00,ALB
Albemarle cuts 2019 guidance on lithium price weakness,2019-10-24 00:00:00,ALB
Albemarle's Lithium Business To Benefit From Consumer Expectations For Longer EV Range,2019-10-24 00:00:00,ALB
"Goldman analyst sees 'compelling value' in Buy-rated Albemarle, Livent",2019-10-23 00:00:00,ALB
Rio Tinto to produce lithium from waste rock in California,2019-10-22 00:00:00,ALB
Tianqi Lithium's Q3 loss spooks publicly traded rivals,2019-10-22 00:00:00,ALB
Are You Looking for a High-Growth Dividend Stock? Albemarle (ALB) Could Be a Great Choice,2019-10-21 00:00:00,ALB
Dividend Champions Analysis: A Lot Of Banks With Over 3% Yields,2019-10-16 00:00:00,ALB
Forecasting Future Results Is The Key To Successful Stock Investing: Part 2,2019-10-16 00:00:00,ALB
Forecasting The Future,2019-10-15 00:00:00,ALB
The EV Metal Miners' Downturn Looks To Have Bottomed Or Will Likely Bottom In 2019 Or Early 2020,2019-10-13 00:00:00,ALB
"Albemarle Corporation to release third quarter —…–9 earnings results on Wednesday, Nov. ...",2019-10-10 00:00:00,ALB
The Most Undervalued And Overvalued Dividend Champions - October 2019,2019-10-06 00:00:00,ALB
Monthly Portfolio Update: September 2019,2019-10-06 00:00:00,ALB
"Kempner Capital Management Inc. Buys DuPont de Nemours Inc, Albemarle Corp, Service Properties ...",2019-10-04 00:00:00,ALB
Q3 2019 Dividend Portfolio Update: New September Dividend Record,2019-10-04 00:00:00,ALB
Dividend Champion And Contender Highlights: Week Of September 29,2019-09-28 00:00:00,ALB
Lithium Miners News For The Month Of September 2019,2019-09-22 00:00:00,ALB
The Software Sell-Off,2019-09-16 00:00:00,ALB
Why You Should Keep Albemarle (ALB) Stock in Your Portfolio,2019-09-16 00:00:00,ALB
A Dividend Growth Analysis Of The Dividend Champions,2019-09-15 00:00:00,ALB
Albemarle Corporation (ALB) Presents At Credit Suisse 32nd Annual Basic Materials Conference - Slideshow,2019-09-12 00:00:00,ALB
"Expansion halted at Tianqi's Australia lithium plant; Albemarle, SQM rise",2019-09-10 00:00:00,ALB
Materials Sector (XLB) – Earnings Estimates - Revisions,2019-09-10 00:00:00,ALB
Albemarle's Dividend Growth Is Fueled By Its Lithium Expansion Plans,2019-09-10 00:00:00,ALB
100-Stock Dividend Portfolio Update For August 2019,2019-09-09 00:00:00,ALB
Dividend Champion And Contender Highlights: Week Of September 8,2019-09-07 00:00:00,ALB
Albemarle (ALB) Down 14.3% Since Last Earnings Report: Can It Rebound?,2019-09-06 00:00:00,ALB
The Most Undervalued And Overvalued Dividend Champions - September 2019,2019-09-03 00:00:00,ALB
"The Lithium Market Is Challenging, But Albemarle Is A Buy",2019-09-03 00:00:00,ALB
Is Albemarle (ALB) a Suitable Stock for Value Investors?,2019-09-02 00:00:00,ALB
Why Albemarle (ALB) is a Top Dividend Stock for Your Portfolio,2019-09-02 00:00:00,ALB
Here's Why You Should Hold Onto Albemarle (ALB) Stock Now,2019-08-28 00:00:00,ALB
Lithium Miners News For The Month Of August 2019,2019-08-26 00:00:00,ALB
"How To Be A Great Investor, Part 3: Properly Assess Strategy",2019-08-26 00:00:00,ALB
"SQM forecasts continued lithium oversupply, sending tickers sharply lower",2019-08-22 00:00:00,ALB
"Wills Financial Group, Inc. Buys Cisco Systems Inc, Palo Alto Networks Inc, Consolidated Edison ...",2019-08-20 00:00:00,ALB
Why Albemarle (ALB) is a Great Dividend Stock Right Now,2019-08-16 00:00:00,ALB
Albemarle: Delayed Expansion Won't Be Enough To Put An End To The Lithium Bear Market,2019-08-15 00:00:00,ALB
Road To Financial Independence: Highlights Of July 2019,2019-08-14 00:00:00,ALB
Livent Is Susceptible To More Downside,2019-08-14 00:00:00,ALB
Albemarle: The Key Risk,2019-08-13 00:00:00,ALB
"Nicholas Co Inc Buys Coca-Cola Co, Alcon Inc, Fastenal Co, Sells East West Bancorp Inc, ...",2019-08-13 00:00:00,ALB
Livent Corporation: An Excellent Vehicle To Participate In Tomorrow's World,2019-08-12 00:00:00,ALB
Albemarle Corporation (ALB) CEO Luke Kissam on Q2 2019 Results - Earnings Call Transcript,2019-08-08 00:00:00,ALB
Albemarle Corporation 2019 Q2 - Results - Earnings Call Slides,2019-08-08 00:00:00,ALB
Albemarle Corporation 2019 Q2 - Results - Earnings Call Slides,2019-08-08 00:00:00,ALB
"Albemarle (ALB) Tops Q2 Earnings Estimates, Ups FY19 EPS View",2019-08-08 00:00:00,ALB
"Gratus Capital LLC Buys Alphabet Inc, Royal Dutch Shell PLC, Albemarle Corp, Sells 'M Co, ...",2019-08-07 00:00:00,ALB
Albemarle (ALB) Q2 Earnings and Revenues Top Estimates,2019-08-07 00:00:00,ALB
"Albemarle EPS beats by $0.12, misses on revenue",2019-08-07 00:00:00,ALB
"Spf Beheer Bv Buys Booking Holdings Inc, Dollar General Corp, Albemarle Corp, Sells ...",2019-08-07 00:00:00,ALB
Albemarle (ALB) to Report Q2 Earnings: What's in the Cards?,2019-08-05 00:00:00,ALB
The Most Undervalued And Overvalued Dividend Champions - August 2019,2019-08-04 00:00:00,ALB
"Fast Growing, Silver Telluride Market Know about the Prominent Trends and Opportunities ...",2019-08-04 00:00:00,ALB
ClearBridge Global Growth Strategy Portfolio Manager Commentary Q2 2019,2019-08-02 00:00:00,ALB
Albemarle to get 60% stake in MinRes's Wodgina mine in deal revision,2019-08-01 00:00:00,ALB
"Capital Management Corp Buys Tessco Technologies Inc, Mobile Mini Inc, Schlumberger, Sells ...",2019-07-31 00:00:00,ALB
Are You Looking for a High-Growth Dividend Stock? Albemarle (ALB) Could Be a Great Choice,2019-07-31 00:00:00,ALB
"Svenska Handelsbanken AB (publ) Buys Welbilt Inc, Eli Lilly and Co, Service Corp International, ...",2019-07-30 00:00:00,ALB
Lithium Miners News For The Month Of July 2019,2019-07-26 00:00:00,ALB
Lithium Stocks When The Sentiment Is Negative - Albemarle,2019-07-25 00:00:00,ALB
Albemarle declares $0.3675 dividend,2019-07-24 00:00:00,ALB
"Old National Bancorp Buys Vanguard Mega Cap Value, SPDR Select Sector Fund - Energy Select ...",2019-07-15 00:00:00,ALB
This is Why Albemarle (ALB) is a Great Dividend Stock,2019-07-15 00:00:00,ALB
The Little Portfolio That Beats The Market - Update,2019-07-10 00:00:00,ALB
LIT: Oversupply Concerns Continue To Weigh On Lithium Market Sentiment,2019-07-10 00:00:00,ALB
My Road To Financial Independence: 103-Stocks Portfolio June Review,2019-07-09 00:00:00,ALB
The Best Dividend Stocks To Buy During The Rate Cut Rally,2019-07-08 00:00:00,ALB
Can Albemarle (ALB) Keep the Earnings Surprise Streak Alive?,2019-07-08 00:00:00,ALB
Piedmont Lithium Making Progress In Albemarle's And Livent's Backyard,2019-07-05 00:00:00,ALB
The Best Dividend Stocks To Buy In A Potentially Volatile July,2019-07-01 00:00:00,ALB
The Most Undervalued And Overvalued Dividend Champions - July 2019,2019-07-01 00:00:00,ALB
The Best Dividend Stocks To Buy When The Market Is At An All-Time High,2019-06-26 00:00:00,ALB
Lithium Miners News For The Month Of June 2019,2019-06-25 00:00:00,ALB
1 Of These 4 Stocks Is My Next Retirement Portfolio Buy,2019-06-24 00:00:00,ALB
Dividend Champion And Contender Highlights: Week Of June 23,2019-06-22 00:00:00,ALB
POSCO pulls out of proposed Chilean battery material plant,2019-06-21 00:00:00,ALB
Albemarle - More Than Just Lithium,2019-06-20 00:00:00,ALB
Wall Street Green on Wednesday,2019-06-19 00:00:00,ALB
5 Future Dividend Aristocrats To Buy Today,2019-06-19 00:00:00,ALB
"One EV Revolution, 4 Likely Victors",2019-06-18 00:00:00,ALB
2 New Companies I Just Bought For My Retirement Portfolio,2019-06-17 00:00:00,ALB
Albemarle outlines plan to lift Chilean lithium output by 30%,2019-06-12 00:00:00,ALB
Albemarle: Unique Total Return Opportunity For The Patient Investor,2019-06-12 00:00:00,ALB
Albemarle says will not participate in LME lithium contract,2019-06-11 00:00:00,ALB
Dividend Champion And Contender Highlights: Week Of June 9,2019-06-10 00:00:00,ALB
Primecap Management Buys More Albemarle Corp,2019-06-07 00:00:00,ALB
Tracking Larry Robbins' Glenview Capital Management Portfolio - Q1 2019 Update,2019-06-06 00:00:00,ALB
Will Market Drop Extend To June? (Wall Street Breakfast Podcast),2019-06-03 00:00:00,ALB
Wall Street Breakfast: Will Market Drop Extend To June?,2019-06-03 00:00:00,ALB
Albemarle: Strong Lithium Growth Potential Lies Ahead,2019-06-03 00:00:00,ALB
Introducing The Dividend 30,2019-05-29 00:00:00,ALB
The Best Dividend Stocks To Buy In This Volatile Market,2019-05-28 00:00:00,ALB
Why Albemarle (ALB) is a Top Dividend Stock for Your Portfolio,2019-05-27 00:00:00,ALB
Electric Vehicles: The Driver Behind The Amplify Advanced Battery Metals And Materials ETF,2019-05-26 00:00:00,ALB
Lithium Miners News For The Month Of May 2019,2019-05-26 00:00:00,ALB
"Walmart's 5260, Computex And Healthcare Headwinds (Stocks To Watch Podcast)",2019-05-26 00:00:00,ALB
"Stocks To Watch: Walmart's 5260, Computex And Healthcare Headwinds",2019-05-25 00:00:00,ALB
"SQM downgraded at BMO on lithium rebound concerns, earnings trajectory",2019-05-24 00:00:00,ALB
Lithium Industry M&A Update,2019-05-22 00:00:00,ALB
Why I Invested 10% Of My Retirement Portfolio Into 7 Dividend Blue Chips,2019-05-21 00:00:00,ALB
Key Takeaways From Livent's Q1 2019 Earnings Release,2019-05-21 00:00:00,ALB
New Sources of Lithium Needed Outside of Chile to Meet Rising Demand,2019-05-21 00:00:00,ALB
The Best Dividend Stocks To Buy In Today's Economy,2019-05-21 00:00:00,ALB
"Ashburton (Jersey) Ltd Buys AT&T Inc, Allergan PLC, Vanguard S&P 5……, Sells HDFC ...",2019-05-20 00:00:00,ALB
Lithium Segment Review For Albemarle Q1 2019,2019-05-17 00:00:00,ALB
The People's Republic Of China Is Destined To Decline,2019-05-15 00:00:00,ALB
"Cheap EVs On The Way In Europe, While Luxury Brands Start Taking EV Market Seriously",2019-05-14 00:00:00,ALB
"The Benefits Of Tactical Asset Allocation, With Lawrence Fuller (Podcast)",2019-05-14 00:00:00,ALB
The Best Dividend Stocks To Buy In This Risky Market,2019-05-13 00:00:00,ALB
How My Retirement Portfolio Will Profit From The Trade War,2019-05-13 00:00:00,ALB
Is This High-Yield Lithium Stock a Buy?,2019-05-10 00:00:00,ALB
Greenbushes lithium mine receives expansion approval,2019-05-10 00:00:00,ALB
Albemarle Corporation (ALB) CEO Luke Kissam on Q1 2019 Results - Earnings Call Transcript,2019-05-09 00:00:00,ALB
Albemarle says new project to boost its Chilean lithium output by 30%,2019-05-09 00:00:00,ALB
Albemarle Corporation 2019 Q1 - Results - Earnings Call Slides,2019-05-09 00:00:00,ALB
Global Markets Suffer As U.S.-China Dispute Intensifies (Wall Street Breakfast Podcast),2019-05-09 00:00:00,ALB
Global Markets Suffer As U.S.-China Dispute Intensifies (Wall Street Breakfast Podcast),2019-05-09 00:00:00,ALB
Albemarle's (ALB) Earnings & Revenues Top Estimates in Q1,2019-05-09 00:00:00,ALB
Wall Street Breakfast: Global Markets Suffer As U.S.-China Dispute Intensifies,2019-05-09 00:00:00,ALB
Albemarle (ALB) Surpasses Q1 Earnings and Revenue Estimates,2019-05-08 00:00:00,ALB
Albemarle forecasts 8%-14% full-year revenue rise,2019-05-08 00:00:00,ALB
Albemarle declares $0.3675 dividend,2019-05-08 00:00:00,ALB
Notable earnings after Wednesday's close,2019-05-07 00:00:00,ALB
Albemarle Q1 2019 Earnings Preview,2019-05-07 00:00:00,ALB
Should You Buy Albemarle (ALB) Ahead of Earnings?,2019-05-07 00:00:00,ALB
Dividend Champion Spotlight: Albemarle Corporation,2019-05-06 00:00:00,ALB
Albemarle Corporation: A Deeply Undervalued Dividend Aristocrat,2019-05-06 00:00:00,ALB
The Most Undervalued And Overvalued Dividend Champions - May 2019,2019-05-06 00:00:00,ALB
Albemarle (ALB) to Report Q1 Earnings: What's in the Offing?,2019-05-06 00:00:00,ALB
Energy Metals Expert Chris Berry Gives An Update,2019-05-02 00:00:00,ALB
5 Mega Investment Trends To 2025 And The Main Players,2019-05-02 00:00:00,ALB
Lithium Supply/Demand Forecasts. Why Are The Analysts Ignoring The Facts?,2019-05-02 00:00:00,ALB
What's in Store for International Flavors' (IFF) Q1 Earnings?,2019-05-02 00:00:00,ALB
3 Undervalued Dividend Aristocrats I Just Added To My Retirement Portfolio,2019-05-01 00:00:00,ALB
Dividend Champions For May 2019,2019-05-01 00:00:00,ALB
"Additional Lithium Mines Still Needed to Satisfy Rising Battery Storage, EV Demand",2019-04-30 00:00:00,ALB
10 Dividend Blue Chips I'm Looking To Add To My Retirement Portfolio,2019-04-29 00:00:00,ALB
"Professional Advisory Services Inc Buys S&P Global Inc, ResMed Inc, Capital One Financial ...",2019-04-29 00:00:00,ALB
The Best Dividend Stocks To Buy In May,2019-04-29 00:00:00,ALB
"Gs Investments, Inc. Buys Constellation Brands Inc, CVS Health Corp, Albemarle Corp, Sells ...",2019-04-26 00:00:00,ALB
"Atlanta Capital Group Buys Charles Schwab Corp, Arista Networks Inc, Vanguard High Dividend ...",2019-04-26 00:00:00,ALB
Hard-Rock Mining: A Game Changer In The Lithium Sector,2019-04-25 00:00:00,ALB
Lithium Miners News For The Month Of April 2019,2019-04-25 00:00:00,ALB
Is This A Gamechanger For The Lithium Industry?,2019-04-25 00:00:00,ALB
US Stocks Advance Tuesday,2019-04-23 00:00:00,ALB
"Aldebaran Financial Inc. Buys SPDR Portfolio Total Stock Market, Vanguard Real Estate, Invesco ...",2019-04-23 00:00:00,ALB
"SQM sees lithium demand rising this year, prices falling",2019-04-23 00:00:00,ALB
Albemarle: A Safer Alternative To Invest Into The Lithium Trend,2019-04-22 00:00:00,ALB
Piedmont Lithium Limited: Targeting A Vertically Integrated Lithium Project In The World's 2nd Largest Auto Market,2019-04-18 00:00:00,ALB
Will Albemarle (ALB) Beat Estimates Again in Its Next Earnings Report?,2019-04-18 00:00:00,ALB
The Outlook For Albemarle Calls For Investor Patience,2019-04-16 00:00:00,ALB
ChartMasterPro: Q1 2019 Trade Review,2019-04-14 00:00:00,ALB
Here's Why You Should Hold Onto Albemarle (ALB) Stock for Now,2019-04-12 00:00:00,ALB
12 Exceptional Investments in the Process Industries Sector,2019-04-10 00:00:00,ALB
"Report: Developing Opportunities within Albemarle, Stratasys, Pure Storage, Tenaris S. ...",2019-04-10 00:00:00,ALB
The Most Undervalued And Overvalued Dividend Champions - April 2019,2019-04-08 00:00:00,ALB
Global X Lithium & Battery Tech ETF: Why This ETF Is A Buy-And-Hold,2019-04-07 00:00:00,ALB
U.S. to push for EV supply chain strategy,2019-04-05 00:00:00,ALB
Albemarle Expects Lithium Volume Shift to Hurt Q1 Results,2019-04-02 00:00:00,ALB
Dividend Champions For April 2019,2019-03-31 00:00:00,ALB
Albemarle sees below consensus Q1 earnings due to lithium volume shift,2019-03-28 00:00:00,ALB
Lithium Miners News For The Month Of March 2019,2019-03-27 00:00:00,ALB
Why Is Albemarle (ALB) Down 4.2% Since Last Earnings Report?,2019-03-22 00:00:00,ALB
Chemical Diversified Stock Outlook: Near-Term Prospects Dim,2019-03-20 00:00:00,ALB
Albemarle (ALB) Shares Up 12% YTD: What's Driving the Stock?,2019-03-19 00:00:00,ALB
Albemarle: New Dividend Aristocrat With ~20% Upside And Attractive Long-Term Growth Story,2019-03-18 00:00:00,ALB
2019 Lithium Themes To Watch Out For,2019-03-08 00:00:00,ALB
43 Upcoming Dividend Increases - Are You Kidding Me?,2019-03-08 00:00:00,ALB
