,guid,stock,title,summary,published,p_date,sentiment_summary,sentiment_title
68,0013818f-eade-3680-8849-68b90c462ce8,LAC,3 Battery Stocks to Buy Before They Boom,"Although electric vehicles have garnered intense interest lately, investors may be better served focusing on infrastructure-related battery stocks to buy rather than individual EV players. With so many new upstarts in the electrification of transportation, it defies probabilities that all of them will enjoy significant upside success. However, every one of these companies needs lithium-ion-based powerpacks. Further, the sharp losses among several EV manufacturers help drive the case for battery","Mon, 20 Jun 2022 10:31:26 +0000",LAC_2022-06-20,0.9313,0.0
69,751f8a7f-3223-39c1-a2af-ba5474e2b2bf,LAC,3 Renewable Energy Stocks to Buy for the Long Haul,"Many renewable energy stocks are going to take a long time to develop into serious growth plays. With the market as bad as it is, it’s unlikely to find short-duration plays to invest in. In fact, I’d avoid them at all costs and opt to invest in longer-term plays. By investing in renewable energy stocks, you’re essentially allocating capital in the hope of securing a big payday ten to twelve years from today. Also, by implementing this strategy, we’re essentially conceding that we don’t know what","Fri, 17 Jun 2022 11:30:20 +0000",LAC_2022-06-17,0.8402,0.2732
70,6ab75584-08a3-34f2-82f9-60ecc65cb324,LAC,Will Warren Buffett Beat Elon Musk in Developing a Novel Lithium Mining Technique?,"Tesla's Musk seems to be MIA in the U.S. lithium rush, while fellow billionaire Warren Buffett's Berkshire Hathaway Energy is a ""prospector"" in California.","Wed, 15 Jun 2022 11:00:00 +0000",LAC_2022-06-15,-0.2103,0.3182
71,9018955b-08b6-3c72-83f2-e8083cabf1c1,LAC,7 Growth Stocks With Multibagger Potential by 2025,"As a long-term investor, the current year might be among the best times to buy growth stocks. Sentiment has been pessimistic considering macro-economic and geo-political factors. As a result, some high-quality growth stocks have fallen into a deep correction. A simple investing rule is to buy when fear is the dominant sentiment. Of course, I would go slow and hold a balance of growth and large-cap stocks in the portfolio. However, there is no reason to press the panic button. Even if there is a","Tue, 14 Jun 2022 10:02:25 +0000",LAC_2022-06-14,-0.1779,0.3818
72,9230c3de-f097-31ca-a1fd-0b5af9b9bdd7,LAC,Proceed With Caution When Considering These 5 Ultra-Popular Stocks,"Investors  may want to think twice before adding these names to their portfolios: Lithium Americas (NYSE: LAC), Mullen Automotive (NASDAQ: MULN), NXP Semiconductors (NASDAQ: NXPI), Rivian (NASDAQ: RIVN), and Sunrun (NASDAQ: RUN).  It's unsurprising, therefore, that Lithium Americas is gaining popularity right now.  In the pre-revenue phase of its development, Lithium Americas is garnering attention from growth investors, who foresee returns when the company commences operations at its two projects.","Sun, 12 Jun 2022 12:47:00 +0000",LAC_2022-06-12,0.8316,0.0
73,94974ad3-d705-3bd9-a779-790142b5388f,LAC,Lithium Americas Corp. (LAC) Stock Moves -1.09%: What You Should Know,"Lithium Americas Corp. (LAC) closed at $22.66 in the latest trading session, marking a -1.09% move from the prior day.","Fri, 10 Jun 2022 21:45:09 +0000",LAC_2022-06-10,0.0,0.0
74,7250619c-ee40-36d4-978c-c2203bf4802d,LAC,4 Stocks to Buy That Could Make You a Millionaire,"Becoming a millionaire investor is not an easy feat and it’s a possibility rather than a probability. Nevertheless, with solid research and knowledge of overlooked assets, it can be done. I often screen for “under the radar” stocks. You see, the big guys on Wall Street require a stock to hold low-risk properties to be considered a credible investment prospect. That’s great news for us retail investors as it allows us to make “smart money stage” moves. The stocks selected in this article could ad","Wed, 08 Jun 2022 14:41:58 +0000",LAC_2022-06-08,0.7264,0.0
75,811bf045-70f1-33fa-ae9e-72c6cddd549d,LAC,Why Lithium Americas Stock Crashed Today,"Despite being not yet operational, and having no revenue to its name (much less profits), Lithium Americas stock has had a terrific run as investors bid up lithium assets in anticipation of booming demand for the metal, which is used to make the batteries that power electric vehicles.  With lithium currently priced at $60,000 a ton, Goldman sees that slipping 10% to $54,000 later this year -- a pothole that precedes a bigger fall off a cliff.  By next year, the banker believes, lithium prices will average just $16,000, a staggering 73% decline from present-day prices.","Tue, 31 May 2022 20:08:58 +0000",LAC_2022-05-31,0.3612,0.0
76,a3fe0a0a-b59d-38a9-957b-1ce64792b3fc,LAC,Arena Minerals Enters Collaboration Agreement With Lithium Americas,"TORONTO, May 24, 2022 (GLOBE NEWSWIRE) -- Arena Minerals Inc. (""Arena"" or the ""Company"") (TSX-V: AN | OTCQX: AMRZF) is pleased to announce it has entered into a Pastos Grandes Technical Collaboration Agreement (the “Collaboration Agreement”) with Lithium Americas Corp (TSX: LAC; NYSE: LAC) (“Lithium Americas”). The intention of the Collaboration Agreement is to share technical information and explore opportunities for collaborating on potential development alternatives with the overall objective","Tue, 24 May 2022 11:00:00 +0000",LAC_2022-05-24,0.9201,0.4939
77,f3af7200-3eb4-3d3f-a153-6d05140e78a8,LAC,Lithium Americas Enters Collaboration Agreement with Arena Minerals,"VANCOUVER, British Columbia, May 24, 2022 (GLOBE NEWSWIRE) -- Lithium Americas Corp. (TSX: LAC) (NYSE: LAC) (""Lithium Americas"" or the ""Company"") has entered a Pastos Grandes Technical Collaboration Agreement (“Collaboration Agreement”) with Arena Minerals Inc. (TSX-V: AN) (""Arena""). The intention of the Collaboration Agreement is to share technical information and explore opportunities for collaborating on potential development alternatives with the overall objective of optimizing the productio","Tue, 24 May 2022 11:00:00 +0000",LAC_2022-05-24,0.9217,0.4939
78,5e0dec1c-f292-3bbd-bb52-394eb89485ad,LAC,7 of the Biggest Bargain Stocks to Buy Right Now,"These beaten-down bargain stocks have strong catalysts moving forward and are worth a look. Advanced Micro Devices (AMD): There’s plenty of upside momentum ahead for this severely undervalued tech stock. Marathon Digital Holdings (MARA): This undervalued Bitcoin mining is technically oversold, and ready to bounce with Bitcoin (BTC-USD). Lithium Americas (LAC): Oversold lithium miner could pop with demand still outweighing supply. Roblox Corp. (RBLX): Gaming stock showing signs of life again than","Thu, 19 May 2022 16:01:01 +0000",LAC_2022-05-19,0.6705,0.2023
